PrivateKey,Address,Mnemonic
0x32a4b341e9e5db066994009533b835d4eb5532b528a7419e976f6765fe39796c,0x6ab1c02aE58b71a27aAB0c0B2f9DB7c0FeCBfdA6,brisk squirrel prefer foam glass hard side lizard hire divorce invest toward
0x409bc72b2e92e952f8ca3ccd7be97f5f4cb562b05ccaa28df51a314d509a7c98,0xd952D7DE951fD47BF9F60ad48cB686f213743849,coil seminar enrich daughter bicycle trade return jealous raccoon boss behind merge
0xd73f4d1c6d9f446cc10f2f47540dd00ac8d9a5beefb98d0a4e009f8f9cbc6ba5,0xa0C220A97F67ad854ff740DCc732821348306837,bar vibrant zone box banana castle creek release notice drift never salute
0xdd0f9038a64bbb2d9577449182519299e84a7aec503348c6fe784fcb5cd95da3,0xb74780D8f8095a0d7Be258617Ca4Fde6c065D6aa,sibling promote short apple kite market table near credit hungry cancel focus
0xb41b44296d513681a5cf9d3cd5f0adcfd9a12387d6db6d860a1c043a8ada3a65,0x24BDEcc23878Ae57565F6D53EED08a87C7634B4D,host hub witness vicious chest barely frost piece control feature youth genius
0xbc5bf9c7e0f511c316d476acc99f4140b0d8fea3815a623b6efe95490a306d43,0xF48B74d7cceE3A80c0C9F793a289cf6a25DE55BA,topple talk elegant library sorry miracle employ render spawn abandon spider then
0xff26dbfe61d3c460551b935ce6e8bb6c2af489fa49f2be65516b05d5c6ab8afa,0xCA1468D2FC16245cDD8ae898088b6540BF039cf1,token fit teach strong pipe blouse cake call slam humor snake car
0x338c200fecea9e5eb9459982d88161584221581ad0258d98c60a90fe39eb1fed,0x31f66bE4c8417120ff90cBEC2a4bE65a3A39668e,silly outdoor front kiss just label unveil abandon garden flag duty upset
0x812496f4d6768144ad0292e33db9b8f42ca7fc96245ad86caa8b8f6af2e581bb,0xC0e35Facae182fbC610121128f0399B295e4b56C,attract example position valley allow faith rent arm assault mobile category fury
0x8a75e1c036934cec6ffe852ef5b35b8ef143d3b78d9c0b66a528763c92e69f4d,0x45dC43Fa1ff0A6B6802435f98a9959701882f3AA,rack this mirror artwork canal glad put click goose crop know goat
0x5fae30c24084032dfc3df6baae16a1a26e48d359ccac591a249c2df299d689ed,0xA61171a65f6E8d59F0d29afdE7B8D37D70a9F26A,skin case similar orbit nephew disagree kiss profit promote scene hurry roast
0xb72911d51cf736897d58923e8f60eecad8a10613edb3b2fe3746e55a049f6ecb,0x0aA866856E53BDA26858096999720EaD759c2E25,primary thrive cool screen notable battle asset glove artist wise raven camp
0x5fa4398ca3d66fdfe32c01fbc886fc8003612d6e8f105fa1a17c8d1d3d37634d,0x3744038dA0d1C64B1a9b137B7888b6168382a642,mechanic wonder merry borrow tower fringe column need ridge defy omit raise
0xa5cde3ee7f01d4fad941f6494ac8236b79ba2623181f6495964605d28733b096,0xCfd70d9db3406e648Ac6F825030Da2ACf9c2B6b4,game essay cargo social thunder whip supply shift ivory retreat fold tuna
0x29efed2b397b8241e95b69d614b99727e49476677a3532a9d487e484828565e9,0x619312B28bB84Dd6c0AFF06389c017e3A82Cd594,arrive elder kick quiz cargo snap dress expand year rival barely refuse
0xd53322ff5bd54cc6b7c097d9ff1527f9b9471066a53e1d82fc44bb88870d1f24,0x2aBBF3496b6E17b932b972b5cD2757008a01C1CB,west piece below season appear angle obey walnut differ grace decrease cute
0xd194c30097bb8cec8a63203e13a08b98a795b3df74e09541b8d69d00ca2d3633,0x56328fdEB525FBEe5c7717b4dFce5b4A635122C8,forget aim vendor aisle height predict foot beach write minimum high economy
0x275062724d781227ae693be99d9c1686256e4bb552cab6fac18cc4d12bd13804,0xDcE1d0Dd344d1815f57d64384d11cabA6DdF2D17,magic believe wire legal merit arrest derive guilt vote human good merge
0x8375a73f89171bccd98af2d27bfe76d836fc98ae06d3fa8f8bf4959eadaf824d,0x1907Dd4D36eB839BeeDdb8F216b712bbC55fC647,ribbon fit leg assist phone recipe flower exit choice control sample swap
0x5bb27eb855f91e475076c656e7d2ac54a92a2f4b245a384e5eb00c2d5704b7d5,0x6E3E4492f7931Aaa72Aadc3b3798833a4bC4EC56,fox family wait zoo guilt online cheese dance solar sausage cargo use
0x70b02c195d6d794cec44bae53c57c20d22a72cbb4a32d88e597225cc8deccbd7,0xa5F46021122Ca307f6C44EED75ab54D9b54fAa0b,music true tiger reward ritual banana joy until rely nest high salad
0x204caf03945c9c51acc2de56838c7d13ccbbfc5fb4530d3335efd865d32aec9b,0x6c72E5cB4955Bd2f7b49DFd44fF2Df0dCD27Dd6F,warfare sketch eye crop boil globe approve joy maze orchard middle squirrel
0xd6485f1d4fc670d0a113ec694e1026966c5c6b83a599878b0917dafa13e1287e,0xF318761AbB6D55B996aa004f65E0A0Fe848E776d,cradle soda margin kit common bone flee select blame what ritual stadium
0xfdb4227de0e551edfb78ad08cc409a98c3df9a56fd6d3d1a7ebca1271bb99439,0x516A159743aD23b8e3ea44c798F735690304c6dC,female tube congress emerge nature sure pulp diesel error search shallow swim
0x2c2c7b4d5f4c78aa138940058ec36d39b8dec7913c1a838db1ad4a9e257ff00f,0x65d848b461B2D3BC722F7bd4dde1843e8C2e6dEf,goose bone involve tackle size extend dove result tree void destroy clay
0x0d84bcc77d7b6610d7d4e875285345283d1c2532c55637639207ed20f48ce585,0xe7A5839E97fc5A899d45A6aEe824078F729Dc478,company taxi salon adapt shiver blouse hole sample camera undo suffer word
0x448ef4fd53d099bee003475383196b330385a6eb5421d89512c5b62395fcc355,0x8A49804D04D8fcAaAa0E97a26A7b9f34eB3b2A35,spin canal cat junior intact dad rookie hen sweet raw spirit dutch
0xb27ea9b6505c1fdaff021ee065c74d4284868fb63f7f85381682d6045fac3c64,0x07ADaF642B24f10f18c46E690554113a2bAa3DC2,trash ripple soldier strong soup face fork menu taste reduce news silk
0x2fccd83201138dbcbe0a37b037e1400436eae3b14ea406de64499842d2b4c6be,0xc1A84e363F52809C5950F6EBBf23706Ea7582EAa,play chaos globe brick crisp seed source memory modify orient demise pumpkin
0xe17bee73fba52297ccc407e8175d3a08ae1518ddeb32d150ffa12232b3403062,0xEfF7B26F69D7C003e6E5c70A1CF313c11EBD06d6,lazy oblige relief scheme keen excess zoo split surround wood retire victory
0xb5306bfec86b13ff72e3be5c8d021bd9212b5e84138636d42c6360abcb03abe9,0xba8FEA36e2561514275089c6e4c03D5299E8Aa5e,dentist aspect palm include knife bounce ill away toe alone punch pear
0x0628b1e769bb7bcbb38dece705b7544a9c681279ef015e85d1a634e74e6a98e8,0xeBcd008E19A822acA1594200c133271Bea2F3D22,tornado exile bamboo genius theory assume custom neck source tool disorder oxygen
0x2949979a982a66cfec4fffc04751db1d273e53d9c71ab74871d7caadd5942a1c,0x72f2D315319847DB687baa5271E9fc951503F7CB,move cause protect great level rapid initial valley hotel link birth rhythm
0x23e7d8fe6f1a83446835dc8e9eff7fa619b1733f57ca33bd691561d03166cee6,0x234B06fBb15dc6Dc5b053D07AB77e1eb6d47e58c,fork secret romance margin expand bike cheese kite sail step control average
0x907ce1e4d25e0ee9727c2d2c49f5041242a4ee9f7a60837e81d8f3ba87573470,0x2d4F57243528d5b680ac89E64AF8721988Ffe86A,grace soccer pledge speak loud horse ancient desert sorry book rather choice
0x96d32f09decef4ccb3dfc7265cfaddef08b661ea4edde1a4a22bf46cb67a3221,0x5489a5c85961DD4A63E0b281637E75357Afb5521,shaft glue edit fetch potato essay pistol hybrid affair expect also chronic
0x15c64186ac237552a226b602888721f524875c91b833c0cbb75de9bfc20276f8,0xc69Da63f4B357f1E4d10bdA7E36440A081E20aA0,human subject casino there since surround cross kid solar faculty merry kidney
0x4f8a4c33440029f82b8cb73c38767a3a938e3893f4117cc89524c25e2f5c3db1,0x6F26B649a7FF023B68877617ee71615D6051239c,fever hill rail ceiling consider frozen sound risk social skin marine proud
0xfe231b753d6b05fb7204f3ef262b5793a8109fbc6704b27effcc8e49b45417dc,0x48BaF3B79ba19659cc73763939DA94860B1860b5,reveal short receive fly fox interest work soft mom fragile blade elephant
0x7621f465b58acb1595dac8d8ba583cf6498b475f5cd8840f3ed346adf3330474,0x354834ED0Beb5A7f73D5368947A617BeB918D1E1,swamp menu sport gadget phone melody cage afford slender candy zone grow
0x0266faf65e2a54093b0aeacd607512431d48d7c5d0b5c6ca3b77503737b267c2,0xD393E31BF3Bc4E03d9949698BF2610cAB8e06E56,token satoshi home physical document latin pink drop father spoil present knee
0x3f1e07fa354ff76aa56eb2531cdff9a2c2e0bbddccf575badb6db2a2bdeeb0cc,0x5f2C3B92BBfE9E379E95843FB82E4AC666867bf8,whip meadow brain load attitude ball point palace online stereo program walk
0xd406b63160e9b887c943bb68ffafb591513c4858aa5f9fb9175563b81a3b1960,0x4bE6F9FF7aD3cBf3969225D761405b29fE225D9F,direct bottom side when hour wolf dragon invest promote prosper attitude snake
0xfe46dd445b7515e9a7fca69bfcb971dbdf8ab1d62e22b7860268b82f64f5c6f1,0xf5404a59D5A00f93e9Db2D5bd782A906FA49C9B1,frown draw fringe shine strong mountain social badge crater sight spray glide
0x6c914b4f5cae44e5d91d28b9999ab34918f2f1a962fbeeb422892bd4ec6ec035,0x2BE0704b8922457D5c6Aa9F4793512f02c2922DC,unveil conduct occur love path essay flock snake myself uphold cradle project
0x4a3cf43edc65af7c371b601558fdaab10e3606ef5a27eb5931a191c91e1b0bea,0x37346163A64aF8E8Bc062782C040efC8cf572092,sunset portion heart shield plug choose birth afford blur half ghost enhance
0x8131306f3431d516a9292e8cc18e291edd1542cfd84308f80b4a848268a99fda,0xe7F41ba381da09Ad5865fBB6414A1d55574E3909,bomb tail slam mistake notable tilt endorse novel woman fit debris arm
0x74c97b5105923672c2b59004895376e069df881f806a808a06db49f0ba239e10,0x370a8622ff5b95e9b6dAbC7BB8AFc7a87960AB52,sorry grit pink rail fork wrong elephant become easy guess stand drama
0x48d0859ae4ed0ae93e26a03511b5ef7008af2dd16f7d1ba47bb99d215cf07303,0x7718Fa536F68F728a31C6D2c0dc8dcaAd2cE5516,oppose security host soldier network speak deny cram misery lend suffer bright
0x9c24c25a11222e212f04169aa928683c5f6fc0b12d34eba8619114aa0f013ad3,0x3a19c9093cD90eC8C2971202cd8B363372fC3D98,sorry conduct expand citizen thing under ankle brave team job wedding fuel
0x84b58795ea3e0684fa7f951d0446fa8ca8547864fc38ceda808bc2a60c741922,0xAB52f4CdbC2406afC0FdAF66B4e0862a2Ff7500B,police suggest couch pistol boring toast pride empty picture level rare tent
0x123ea2afe059145d70dffe91fb7453d23b0582923d9e076a009a4841c194e066,0x1ef975a8778DECf37cd0E4258a8bc7582F21903E,adapt squirrel cube together evidence upgrade hard student spring initial evil ethics
0x9f34f3a3870ab556e412da1a2706caa29a0b46c0bedcd04ad16cf5ee412e565b,0x03737985c61BaF11D2Cc3D3837189d6477cfEf93,arctic analyst debate drive welcome fringe cannon advice pear engine cheese blue
0x96cbed56bee9400a1e6f78fdc73cf3d5d5e0c4f1f0098f502b570b2e47f70d53,0xA74C65d6402455d24e0d39f5a0Bc412f470AC4f4,call bird arrest master surge sniff nominee trap bleak garment alter demise
0x695071b030b1c2ee6f3133f58b0fa2688cf5932a6649e1a42db5a7d77a34f74d,0xc93A89c68Aaa6d6FD8Ec6c5145facCfb40a036f4,paper fix circle mom access vehicle pool patch fat gravity luggage tone
0x3940ed4becbea56786cd621df04b715efe3dc002738b53554b782fb0dd441906,0xE1b94a600161C638f4167ef7A10750da2953DF04,brain festival where moral guitar bundle service carbon warm wave call depth
0xc20d63dce7a27bfd9ba9d8dcbf7d992f4d760d4f6500ff4cd7b432aba338d5c9,0xf632091F9333F5370669e9e07a1E9a258e5220fF,arena hero screen rocket caught sense tornado pelican trash guide perfect language
0x5581947c7b5a27562b2681e5d6e26138388cf4236c58b60a1585c2863447f73a,0xeED135638B5DB8588BCc6cA5DDb05FeeFfFCBD33,please verify urge wise fish pyramid pepper head wedding bind avocado snow
0xc9b754eafe1376647f1b9deb3e9f3870fc19d3b8058d8455beb13ecc3104f020,0x633581c77EB98A18e9d359872e32775c23728a40,raise note pony soft link primary typical combine intact desert palm flush
0x281d547ff1e9f9f552986cd58831af117e243042bd5dcc61502d8a2c82313200,0x613a663Abea843E004C438503f5675BC1B0f994F,flock illegal update raccoon media write price syrup aim seed blast gasp
0xc283b765545db6381274349eaf6da6b77a5521ca45b9b2be87c7edcb1defe629,0x30cd6cb2748B6252baf84A6fBc868e9F4B96b30f,mushroom taste donor canoe labor ball decrease tray mirror nose beef work
0xf9b0d3d612a998f6dc0d240ce93427f77fcd95c92de046cd39c74f3684770c81,0x3cAcD776b3627B42Def89E5AA489586Bd8f2Cb98,chef horse frown impact fit gentle cigar sure demise party element hurry
0x32536e9847b0627f0621399bac9b2ae55d3056ed47c0239d9fc26139924d9a55,0x5A4122A89BE83552AcEA1AaAEEdD8E56E70aEd11,ankle abstract direct gadget school morning very flee jaguar sentence bulk runway
0x736d0e39df3b13c7ece58cb459e2f9786242001c3cdedbcb09372cd7e4ee6d43,0x269604A2444503E90657ccd7837721BC1F6118F8,kangaroo matrix author cash pact fade half scorpion type review tired crowd
0x00af41963c8e000f598bf42d8c7bddc80eb15897954ce2ca75bf6f1b4cd26d84,0x0988e1928837FA1EC28166990C19ad9b18BC7E73,galaxy usual push umbrella public venture cruel ankle outside harbor jungle recall
0x88533d140174e858fef1f4e56a9b2d792c30984125cb7a05ff7a89cd3130fe71,0xFe4eE74CDaa7659d4861851551f91d610Ac9cF41,network vicious there run acid job method axis donor frost wage image
0xb672300406a1e3d93475aaf8093ead1180f381830293aaa067b6575cb35678fa,0xAD6A36a7b4f39Ad943b54c0415F43BE026De9F3C,wish journey aware sing shell motor nasty price turn oven awful mountain
0x0e6cec3d86414db2484065ecefd74406204364f8411fed3e48c9e9a9b1ac2950,0x684861507cA45b5749642a773B952eeBb0C542a7,arrest actor cattle exile world recall quality junk match fault bean advance
0x22cb662515826e083182e4c9081ab5b5f7fddaf548b98aa40bd6bc5b99c60880,0x934C934eE3729f9833434813826700580ff28963,candy choose warm suspect airport shield paddle father arctic follow just six
0x196eae1e5be96f4cbc1541d0efdb86344ba864d4dd2da1f64e4bebc812665081,0x2Bf841b2825f187711b65A1D83D1c6ADfb976666,tribe turkey broken enroll document vintage type train service blast lunch salon
0x361804236ca14b796bc4001b3548947a53d0975f4e3c4216ca235809c6b56704,0xe1D1E9d931AFEE14129dA7919A80e5291b9AE137,palm fly mandate garden science ivory strike always found grant rifle person
0x3a53e64c978968accfb5d5d43698e536d82cfeaa358c2fc0986e52fe97db3185,0xE31C20213bF0e97A00D4146D03D4DF890a3EcfEe,lab provide quality bean cousin away outside toy earth pottery cream odor
0x6712454cdb4050f8c2c2c35d65843a2c2f328dfb41f0c901cfc6ad6398ce0b5b,0x51df639ECbE59BE578B841c264f810b945c85022,decorate curious umbrella win canvas extend gaze extend success dismiss vacant another
0x93500469b5929337fd44869aea3bae47b1b940bdc1df32e89c5011a7b89b88fb,0xf99d0E112EA245159d9a0603Dbaa39415d270550,jelly liquid monitor prefer decrease tennis cotton eagle tragic keep motion copper
0x37240740687759f6310b698207f9d62b55f42b4fd4929df95020a03ae0cd6235,0x0Fd0d6AE4DDb3453a57B71E128C847891Ab66854,payment story expand fringe danger symptom behind outside head leader fresh mad
0x50426074e07a944355214490e0cca044a4a96d0781d36b413432cc92d60824f5,0xde36470B98560063b6cA753Ede3a47a9F5246F03,brisk soap seek gown tumble narrow solve ketchup able blade must employ
0xbaf12bd26c86051e8bbaeac941c7377f4497584c9e774cf2bed6a9f4472eecf3,0x57D7fa4e7C4501004a285638D3A4c4Ed360abcD4,yellow destroy moon buzz before round spatial word sock desk holiday derive
0xb9f8012b1ceb8c4ad8213e4f88ef3a7d3bec166d6a48763440d9931d123217fe,0x468d4DE3173C17E7CF58155C1b0b2774060502eF,enemy patient explain final crater approve common gun ready arrow walk lawsuit
0xdfdba67fa4b7a147e110ba48825833b62263e3c0e32a37fd049f0e89af1cac80,0xBeB2A23296dB22A5D275adc6D1Dac24A91CFEb10,gesture ostrich vital rhythm snap mom fine jungle clump road genius stand
0x6b7db182e2449568fa42d983af39f1694715257107eab2f2f10143eda0f52bb8,0xABf3816026383Af43A7D7f5F2f48D0C3C644369F,nest busy rubber annual climb knee panel subway neither sister emotion pause
0xd3a4fdfe627369fc4b58466f5df3336223f8b96a6b0ff10458d61e119735cbdf,0xcc1ce5Af4B065a3Db99B31718A37778B0A905a4a,unknown rule park engine mushroom adapt rich yard drop finger kite famous
0x0ff26a3000fe95f63042af596bb7b3443efbc390ce99dba9e0971f4ca8de4d21,0x10a51160d75454909df8D5192F0Ca9569cB2bc96,pill response antique slow future legend endless tone blur coral review news
0x6c0006e5138fd7a58dfe2af735d6e37230957bd0f796e7f03b95f2497886aac6,0x02e0dc2e919DFaDA88435ce9582BC86AbfB01D3e,normal ankle capable lucky fragile furnace toy tag build quote caught fuel
0xb99be4fee75c2352212784eb7abb334eb68e665a6fc4c5cad4f984151f08c6f6,0x0B05bFC2c34cfF3E5A3698b8e1Df24003eBA9448,glide scissors park story alcohol increase traffic novel where gather catch salad
0x8319fe09b437961b1395ee222f3d64a74bb45f9a15dd33c61c698517f197c658,0x020F533D85CDb1637Ce05e3f3915d7dc75b78C61,barely pole arrow october worth kit error barrel hub family various mistake
0x5ae240f559f230591b8dde9c1e1c91d51d07d5da2114ef4a476623ae5a0d5ca9,0x36D1196528d3CF65B52eEaBb547d8D0aB8E5e03F,fine boring cash donate list among save minimum april shift lumber piano
0xb6f57ba41d6723d9426eeea1a7e8cbac3cca4d9a06677ebb547d1f5c8a9a12f0,0xC5d57889ee59B4c9D86294aE5F6dB6220F7Ac4b3,inflict valid property stick connect stuff float motor kitchen boss treat learn
0x427c60ae64099392a268bbbc978e929811510607d2cf0f9697b4479bcdad2b70,0x8fC4C9Ff9713d7e72170Af06B7dE3263C4D25E0d,because visa execute there raise oil funny armor below toe smoke cinnamon
0x7521eeef23073636e9405df95414429fdeed6b32cfcef80bd69ea5a18232331f,0x6F9F5feFC7748C4850c9231C45Cb7803B26224B3,ranch stairs primary toe hole picnic stick clap trash reunion civil pair
0xd9bf51cfa5e577246d09916e5d35a605549a3e5bb7ccb9f7b36a1d2d98b778fb,0x8eB2aF4De75044ac200959b904bc64c2740DAdBC,local tourist tourist cannon shiver cart bounce bulb title energy again hundred
0x77674b6f8ba8b439a1a70c4852e8c9b05fe5670791fe3b9f4a7b4c2905aed732,0xCFd5049d3a94fD2CB7Bdbb9fdaDcd9f5aC190537,lemon yard gloom learn elbow gorilla find hotel submit video bridge panel
0xff35192a509333e6e0a94f9f46000509836143352d3a35b51be650839913f0d7,0xf84dB4A5E55ecE92F6692BB5f2B1FC6238eB6982,similar artist merry common hip helmet ceiling border idea hat include pear
0x554544933dafd19859ce397b895a45fba38b4c4717b7abca21845b409d41bbc4,0x7D32003727A47F6D6ed1021e2d1bCcb122b82387,anger social increase chicken rely smoke orchard biology level reunion gentle enact
0x904e0d46d70573d6b90bcbe2001eac7839c62243ecdb6b0871721875aefd35fc,0xf4a1378E414746957290807a1Af1223A1507e2c7,favorite camera seed grace glove action rabbit tray link palm catalog trigger
0xfb24d2b22cde9605e43132ac26690af1488587abfca9fda4dd291db2e3d51c85,0x29762a46804d7C362D4Bb9b0B9B0e90E73ab929f,weird paper lady wire neck few stay discover evidence agent penalty sea
0x6aaed402b6a14f4e186806bf5abe2cdeb0edcab8774c2e4f73c5ba67a449c627,0x4FaDe6754E85e1045dF370D09fDA23fdD9bf86E0,twenty bird throw ladder pencil dynamic anger spider check educate salmon panda
0x070d1619e1454814e40467fbbab9d8287a9248106e17b6c5bb7e92bbcd9d0aed,0x3A27F114960E4103EC154f961bDB2EF77cA433e7,lecture ritual trumpet stamp boring try smooth lottery draft wheel prison hidden
0xdc6de6bcc99957c82bb470fd624669369798b4eea102ddeceeb35d08de29dccc,0x7986791eEa1ff2a066816c95584CFd36904B9577,flower toward catch drift clap mass welcome flag regret chalk ticket hill
0xe5882e85d2216369466b5d3a3e3f8b789a4992bff67ba6ba3b7a2c88c58c44a9,0x7d4e254B35A8ca7bb37DAeCE80cf0244D01b110C,obvious sell bronze fade possible kitten dawn crucial actual monkey amused toss
0x882644522ab40874008fc3dc36a8175362ac1f10cea6f43fbff51be13e2dae63,0x9a1E0A9813EF5e67396e07Fe7B58C5D88B1C4D7d,calm raven remain basket forward patch deposit nasty donor blanket render hollow
0x61299e0b8095b16c07af878e239ab7c697e7aafb98736cd9e3d4e4d4aa962e78,0xB57785fd60D86b5952b915aF90B217C0039701Ad,light rubber shove view treat mimic course luxury unknown type enlist school
0x7960d86f22e22c32364ce4257ebbcb82dc94a1ed614bb60d748f4b9a3be58749,0x92A99EBfFf3383021ff9e93ED282670bA1890AD9,moment shop aunt acid arch harbor wild cup boy clutch health raise
0x2f61df1811135fc584a31d4d384dfa5699cfe6cdce478c86327b3b19e7678599,0xDfAA07193B24CBC2Ebf0F0b65e9aCc8a6e5a6C82,favorite child police urge month butter rebuild ocean away shrimp tunnel sweet
0xf34be73af5b9b54292391ecb6747985c72fe80f703f6cd8359279f6b55798d2f,0x9754aA873620e3C5762CDBeDeA26e485B538d281,devote crop captain response very melt fork swim exhaust glow rescue chat
0xba960d610e30db6d4c523b1147509d1c2602424c784480b1aba3220fa1521cc4,0xEdA1d1857F528437B814819Ac91ABC3A9f666B6F,sugar copper over claim column romance excess duck gift blouse jacket announce
0x0e33c2d2b8f44329614e5922c8c535d2fa31435b53cdadc6db42c8c75edac113,0xc0d1184Ea876ac364A6f14c742225f17bA8386CF,reunion happy round gospel welcome clarify fabric term spray robot exotic blade
0x75f6138a6c060b456809d51018ad41fb0492fd4bb045d83bab8f148dbeae130a,0x862C9ccA9E9Ff3dC3c4e005352bc783AEa3d6f5D,gain fish bulb rifle inmate strike final cinnamon police limit tent waste
0x83139c35b120fb872da7580bf5856279d4cad8b4e739771063948a05282ff029,0x01AE7729fDC2A0050Bdf0f5b2A4c04EdA5271C08,govern author bachelor lawn image write purchase exhaust social pull power soft
0xdf9b71e68ae27ecee5d374484cabd840dc2f70a230b0794278306e6dd01edbcc,0x4040e9d7CB1f751d065814114797c11cA49FC8c0,wear subway forum scorpion december order close reveal air click coral city
0x9c8103c8c18198e72e24b6d5f616930d122ef5977700d1aa498689a22f5a5a24,0x39b84d59f1DE468C295fFdEdFfFc75c752De3bdd,truth question tide outer normal notable fold stairs more motion spy universe
0x80b22f3b3aef6037e837799287ebdc64ea0ee49921048bbc9d880332cb6c467c,0x5eD1b122F9db38D53Aa46cCd6a51aa41e207A1E5,loud capable assault embrace flush food culture normal lady guess salute tuition
0x8aad841e7232bbb42cf70a96c5d95ae478ca344a0ddce87516ccdcfe4db7818d,0xFEB63D51feA002F40bF969C47C281cf5Dabb9584,water burden minute hobby mother feed rural pitch toast move pear behave
0x65394b9b183d8455ec46c0db471a67d44fc903c9b68b6a9017d9cdb127f970d7,0x3A6478163aee2F5578BBc7B34D9059c0C17E8CD0,vast teach theory nerve benefit hold tornado hollow absent battle naive account
0xf986aebdeed6fd1f0e0c1fb529cf0eed954f453b5b9e741c010c8d0f66e98d91,0x23F46EEb3EddCd95a1F24c2862e94a81266c4F32,retire north dentist check lunch pulse mail liberty human prosper point share
0xc65244e35117c664f22a5861f51ff5a95d37c32c64cc093d33f73e34b4b07f5d,0x0A1aF22bc40504293447F150683E0dADD2F3F426,ethics apart quality tent oval vintage envelope milk lens sound idle federal
0x45c9c1ad5ae89e704a53a93c774b288f0e76525a59c5c469337a937b1fc758da,0x0f80D57cd9Fac289C9B17e7820392E6CB2F72d9E,metal release actress please assist unfold this nice tuition reform already between
0xf4e83fbd29ab07c8160e8111535e640191ecbfb2f4a5acfe5b14b7cd9159f09e,0x4dacfB9362583d6bf7703fb908fA3D71621E6680,differ health swallow vague bridge salute ankle sport daughter reunion cart panther
0xce2952e6ae7ef917528236fb9fc92dd415186c33ac5214eaf5ea6a26c1ea5f1d,0x05AAa8ae7Fe148Af72a9be078F49b2b02d155509,cloud pilot tomato expire giraffe cat frequent hurt rapid album angle dance
0x67864f9e1752c4413f28037d8e05110324500e539296bea71102b72046b832b0,0x0da187A5f09FfF28Baa749e6cA3c32F785296c07,human rose sadness mad situate round minute leaf depart infant drink fly
0x9ff353eeccb8b611a5cbe7b12c0769864f0ab83ce39f7d107ce011f5c540cf1b,0xB4375317919e453cC1FEc4452395784B274bABbd,leaf bracket evoke refuse joy dilemma shove curtain camera frozen warm home
0x1380431b5dbc04b5a4176cc6ee5cedea722704446125fce84db910d43ee9c454,0x5a387A4C1dC91f7f8D6db2b70b8358dbc8C08Ab9,easy nuclear split chase curtain tribe sign nasty frozen lemon glory unable
0xdce93efc992c08c6dca87009acb0b1cdb4c53bda51f9b255cda413a42d7277ee,0xf47d490A16b8d22E38caf109A39bD948d9A5A078,diary day base catalog confirm drastic again fire erase sentence stumble whale
0xdea6e87a2491c4c906ff36dcc53be4b8c81b3e9b399990731af7b69bd4e626c8,0x6DAd4A92761AD672dadC15f6862635F5e0e7aF3b,slice legend hawk silly glove night hip mouse cousin message shock fade
0x871eb0c6b4283a7fa1f0e163454ea35a80dd77e6047d31328592428bced50c5a,0x945AaB088955faD0b46AFDBB1fC83C6B73aE6e9F,check stamp boy piano abuse prevent raven ozone blouse giraffe nerve damp
0x93e302cffa48e9f8385d67c640ad44768b2f03433f95db71e8ae278accbd1ab0,0xF63A7f0998929b7069feF8Ea8Fa091aCc5c515eE,lamp erosion relief menu advice slow price meadow eagle void ticket congress
0x724fd5d0d5a6d11e726fa972e979c71e7b860205a2360e9e85f1468f61cd5443,0x22e87e55329410943CF37A926f6eE6899592381e,room clip engage check despair more inner victory orchard midnight fossil behave
0xfb3524d0b64017ad3f21a51725bdea4cf4650dc898112abfd248e12c58a715f4,0xfa71F1dE079F280056672e87d87b1824DDeE9750,observe nuclear evolve fiscal picture prosper pen club find have wise submit
0x27558e96c41725dc6f15579fac308d7e2149c94d8bb3a0606b9b1d21e652c4ad,0xf6d9605C3BF49c186a8cED0EE5a18C43052f2b4D,choice spin extend jelly enough kite flame wing boat clip omit rebel
0xce61ba6b0e5c02d141197836b02f421eb8e875eaba5168f8745f4c18147a3905,0xaD7D6517B3797f0e7af4378B0cB654390731e1a7,violin lens urban mammal victory divorce consider tissue sound key caution liar
0xe8212782dc28c2f7ac81b84677e48fbbba2c75c1cc544e4d753dfdefc678c24a,0xc78B834d8f5732F56655f829CFe01fa076d19E80,pencil garment banner rate antique rookie happy other increase rely chief comfort
0x531e6bbb465280d3f782dba3a8f26ae7eec3d39620760efe1c15dc345c1afea9,0x7884694F6C156BE5adcBb152E1F341319F764b7c,modify ginger egg limit thought blame measure deposit like region bring sustain
0x3ba1e5500fa58b312864200c29b9b9d7f1c804d4d2d131299456f32403786b63,0x5D498e1752E0c6d2a765EBf331AcA4F57AA1fDFe,anger scale purity witness finger fancy collect tobacco road receive ginger robot
0x1dc6e202c8416c7027bddab6e90393c2b2f3fee63166c07550b63a3823094d1d,0x466e78bb985C8A4aA16bA8b741be5cA6c8c131a9,save wrestle race clip word thumb hurt cabbage magnet gallery typical tooth
0x75e9e4fe7f615d88795a6c71c547779d61205844926094e44da95d0da899868b,0xDc30d383add5717A5e7ae820739D2AEf043285f3,worth pilot dizzy silent such cry enlist identify keen aerobic cattle donate
0x34f209bfc39159327f8fa78f42d887bacf5b1dea44d6a8b929a60540f5487916,0x4ce3d179096e10df24C35bb061214516c69Ff0B4,notice barely pioneer trash safe ignore combine garlic quantum friend sudden excite
0xfa81ba6c229ed3d5007e7fdc6e9d29783aec26be840fc7e066d69e2d8e456e0b,0x9206434D8c23fCa195c23146e6cc8D54E0912b06,green birth curve scorpion fluid open voyage wet exact conduct finish creek
0x407763106c7ee2727d9ab00492728116e48b6408f8ec53f44e990c79ba78c0f8,0xBE55228367cCdA29762fd2B17Baa6840955558E7,december brick pipe chief frog slab female music hazard crew around ski
0x99d87ddf7ba9c00de4d3b7e6e42a1270bea9de4976c1b727e01dc9016234351b,0x85f7641b36803DE6f0C4933Be8CB4279E8D287dB,convince express become cram spatial submit pride demand muffin brisk prevent hat
0xbca9b3f322eb8e6d2f9f1f346a52d5a3d111b1033a22fdb3cd9d99a7533dcec6,0xB1624A7f4998271690310972F9346d0eDd375fcF,dentist verb virus brave thought dial switch lounge meadow unable minimum drastic
