PrivateKey,Address,Mnemonic
0xbca69f815d21508748b5392c3f71ad2ebcb09092a5937f399f47672f18d93b6f,0xC12A48714c86498a43F486ee75761454aC7d011F,runway rapid original candy rotate tornado narrow zero else hospital winner source
0x729101faea25fd68e5770f05fc030bb3c0cbe9b7c28e12fb1c9f0167d3965a6a,0x37237f4081Df2D9d5dcbB92B8F7d1c17A924a5A8,shallow robot reduce frog sheriff ethics gas holiday hood mom vote pigeon
0xa7f4915eba838bf20ad1b43e7635172093ffa7b244d45da66350860a0792746b,0xcd73e369De9D88bae5e8fbf1088132c98ebE438f,boat blouse one wealth lyrics capital roof essay soft item throw common
0xfd99bac12f0f42188f21d2010ad5477ed8008edbeda337518810b6f10401b4de,0x0FDd32797cd732B1A9a97139B0f0019a893a5449,cabin visual bar nature purchase repeat vessel strong shift forum all rapid
0x183d53b79f1ce1d42ed8095669c7e9472b63b7f6ddb9e5c6b22ff06737c144e4,0x6e0830CbF7Ef5520eF5f4f1574351Ca02076fA82,bachelor urban seek desert sound special enable when sibling coral cattle witness
0x62fd4bee660ef08c9913685c8d6cfad348bacb92f18f3459648ea77308ac7807,0xFEb72DFEb81c2886709973aa44F3700598173722,flame matter emerge puzzle elegant task chicken post diet exchange width away
0x849ae3e7207fab740e787c4775036ee17dd9bf6cab73b939a6503ba9d24029d0,0x30eab92326BB62E71e1Be858845C338f20800d08,merge fabric deposit scrap thrive have fog remember license orphan pave blast
0xccac655854e76595e1bc60c01affe2f4a35b6573318751a66734d496d6017e0d,0x29621E7FB389F5B3E48bF35a98D6D7b2515AAa03,visual trend monitor opinion volcano program spot identify carbon copper early van
0x193156756373abf94dec5a8d84b45cfe179fd1dac0ff6a3ad408f1dbb0e3a2de,0x1Ffc0501Fa3F07d0dF911ba5EbD054fac457E412,relief ride knock elite radio unusual brass news midnight type ribbon minor
0xdf5bc07fc4a0716f4712b9d64180592448e32dbc3bbc7ca76c1b32e7b6c1dde7,0x7105Da26e2ee58e1Fcb4c333aD9505D14a8caF2f,ribbon weasel sheriff like harbor grape output result future route agree pattern
0xe6964615f7b13cff096f1e17a0e55c83fd3ea023f6877e98d961b507aebb4dda,0x3179fE3E2CF6740Ada67CC2F7ddE98dAD56f040E,leader similar nation multiply topic travel rough awake powder trade bargain insect
0x978b57f97a8c177413706885cac9d6120d16a68d1c9403e0efe8db6156398303,0x69f34a5752700Fa08425b3B4B95919Ab06Be16D8,silly price lawsuit pond when regular crater boil rebel weather congress forum
0x998fd0b29c7501f134a05a53073e4ca1d61e6ce4eb04374f022d0246cec3efcf,0xd1F9C3e697D65fB9315A079A632Df740814366fA,gloom scout crisp wrong favorite ill reason someone unique minute waste sail
0xc07e0414b4462f14b81d793de9c1c8c02acdc9d43987df40c77f82d4a8e66118,0xc8e8f8d7c9368a444304d22167fD761c8F74c275,day adapt mass soccer rack weapon shift flee pulse wing subject organ
0x3ce63557c668bcac5957b5e42a862b64b27f3515c9bd95cce36a865a625431ab,0x5b9E34dAA170459134cd8085220A204FB1425e7c,nerve fury above dash maze canal body amazing crumble world decrease leopard
0x8840be7a6ab902d344fd5df8ded67dd19176b4c556e3ecbe62d8c9ecde957f3e,0x3e84fcB9b316C02cFF5aE9BA27F1aC4fCb779E1D,potato jeans lamp elegant stuff pave absent simple fault topple sauce involve
0xb84a8d9442a4feeca8f243b5b38ffbb223850f1eca32734e682c5d1cad9eee00,0x1688395f966F0D9E6129EE20Debe86DF182eB0f3,place team hat arrest crime chief topic cart goose movie zoo real
0xdb55aa84b8e080e3a2e441f30691f50fd3f88d044e49436932281b423f9b4cf3,0xD143aa93c0a8840fA16337332600ec4014cFE81c,document grass book apple offer region knee lunar drop sunset road polar
0x50499bc377a5d4f3ce86fc8f76b0dab211485df680f69875ad167e78aa4ee7c5,0x48632B6ffeB6F40E5630936aA3222eAE7DFF6Bf3,fine spend quality excuse hurt belt cool surge ozone blind cancel home
0x74facb52df704ad0d3b4ea09736198d575ae22e31d9cbfc1a6918c491ec8c8cb,0xb1c4ffeE95A209eAa052059868b3e6aA7b993d48,daring lion virus chaos figure demand member urban carbon breeze sheriff year
0xc28e86a45386bd70f9cfcc3f678bd453cd5d28440fdf256ad298e600f1f04129,0x696aD2df55e25de3A5046383e8185AD545694eA5,stool cage squeeze know recall young emotion budget slight nurse fan torch
0xfc28d2f94058f3d0441b0ca25503577c914a83e5e7f6024969e69fd113600760,0xB003610E002D17Ed1D737E1bbFC184989990d978,major panic frequent walnut practice same just boost hawk twice public badge
0xfd78615134024124f35b6ea64ab96d5ec025b24d039bf28d6e28a6c84de0c205,0xE17aE07BD762c32f01d1ef3510143cdE8a370d99,member unable dignity initial brick saddle vocal convince glad crowd purity coconut
0xbf103b02333dfe1d2bea9bb185f1e7b9060e0a54cb5a82a3d8abf4cc4d441867,0xDb111aCa4BB829F46b9374148A4eE83E325a6895,provide harbor vague galaxy travel better marriage review cigar lion begin virtual
0x460c43027828c6d5d4fef9720d9d24a2e375194c5603a1006fe5ad5492b512d9,0xf710cAac558d16982c1Cb848107c99Ba4B1418EA,reveal social bread session joke roast grain arrange empty manage dress word
0x4c0cda3ac98492daa5ed6f54f58ac704676c7757e183e31db135f60102619fd8,0xDb56Db478EC9104dbd85D59B23C4aB4CF4e5D180,deal trim firm shock flame ribbon nasty episode exchange before cook ketchup
0x905f9926025e309215b48241e802318562a176c2a217119b5550b0565a255029,0x07535759c919bbFFFEC0c403155d2B1F4A106E84,chimney toast home evil weekend update endless tunnel trend dad inherit reason
0xa01e15d50b138b3347105ca85870d0f8e24dd07840bd33bab9ef999459b4ae73,0x568e165546bAd0Cc6C42e43170583F0fb4e9E7B3,february check scorpion observe result display core cute change about town pact
0x016531fcc8739e18dfc26054fbdb0e9b9262b0a148b66856cf1b88224e8e25b5,0xCAc315cF90154C09b65Cd4348ABa3056e7aA4b30,abuse soldier office immune glass escape immune quit behave upgrade tooth beach
0x2808ca13a7a7f1154a5decd74157a6d7a5fa6346d40fc8821ec5cbf5d658c23c,0xA0cB955FaD938545d3e865919BEBFA204aDf93B6,program improve side odor perfect muffin obey doll arctic tenant moral fault
0x4591c9f320b4b695be2a4823c1422452f356731e7c4c65baf195feb3fa30d802,0x395f4c783B4024c01Ce2FB4E8dA372A63C6071A6,behind deliver icon track baby net finish find amount student escape clump
0x48d1386dd5a95c2121afad11b4327068e80c9b76f61d051d05081ed624e50b71,0xaf4f345B7CEafff7441d8bA2B7Dc5c22f28aB516,moon allow kid emerge book paddle chuckle venue practice rich rack step
0x2d17e981bc53b3d4e21bc8a71c0dd7712281503d9d024044029eea445c76e76d,0x2235527C033a7b83caB9683f2655787d3E4F1eb4,color that renew still divide soup depend velvet celery next stereo unique
0x6eae2e60e3f658264951502e8bb228c9154460f8c9f9fee4767f86f41ef5127b,0xEE77D04Fd224e4A153b26317CF3c4025D4A2Fcee,display tail garbage perfect turn talent bus glance sell mammal another satisfy
0x7cf9214c8014808056218c20405da972e6ab0c1ebae9667776f6a4fbf1d0f9ea,0x0d4187c87456c64aF585a6724C63c52367720c1C,animal celery submit fortune salute material exist move same palace dress agree
0x7da304df5443e04c82548bf79d445437de9411f2c46b470f4ca3ace25ea41a18,0x913F67d9dFC6e08e65A11BeAbe44EE252c06e035,arch pig proud tone hard gun eight rubber useless hole evil bitter
0xbc6642ed57766f46eb0b0bbb3cdcdf2b81ec6e2c96864ea82548b2a680362d97,0x2fE26f3dA845C2E4EF0b704c72E52d0c326b46Fc,immune wage fit build want observe rabbit merit bachelor weasel already divide
0x63df7241b18d5eb22fd9e46fc08354f28af2c6c871a37bd01c2da63c7f4294d4,0x58ffF5652019f374894Bd7eEa1CD677502B4f88b,tower fun hint gorilla business question attack finger punch myth same plug
0x85460e4b66885c9fab43647c0e7ef6823e5e6cd9c0da091f7e27ce919b2b2dda,0xa6c080d9a8c2936463e581d314e3321e7b3CF7f8,divorce edit use foil metal cancel brisk about penalty discover air there
0x08d0534c7bf283258e998a4d3374efe9b45005cdaba85ed891266ba177a96420,0x1107Dd87E9B62629E9bCb36C0297664ECFc0DC4e,drink column distance fantasy setup eyebrow animal betray wall okay income calm
0x682059f04817d66c9441bf4bc6ffba931eb2269cde4cd60a6b67e4d49c8932d1,0x08C6e3cEDfE1A0EE3Cc39329645D3A2e2882B525,letter pepper trouble elevator vessel iron skin thrive bomb fall casino infant
0xa4df05a73c4804970b00a5b5033a4f7db174d0e636e58dca88098afbb749e7dc,0x190Eb6aA09F7b21e5C88662374098B145f7351bD,shoot idea example trouble visit wage direct robot wine below figure marine
0xbe5b454679a26bee682a7d246943274b245d308bac8b3636d89109522bc67e3b,0xf753Eba85e6F73966b048A0A7E75Fb6C0303a25b,tape ostrich original know feature typical bike drink nest rail dog job
0xe1829726a4082b8e6c1b863e6dbe3d59a4c1c4ca1796e92c477d3b471f2ae891,0x2605e67E2E8a4CE90d731879204219a44dE775f1,setup biology puzzle hood blood smile idea measure unaware domain surprise release
0x7597fd1ad369b8f57c6bca0465bc0476bc47d5040f9b66838c5328c769091d14,0x0076a98BB493f8553E759f86880851CCBBB30260,chapter draw supreme foster vanish advance skill scissors burden spice donor degree
0xe1a219d0a34289c107f6529f44fc2c559f3f66859cf52fafa5e9032697c79ed0,0xb0591e724dE9D64a23F30def1710f535b206Beed,hybrid match twelve joy stick notable search doll teach sick illness middle
0xe4abc4d9e883f1f0a1f2304f21b83d45abe6e2c0eb09eb717aa92a529207b958,0x771c962CFC4F4FEcF3794050fcCcC272A28F5C93,cycle cement angle work drip melody risk any reopen spy behind ill
0x6a7dcc92d1bca76388f424e369b5a1ac17c173ad4d6fc0a09147f45772b6faf3,0x3e0F8342f88C19b249397293b60FDb7685709e09,galaxy promote frost dirt camera depart receive party announce category monster sing
0x0a7429abcde41660c23c7817c524d2bca484409370339b14692aa7220e062d84,0x60A977D6CB125c1A7157Ce2367c93D9568DF16F4,oxygen athlete quit behave urge come someone arrange make impose car rebel
0xeaf9e35d8ad5d70544c02b8ebd4332b1699dece71117b007599c70023c7cae74,0xDC5DB174FF3205ADbD5C25628A35a5511E9f48a7,diagram rack scheme ceiling magnet element girl street august visit artefact fat
0x33f239c0768bf4a698d250ba6e0620d97f822599a59e3bba43caf8f7629a4788,0xD852B4bb811E6F1f9865f3C2Ee37caFCb3EF6F8E,jealous liberty hamster young letter decrease dumb crumble tragic crop level field
0x5dc35be3869964474f9d5999ad369ee95808371a0cf9e32c7426c58f763b65e8,0xaB54e222AcFC273c6A72754B707E9EA6fe66f2F4,balcony sudden raven cliff badge monster baby action start almost student monkey
0x48167953d69aa3c0de6cd3ed8a99b99268310de9b2bc6475d89e87edd2a9a40a,0x5E2f316032428F55E81EbeBf8763cC3f5D16d741,fly giraffe speed text hero divide dismiss cry face wife sentence manage
0x990a6d455a5ac7673d08290c427b12200e195fec5839b521f19924471d57795e,0x4155F1a013EEeAf6aa5160FbA680028eC8d88B71,script lesson artwork chef assault citizen dragon rate apology lady beach bus
0xd477ea8d4d9674991a51f87b5f3f67a995f57c3212c8998203371f2023b9042d,0xc89B6d85116163facE8EBF8AC3349C5BE42f7C95,brother later document primary happy exile acid tail galaxy bike beauty original
0x9b56c7ef2423b2fa39ade9b4ffd1b4941685a5a5e5074ea2b5af53473b9b01ac,0xDc667dF8B05ed4489AbF96404dE251308115Ab14,quick man nominee lazy spend solution situate antique piano history snack neck
0x04e53ba1f68dcf69b8df1c56cd76d5a57e211cec4a87e52bf68e0f7d1ae9d485,0x207a4f58d21fC9574F860dEd4e27C1611cF35312,impulse bicycle auction alarm potato vocal novel rely burden submit infant top
0x57206af7811847ecab6f473e3084c36b9eba6e88e31f4fc9b48fbeb51af69b3a,0xf9aF4471aFFdEFB0274f69654916626F83DaA9BC,conduct copy verb purpose monitor siege enable drip slender during polar grape
0x1ff04bfa89bb3c8c6f8771f3bf43b4c2d6a57583a9578e8c43ede502e76533c8,0x7442C6f15232336Eb99DA9828dcbf31BC17e8039,digital hat target harbor question because prize omit disease spy rare boost
0x366985e16f130fb0010d920b5c4a378c700ffd64d66a065733b24b46075caef3,0x4e3C5c55fEf77E0cd9bb4600BCAAF726AdC97AF3,world trash exist news scheme thrive erosion merry mandate spirit cigar damp
0x78064e4ab84462c61ca5b8f08249c913f79b2ca6718b4a5c5691472236253cd6,0x5f00447f40952e77f88f604E47732b2Aea35C5c9,budget start huge alien clap friend cable pull speed acquire life warrior
0x19c8935555f4f167e8a78c9b38f1420b3a546a5f4e3c87d1bb3dd05e0675269e,0x2208Cfe6781c532551230293D6626a2Aeb46c666,sock swing file blast urge jar hub govern ten shield matrix patch
0x6b9db649da955b09c342573cf242ba3ed5b091811ee89cba33443e71b77b391e,0xCe6bA5531fB36dDfdA39e955FC23960Fa26C3E90,scheme ask art clinic crawl shoulder cotton lucky common hen admit moon
0xb0f410e4222727414c6331363176fe148b4da770effc6ec72da071ddf5682109,0x2647be63fdeb6a898150c3608388807ebac6DC3A,reflect parent library unit code motion cousin deal swarm control desert action
0xbe4fda839fcf700e176bee04919d1d8ed5127616e0ec4589451ca83f8cdd99df,0xDae79dc156486a744b577026E769C439699A79E1,disease wisdom black reward hedgehog february eye access music conduct practice dentist
0x978dd6c817e1a15a76705485052544d31a8441364a46974a74fbb5f78b291fc1,0xb971EBa0803e1e3dDab56af1C0141d31078CdE91,marriage hedgehog stem amazing library case peanut ugly kind banana roast sad
0x42627b63aeb7028db1ecccf8d7a4ac16a564259ec8e4bee294550655a68d9c1e,0x12F4b6C1504659de129D91978d9c4e792ec31dB5,bleak smoke sauce buyer drive impact regret pluck morning behave glance vanish
0xcee5b320a3f5e082609643cba84fa44ae480689dd0ee8bc0f2009562d6b6c9cf,0x67B7399C5d305c1cf3E9Fb2eADe3e5ad71e05101,tuna subject city flavor nasty predict manage tragic stamp crystal suspect struggle
0xd8ebf1bc7a8a20297b34683e27cffb81de7e7bb9040142475c00de487d2d2586,0x23c2393c12BA1F2469696Ca578Bc10060e5A11a0,else square face heavy series lake debate alpha couch card salon answer
0x7cd82b497811829af7bd409b47c0dac6771e6a9e1f25d98febd6c815745163e4,0xF474395b95e4C49b455D2826Df42746AeB071DcA,among beef eager diesel casual must legal electric option appear become play
0x78efb43ed82e1e4d2325752e0e67a478001f2ecb2858d8c09ec49ffb2ef21bdd,0xD15BD4aae133eB23dc2Efd54D51742fB78004BC6,use since orient orphan palace breeze decrease caution wheel nut until annual
0x445f159f30c0b2201c1cfe560a4f2fb419d78530397da0de809dee1664c96551,0xbD34998585201C818E95Cb732a65dAd27dCf78E3,clever glance word flavor movie laptop jaguar smoke cotton cause arch cream
0xdd4847b7af0b08bbe61138a3e330f44796b50d1acd7485fd3c01ccd89cdceac0,0x0c35377E03B8DD3A01CB9186c1B35a2BEaF3ffb1,spell doctor refuse sadness artist equal assist law system silly yard exotic
0xe88c732fc519e6a0668c0fde73502d8562bd5ca306d3ab1745d197bb9d537331,0xf98f357A154df494CAe9d61a5F5dC1044FFc8bee,oxygen absent prize honey weekend hockey jungle slide area gate transfer gift
0xcf682fd84fb6315548841dc61c9aaa72c15b0da4ebc59506463b6460b61df465,0x2750Ca773D71ce6d5Cd6Ee3127a05fF229383399,evidence method humor candy disease gate acoustic session reduce health slim craft
0x2ea05ac383116917e5edfc1d41ed834509ba515bf0cda7f645b5d5f3f0c08858,0x1037D00DF3840b39E95289A8E65d2C6DbB7Ccd23,equip casino truth lottery stove captain jelly force first picnic public correct
0x0a2dd4db3bf6f912080b7dbb5c857f478ab84c1d1ed9eaf754e37eee689102f3,0x889564bA3Cc0680580699A507607cDf090AC4653,warfare need involve debris flower fold notice crater trial develop stumble anxiety
0x91f99f2d1dad9645e18dab6a9877d1915e55c6cf86210ed149aeb67d61b63ff3,0x4271C9a49aaC0570e63989143B4e57e44BC1ceD5,awkward vivid frown wood inch pistol company vacuum track claw combine bridge
0xfeb884df03da1fdd45a7143c3564cbf2f80a3660ab5e8a81d53609ce2653e998,0x73c1B9857B04CeFEA78DDfD8b175DD12dF91DF88,begin poem sunny dwarf claw wire urban catch excess safe story evoke
0xca433b215b095087a21ceca9942598c67b30fe0c87c131a72948336a90c6ce2e,0xfE27e0E0B268FFb532c00BBEE660F5B35F29B3B8,suspect blouse toe yard wage wash taste protect mimic good current water
0x39852db7833aa437c304ea3685582275b7119aac0d0e8ce4a62a720ec84aad43,0xB5f7546d7E75907B84dC7d5a961c999F4f4594BB,dry canoe foil welcome vacuum select stumble year debris broom soda foster
0xe5cd88bffcc2ad371b436401198e7ec20ff169167df8e1e51e9fe1590af1932c,0xB2A6c22bE6F8bE65B28C569e4E553C6F7048ccD3,soft blood mixture stairs rival doll aisle unique enhance race broccoli proud
0xf9841b7e63c91deda1b27b194f8537b20988ec01114540245665d5009ea5470b,0x3DD5cE5e9423Ba250e2C25FC7A9dB49732b07a25,sphere hair virtual romance pull rescue farm judge title rule wear answer
0xa3563397444875e0dd938bab35f4d0c2df38f89a24da1146ea5f9acdca02c02f,0x11FB93FCc519040C3a1712BAEA30D21dA7C01047,sponsor around find hidden snake panic hobby myself million enough attack leopard
0x58ba0c31d2fedea2b553fa3d126db32e5c18002dfdeae3be93c4303e50ad8a72,0x4745bB24c6332b437496993d3A0723eE90A1C6dE,cycle urge payment collect sell fat day check marine push edit lift
0x51a2fc16eb73e05081a25f849e9d624364c06bcca4dbb89194d928dffe19163b,0x4766f27F682c65f095d22505c51C63874A4E5cb1,radar salmon chapter castle relief ill balcony hover abuse broken undo prosper
0x54842a81c399d96b1713a0132bc4b7d55789eb34eb5e177a7bd04a506faa4309,0xBFA755c89399C0179FA659224c5FF8f9CC690163,spy ugly entry saddle practice wheat gadget raise kite delay gun height
0x3a845126cd6231e912cbc3ea03003ce562ac3799635538950d73633ade5c1243,0xc6C4fE71aA631260Ddc97326375d2C0e64032980,cycle royal start erosion voice swap pink lottery opera prepare company worth
0xdff82f4d7fcf54ce353336d510c173afd100ffcf42b433adb2944d99b782c00d,0x6ab457e443aD5c6674Ea94778B8d5016038aA45c,cargo fame wall fresh uncover giraffe manage raw gas mouse egg february
0xb519365806d76f125097ba8aed55b445c2bc5d354277ba826555cf3c380baa1a,0x7339f3b1a88306f8440CeA496F467bF66cF4Cc72,child exercise move silk toilet cliff topple wrist evidence proud scheme soda
0x4469f976b5ff170becf03c70db84032ab6695ab94eefec453100ad9fe2da0f53,0x7efC3348374615153C815BeE13B04bfCE08aF16a,spoil response equip kidney gift gorilla absorb own smart forest again belt
0xd2697e09282083408914d3ff3b73ca2da3df9919bc3a39ee3ed1a1825ac14be0,0x9970fFf0Af57a5dE36d05f4D9A398DEa525C2eB4,face glide change ribbon friend couple romance truth pair ten kind used
0x826b547f9ed2ab513e38b6289d80ff7a6fadb64e669c5a33eb2290cb8a2590e1,0xc4c90692EBD31f5070816eC7c150d455708d9836,divorce reunion display diesel web glide sense cheese card offer robust hammer
0xf935af1236c94110a55927c256000526eac8cca935f9d379677e738fb03d5f58,0xe1eD0A5822A28Ea1271F6834b398503402922E01,maple scatter nose two ski give knock vacuum fold note pride select
0xdbb88de50553d1316ddf4d2774df3da8bfe0639dc6999b892d0e94d148e30024,0xA2400330662c012c9Fbb827B0f75c40B2a75D1C2,dinner submit mechanic bind vessel boy strike extra vocal wish expect diary
0xf86b406eae6d862c805dce69152caaf357a8084b4b512125637331e9c570b822,0x9ac6062c162F8bfE24e623BAa32abd5166Acd554,flower bundle pen sort poet resemble alley artist convince ribbon banner bleak
0x1f8e28563a750f25aca7454787e09e4a4b4d8d31eb568fdddf649008ca98f338,0xC7aa56070f6495eD64a9643815910B81c0405894,misery word then crew banner claw million wet salt spring exact vague
0xe1b3172d0208d82a8faf86fd48d5c9fea02ee371321dad73a11debe222962142,0x749bA236Bd9593B871257EDA1F85080B1aAca8DB,old battle swim burst patrol rather siren neither grant fade wash pelican
0xe8c0c73c8f13c18c18802a5c120c2a81f97332b2a3920fe630d2a117c9a13465,0xaf2019e82aB207718a7723e5D3B2AdEa265aC615,embark tourist waste correct lens bicycle giant similar doll help spy similar
0x27c0ce6a239593870be1382682c6c9a52c99c8c2cfcb5602122d9c72be977850,0xEb154107FedCFA9696328477054f1914016B1336,wash diagram asthma know camera tribe over plunge wine visual cargo sunny
0xf76da7a14ee458ed951acaffbbfcc693bb0ef3dceb5dba18ec024a131c9d9876,0x70FaAC1885915EbE9bFcB413bCb1C7b9C9C9E87E,blade okay nation device base grocery reject month knife bunker detect discover
0x047cb13ba850392150aed8791926d3ae95674c960559616a89cf2ea6676cc61b,0xEeA9e3a620283dd476650b8C8E3079e8F027AAB6,together print polar exotic adapt loop wheat crisp planet disease school protect
0xa4a64695f4d300ea10e0f66b14791e3276c01f6ced51af88e1b3004eeab35e2e,0x9Baf2346a8EfbC8d0bcD39648399A24b25C7F15e,visa alien absurd evoke clarify artwork tomorrow vague flock connect use pave
0xd4fdf214177bb19ea19339b0b365ab76dc8d334b967ed1869c02590a9eab31bc,0x7271DD9D366Ec4176Ea3000CA1fc89134D1D709e,pluck inquiry truly edge benefit move column lesson core truck case recycle
0x0a939b35294f4cb515f9f5de953fc6c84f82bf06075ceef16fb9e084cfc8f407,0xdd14a0DdFA0338C0b77199d1E9CAe7bbB699D40A,field model kingdom brave avoid okay pipe roof sand enroll actual deputy
0xca874548b436325c7a7e88d523ac11f7f405a47489b282fd95ed2d41f83150ec,0x6fcb636044b1215Be0947610061116DE5cf92DB2,into minute shield grocery hint country sense permit tobacco punch tennis soup
0xd2623e09102d6e8008a61fff53542b1b852250f023d00d6e4ed905239670eadf,0x88D2E103Ab91BEA21Dc34bAa1336FC0e0B259099,target stumble wire thumb trust receive sorry pause canyon bottom fit right
0xffb4e9f5c0eec989d24a8cf48e06cdfcfd2435010082c13f20ae5c592a668882,0x57F86c3916D5Ca029647b3ACd47D9bC6c0943DE8,mixture belt lucky much acoustic behave large solve shield error repair lion
0x0595a68cf3b85ec23f374b69eadc01decaa94c5873b4b8d1e98b9f5b1a4ebb15,0xeCE13Ba4b1CF3981A39908AA00f5D0Ff9b1Aa85f,cattle address note cargo social reject tone spare verify sphere spirit submit
0x9741fa6d8d26a7225b7c75f26014b1bfb2954edeb80259e19434e8a42241ee47,0x1502bC2faF6219e357561b38c31cC8C6F50eb5A7,vital omit farm session attend lobster bonus regular tenant please design coral
0x08cf4b20ebf371f81176fbe5b0530b78f562b24929fa0cf31d9c1a8dece106a4,0x5458A3F996006EFfD49c80F04e910d335e106557,buffalo lonely script melody solid cruel logic vintage aspect library treat scheme
0x2cd715eb2fe20a61cfa5dc10467e93b304f7ffcf26a304d1d7ee7fab0faa5f20,0x3D10dA251A1D63644788EeC4f43cC5E5a79f4a5a,bread cereal stay million clean shrimp profit glow crazy blossom pistol accident
0x8bafacb40bd8cc2de026654910ca626698e1e78818192ddbbcdbcb358ada3687,0xe1E0e0E40D13705E52cC1F8724Ca7dB37741C6F3,priority poverty visa burst indicate window consider want term inflict discover harvest
0xd2823f95ad6961ed34b40e1774b8795ba4eb8cf132b60bf6acb099893c1d7c2b,0x9233e1E9383717fb7a4D9784d5E6385A2eBeA555,wool connect lemon sweet bitter bicycle stereo baby pink ecology cake shiver
0x222557255156bb4edccb55dc45933a9de41ca709773d451def63cd320fbdcdbf,0x008f099DA6F38752fFeeef6Df455Eb1F75fC166e,spray attack battle thumb ring rhythm man squeeze before then hammer pause
0x608c2d0f6a5ae501c5c17bad1e8e072b50cdc17b1ade73c6eb0a4b2158e6cdca,0xDDEe33308B0B041a4e0b25c9D3F275AA777f95bf,vapor keen board gather mom milk relax hold salon spider pledge boring
0x491688bc4ce491733b38121001ffc222d1535f2f84e9e4d27684905b93b319df,0xfa38c62DB15F18E2f48cb79f89577BF544e63D9b,brief win clump meadow differ large width nerve key learn genre wasp
0x212e3a93a7e35c7a0c7d6f6c627ac261300f9fabe7755b260c0cfc2aaa9f283d,0x4d9597B91184Ddd287Fe26736bDdd50030777300,boring gate veteran eagle wink jazz evidence alter axis runway slogan promote
0x204b8107244829ad417a2a81fe8aae4334996527da630537b76a39e69f53122f,0x36A1ccf2521dA7B09951dd6055A88EEB67307057,also chair impose way garage genre real nature suit zero settle test
0x5ca089746790a4baa40184efc63b417fe67a8a9c77b2eb9cb1e48a93773fe9d9,0xbf6b48C4AA6b52a4bd3E0B65502B8dBeE861C9F7,junior always control unknown bean oblige unaware absurd miss blame head feature
0xdac5d3b15a48f4e061b992327a3274a859b557bc7f66d37fbe1db81eebc28eca,0xc4869112F4FD5bc8ae5147135846D02D9f3571d5,own sponsor small video veteran situate image pottery medal olympic treat thought
0x2c4f6584a2e97f28251840b31c498b9b0eb8a947d7b8bb649e34b6f371563587,0xCC78434A1967d7f9032657488e61eb0530cD90c7,kind style cement kingdom icon stable elegant portion portion surface snack vicious
0xe7272b56c8550753ad302bfcb2a9bcb035f9ca7b6ad7c42f6fffc84ba744f259,0x79015A413A03e1F663EAD4137C2F15656a6cb9AF,that oppose clinic ghost giggle tonight marriage lottery scrap lift safe toss
0x188a65240088cb01f0cf2da61883361b49fdf9ba5cef44cb9dc354d8975089ce,0x2100be70051fDCdAFa633d358cF09ec049C017E5,scissors aerobic blame blast pistol carpet draft stone day build degree finger
0x2ce474de218d8e5995c347ab8706eb90d3ccfcf577112290972fac7991f73e5f,0x94a79b20Ca1feE7D3676f9bEC66F36CDD6620308,draft shadow cube march fiction observe patient vote derive swear infant cactus
0x55569e4d41b39a128776754c4c4c771020b19eafaf398f3369e3e406bea5a399,0xf3DD441052188DBDD4399480F568Fc81ecc81362,swing stairs basic draw truck unable obey wrong gossip barrel jar treat
0xeb28f82af64319a20ec2befa6aa4d9a316ae2f9e3d9b47144cf472cf900d2796,0x8C1f28D707cc36C1Af7c6bc6Bb201A22E560cc52,latin north point same prize broccoli ginger game animal inmate twice spawn
0xbc6cab5802ca442015f9ff8a50802b7cdb50c43847f68dbda4f795039446a435,0xbc1b1342Ba05249eAf893ECA79308F0abB95E351,attack festival physical fold belt siren hero pony work bright tortoise use
0x63f1e9c5c2563471769f2ad33506539e4742629c7d073a170f5f6f1da61a6f7d,0xa4903ef56283fFb0DEF8273E374E59438c5d1715,poverty frost tilt art noble replace sad area orient bunker divert dry
0x0cf7be1875eaa6d82494bafd2261fbde47eced5aa597eeca12ea3e5d9d6499d4,0x115BE008546Aa727744d53c583392C2303062855,possible oval weasel comic congress taxi local strategy dice still chaos priority
0xbb4f91163e803147ee862555bde5ff633a0b7d66193693bcfaf0e9c13c928c51,0xa07C61F012F56A5e9fC61ab6C82b87c1C1128693,green rude flat offer idle alley hedgehog copy juice horn tennis mammal
0x6a3cd8a870ed9615cc5738c001f30c373acf9c4ea849e6fab7b3cf80a01d4acd,0xdDAefaAaB157dC0FAf3Faae66a2BA41E6F22F345,mosquito vibrant habit shoe retreat olympic strike combine tooth ask wild fox
0x4afae7b33d9c7cf39fb2e0e8b06e825375cbb1859e9cb5c2dbd4cab3fd09efa4,0xE83B8E29431Fd846ba35C8c981800c5112eaE314,label despair seat device lion culture item borrow source oak admit toe
0x6e50df55c098f967a4aeb2ba13b8d1f2ef8c0cb5e3f85ce8f7f4d55994f19c00,0xe7456249e12d9BEf66d121F241b488261aB3e562,popular guitar shrug piece mixture clay float panel despair lunch muscle stage
0xd144d42ac2a52a2766971646670fc5d36335e443ed40b0c0d35f298cb6f77cb7,0xe365b24916D20614900E3e11704D399Fb667dA7b,virtual ribbon news limit always attend salon sport penalty pilot gown bunker
0x61152cc935bf5232933bb927fe80e477bad35c47f5142906a716856163e7830f,0x438b440E292F2ADC59ca9E21d5e2Af886bC836fc,sketch joy unlock divide field few deposit weekend keen rifle meadow length
0xd07856349c5bb5050c3779b9e0b05411b68b4ef178bda373d7359dd8454eabff,0x45e5124a941c8849fFc371832F77141a0E355f8D,success squirrel quit vintage goat little play nephew coach body bicycle physical
0xf285135a87cfbf8bb8abec1661f491ad85a8025472255513b78a53c5e0d7389b,0x464385EaCc4Be093df12eCd6B4b630De07373205,mango sword end bean head fence enlist report beach appear drum negative
