PrivateKey,Address,Mnemonic
0x131bdccad19b0b7687678abb2f6ed75f8264966c65a154cc7075c894165add0f,0xC1BC952fb9f729d47b17A883351722aD16fF9F29,snake smooth screen orbit hole strategy roast baby violin draw exercise piece
0xdeddaad2abac2a9a6e43ede91a04ff95d2a2040df7b5aa527451dc6b84aee662,0x7F0aEeC57Fa8E741B593eC543B06883a99408Dd4,combine total melt mail area panda resource fiction awake boring barely west
0x70a31465f1d9370186874f5cc6cfc09a859d79852a2d4d274e6d17bea14553fc,0x3E27e18A4296EDAFbBF82CfA02B5153e9Ee41eff,unaware since cat rough year inhale decade clip risk pill deal claw
0xe5c7ec54676470c9890c266bb17de13b054aab21b1398b15f0548c8765931177,0x6A3C05EF18CC87c16c665Fcc07a97B2F28871aC1,genre identify unfold awful plate shell drop become invest jacket reject razor
0x12972eec6e0f1eb95beeb2c314343ab2955b474a354909080f780e25de0b9bcf,0x21f02aFC1230fbd4b09A88F3647B07E73Dc903d1,fiber parent lyrics visual apology butter caught ivory approve inject oppose pottery
0xe049969dac56e3fabf83b80b46b3f73f00ed62166879f8de9b5ca1abe0d81f29,0x1A0EE13A2f1d9a003d45b4f37D4801385736922c,gadget near occur unhappy response airport trust change chunk wrist avoid witness
0x50f1c935c74fdc220a1ce1343abd6503d7dd9b7c53d6406deb9890f5621a76fa,0x9872e02097B0B6AFC220C269835977fB3BF9cA8b,burst sure toward inject educate favorite pluck course cluster pride climb maximum
0x742de804ea59b79c477284c25db3d829df18c70e300bb58096fa0ccbc4fd46ca,0xf82F7205FA945a07D56A514d0e7f54ECFd225E64,spare stove best stable tube build lift round hurdle uphold general exist
0xc64f1274244b170bf570975964405006582a5c53596e7cc11f4559c3005a72e0,0x71bb9025e7B90549E3376d0D07C2d8295B81aaC7,remind topple chalk shoot shove actor merry vendor jungle deny hobby neglect
0x648a9bef0f26291bf39a63d3d06cab9fc34b1eb0a20f9f2add7fea3991299005,0x6a51a8b1885aD7C352E604BEC9322f1B2b9bB484,awesome cloth poverty champion husband fix guilt neglect anxiety budget pipe unveil
0x241ce52ea0bdd122b4453aa464b3eaadc4e7adf038aa23bd65b61924ff85cdf9,0xBC172b81Eb95536F1271399E5efe0a611372fd50,frost win glad faculty book bless token bridge jungle artwork evolve seminar
0x04fc5d0a062b0893d483317b27b13a4bd68be16041a6c93a60a53b272720d056,0x962254D3ea5e63D09aA222d5a098b39C02Dd0fdE,jar video trust speak faith fix pepper tape banana produce calm acid
0xb7d0a45a3990f38f5cec23a06943969b329394d2b8da543719ed743973b33779,0x6102eabEFd4887f268714cF8FCAE62e45Fce1B64,neck know enact once income benefit trust capital easy tribe disease soul
0x1c981785a9e9fca3863e5e728328506f10189b451c680d4f15aefaaa13f6d7e2,0xe75cA71190Bb5afead7861329ca018C15656A22d,cup brick track pioneer roof magic ribbon glove caught tenant stable dragon
0xf68826e1612b9fda2a62bfb2ae525ed3b4835e0b9a290772d1fe133b70ec390c,0x517257C6Cf416D81BC35907B0f88Ef29E80E83f5,hamster predict entry galaxy asthma inmate eyebrow bonus actual machine amused tunnel
0xb9ef13c495ece08b009249b2ccd08d715a6ffc9df80db1790ac86b55f9f02123,0xf9DF83C9D999fAe75B7ee949985b6f31E4928E81,vendor pact sauce baby exile welcome icon enact sail assault river invest
0x4dcfd811ea5c117861332e7d993fcc825c4b82c2d677d4c161cc5eac044bab75,0xa82D8534D965c7B5404326f25413737000AFFF6C,egg midnight matter rhythm sausage message cupboard knock garage bulb custom mention
0x3940a29d4f240fd5ae2987449676aa3061706c9f6ca28a201e0eb5029bcf7bf5,0x23431c04169a621A50C7F952Fd13498f7ABa8E6c,game adapt accident rice dolphin doll car certain pioneer metal hidden toy
0x2baaf03dc96d267fcd5b513c9f687b1e093ec054025f89707e7b340dd1b6c0b5,0xedaaA5a05187311C559806C29F1CDc3eD695a9f6,fossil broken clown dance popular season juice shadow leaf near cave pave
0x571526a0ee3ba1bd0d9e80f06701f9673f99fb3399fd09d333751a206c7d1a3f,0x0F782499E70094e8A5A3d699B4eDA123FdE15880,pottery riot puzzle damage slide host load produce cigar citizen endless cake
0x8831618e703816c7ec752458042c18a2164f4a5f97c82cfa10db50da4abf7770,0x3415c53E39B5aB5e9309a6194d341842b00F0beb,trash industry muscle legal fiction keep oppose choice pyramid cactus tower travel
0x8624c055675418d65d5287a247fc7dee3964f6bb1a89764674bdbb5f6e54da22,0x05bEdeBa937F712421a36F240B405cCBed4846bE,notable strategy friend pledge equal method jazz seat umbrella yard impulse open
0xff8a53e031ab6f4a633a53c022ff83f905a5da54e70fad0450f3290c51c17a24,0x0ed9678b08483b28c7ec95139bd176f1E577ac80,piece crash mimic raven inquiry capable hazard become unfair umbrella tennis bomb
0x5a630778bdeae8216212bd30d3da4a5384c6a394bc765e7e35a5dd9f88206cec,0xd45B8c177ac6c0935671AAE6f58376Cacf0f162a,gather knee economy stable tooth wing range certain among ill iron copper
0xd19e64c7a5e4bded97b497e8099c2e6bf0a761625710fee336be19fd58c76671,0x3F8b2553D79F59eaCcf886723c1080FcA75Ad3e6,file miracle rubber uncover check reason banana wrong talk raven shrimp surround
0xd460180482af58107fb58eb22df6347cdbdc5508f76712b539cf2526d3c40bea,0xc1b17CC0eD3E4eA9f9507fAa07ADA2d5dFAd2baa,arrive gas work advance jewel expect merry result arrive wreck eternal gaze
0x8fd0d662992caf3f7064dcb1c891057f9f2cec9a4508fa6263a9a461cd6b53b2,0x5e756d4AdafceD136E40B0F7d9b93FD6F100e3D1,key metal casino ill pause sister identify balance valve creek morning lake
0xe1937ec6103ad81910ededea2cfa066f1c9aedea94eb53e3b71af4843fb424b0,0x902342f7944953d1d3bBcE26563921D3E17156D6,search shift glory crystal sting eternal science pledge notable wrap bird where
0x90ba3306bf8f6c7b18518ccfa256147c9320a12a0677c3be009b0c313085cf30,0xAB2f4ee1b0d7a6f6D9af761A13c1Bdf63756d736,layer rival divorce oil assume occur fire carbon argue win offer attend
0x498ac8fdc23faba2afee4dfba06ab22a9235d1555ca93571280b646375961142,0x120aF089D97c751da9FbFEc3229085Fe5fcB7E22,kingdom moral what vacant virus trouble green history young fix lake tape
0x95854e5d9e9c31bb8328051c315756007c9b247000b62a4688913d3320540620,0xCCE149CDC64564BF846e0349a7a0C77D9895D1ee,bronze dwarf sweet slide sausage proud home tiny upset ship pear focus
0x9ace26b879fde3ab49455515d640d161b0bf350a9d114eba669f4aa1e213a0c2,0x35656C44273636060F4bf4FAaF93FcE55E62e1cb,motion great dirt ride gravity club project riot wash panic inch actual
0x71e255a607b345dd80a402b971f1138b3198563e5178e672acfc5725b6046281,0x91bd9c5125d7064FA07404EF2c6dDDB906AD3476,bird warrior essence situate inhale chuckle rival seven second start lock useful
0x085f81177856be3f5f78eb19e0e88d5b31a5dd1a997c777be9cae28a46efb126,0x20914fa93049e74152208335DDb2e284a80DF82B,pulse donate party flush night lift account drama mechanic depart dust warfare
0xdc674cedf7e8bb109f4dc0104506263e42cff9c00a835a8b43e9551401821741,0xA3399b012C4Cc4e03053150133E163Cff4F5079E,dance gravity teach decrease fiscal service effort diary sphere ghost occur whip
0x590bcb8627b12e53659624188a3b40b6fc0d43076b345a910ad19570da753bd1,0x004A45eC0A93947f62E787BEe14FC0E42758Be75,grow fetch cherry wall skate search aim sock long purchase such scheme
0x3f468e10df9a0423ca7869cf26cd2cf67537b1fecb59e04d7a752d41bc968fd4,0xA5D7b58F0532199DdF0183580e34078a5e759bF2,climb feel ramp brief utility tool absorb team breeze meat picnic camera
0x17773de8d861c6d5ca6e507fb758c150c15aa33d17bdc18de0c4843f29db6c13,0x226891e1D1b11Be1004b4055e46e80dDbaBAED63,card bamboo nasty gain govern crane jacket loan observe parent voyage nation
0x5edc4288a8827b7386a43a02a5efc98cee68fd74e920a09995df2978937fa1e3,0xA13eeE3558aacB78d094f1fca42677cc79184524,monkey bullet husband warfare arch check imitate royal smile deer exhaust stairs
0xc43a27a746fb0a982745f7b7c465d80bffdbc03891107e68bc610331a58b29cc,0xEC179B014c601ff531C85053F51f66403E8762Ec,eight pelican verb canyon seven review copper donate shield inquiry marble syrup
0x3ce012bfa2e264415630f8b0b8cf9ac13e7531f4e343cd9b5ffea01402637a5c,0xA0E8cA2C9769cEdD83FE80EA72065f6E613c3880,mule dice inherit note cruise resist inject swap since utility device similar
0x41f815d1078501e325362ed172c698d0d14c4f6577e61bcacbbf9743e09bde92,0xefa0a36d3B28c31525Af3Fe87041462c7610757d,cruise giggle buzz liar monkey hour tenant long page envelope still priority
0xeb18ac2b647c872e6d9ac0df35009b708886d06c791679c95a3c35f3dec11127,0xdb14a6271149e094a44753325917A7b7b69f46Da,card whale wall brick core stool afford figure shed monster actual alarm
0x3557bda8cb36795f1f4826768551e059dd46743be705d06a1c61af3fb4ac3a74,0x0a92c275625406cbcA4624127f35F2100968bbdd,dwarf man juice wise air asthma stage useful moon apple enter world
0xe625e50a2273c0f0959a2174a56b2dcf55ffb4c1f612647fef831bdadd2d17cb,0xf1190dB99f371082a196549D0AB0d50c3a4c9D7B,wing survey neck hidden work night moral noble talent verify rigid planet
0xe14301e70f1775119f4683f1a9dd05b3bb8b6d6229a023b6fa8ca77dd19adc37,0x6D20BCD6696A094d7CEf8351Ccf7Bd541600a478,ready front wear ozone certain immune fee stomach blush giggle guilt nominee
0xe20f6ab61946e02a44f8ad0dbaa728fe6851b7e124068b9b81661de738ae6c44,0x388F57061075bB911e2f777FbF30D1dfDF630812,hard father text young pole luxury race miss fun gentle gate adapt
0x4aac1f07fa91b09e7cd759c13c1b60bda7c6a294bf5b16727d41a9d7d23ea1f3,0x25946a4d81fA92Cc27163B9367f3859Be82a374b,twice among process cushion develop mandate waste advance list raccoon select relax
0x5740ccec3e3fc35a3b3fb298204b34ab5a43f819ec684263f0fb5295086686e8,0x4284652F6fB27FBB27925a934d544328C1E37a7A,rib blossom palm oppose estate mean double poem humble lion tide cluster
0x0f5f8e7e7b0e4222f2dd08515d19afb24da2b00230df2e88d0da2d3c1d14fd30,0xA2CefF315246ab2A4E002197D1F9364c8A809DAE,trumpet pause thing govern vintage salon fiber dial trap slogan devote hint
0xa017ff43dfdb7b27de9da6e5536de9294804c9d5f5b419e31cb1b7e8f8a441da,0xda8ba82Ab5c22cedECE6615EC9315227519DC06b,useful knee make clap caution unique finger shaft horror tank glass sea
0x2b42003ca9e16e2221c5131b8469cbb2f2f7e9f10b9f638aacf7d7e9fe9b6e09,0xc1b99D2E231eb6f050D4186a885813E77A59Ac78,ill snow during depend afford wait dose subject water flavor rain tank
0xa0308159979206c6004b1d74c13eb3fe9ffb07404e85718fba3d74c2294bb0d9,0x7338AB0DBc1d0cE7237305FFfe8b38d4D627e6b4,habit gasp tennis rich element infant school endless vanish mango balcony ramp
0x578428d3d4afc1eaecbede24d9e66eb85f5168d95c010896ab07db413cf6b3aa,0x1af637e4a61298cBCc6E1505a41A63d057dc43b5,minute meat cereal surge liberty language order hat muffin funny flee wolf
0xc70745e9c7ec69e46905d6e24573171d0cc4ec3c0c93909c5f78bcb7919b97b6,0xF6183772E260cC7d2A76E344b7E4dCfdd61DB271,pipe peace denial hard taxi column fork pull tell junk giraffe media
0x1a9f469faedc142634fd07fa20e3dc2c821cd80bb75250238a2537ce9ac35e56,0xa65aFb5c4fDFBc485EF6AA1CCa40511d91610903,build whale need curtain loud second begin end public solid split van
0x47cfbf5bfe1d72deab4d54827d83daf59a8fa7d488567b255fd13ddbcd5ded5d,0x18aD81019Fd48BD40D1f555F1F8b54850Bdf8b09,normal barrel crash book produce jazz cloth subway equip foil rigid object
0x355e343450de045d00b9acaf17699cc11504ffffa3b0de8c096296413f51702a,0xcCA03bfB036F976e19bce10792905C8A979C3C85,net vanish state sun indoor gain chase educate absent decide echo mother
0xfde4d3d6f4ccb11eec582e58ef3e600ba5a85a1f6ae685bdccd2c42bd9644f93,0xB5A6910F3Ff80929Df7554Bceb3D2eD0f643a6ea,captain orchard energy provide catalog sign excite use choice spare truth verify
0x53cb80b06cde73b949bba7ead85557f2bd3631d79ed9ddc2efd019175372a241,0x3983A9A4306B4fa105F38bB7441846a498438E91,view crane shiver shoulder federal crucial shove wing light dumb toe speak
0x14b6e25cf75667d4a0116ae2e41a276bb2be0baab8a964a8e103e54401ea814d,0xbc087F61584e68B83110eD1eB3f697307c6dbf66,acid green bar comic venture diet carpet slender powder draft swallow clap
0xdb7c4107dbd4fa62e454e30b70d61fe2ec879504de636447fc416436d0778ef2,0x0eF6276c6465f06889f1F13Fe8C27754DBEff658,road spatial illegal frame original antique predict bamboo purpose museum plastic power
0xa6478da90669a5e1588b8f407869830ad24b4b460dae510f347f8856538f93b1,0xDF3240B18158F8d9d352F864a3401438BB2D0A54,logic ribbon sleep inform guilt east daughter modify quiz pattern join cat
0x817e8e9a223d0e82ec3133f78e71fae194061fd3f917a46733423af6986b882f,0x7D7D5bf4051fD13bB5910863Be48a2B182184205,spoon soft idle valley opera swamp dance stairs increase ten flower february
0x0e6f74791093e2c56a4c18e7c80e17010e083a2f0477908d96886982ac28e208,0xdAc6CDAc326bC3ebF3D84aD1c1a350DE7E60fB37,project volcano liar stadium boil rally luggage run prosper error lock soup
0xad42c636eb5a129e9c8d194d7fbddaa5208c36d381179de4688593f52396f0fe,0xC363332c69A51791fCcC4Bcf89B4A7c158E87BC3,catch vintage orient security human defy field merry exclude caught walk joke
0xd5f350874152208957df006dfefa7a475ab6fac04086731c95112b0d9395d735,0x23c09D013Aa014140a6fB1F13Da079d9267c0273,begin future draw monitor gasp episode between secret sea common target forum
0x928c90406361579424437cdb001ec50ddf99d54391f05addb50367fdc4fd9ef0,0x0579c5696534A24Ac46EB058f01D953e172F160e,march exact buddy eager excuse knock spatial water earth garden hour protect
0x5f348e23834565edd883d9635a2887c7d59774d85ccb7c021341c28e2f0fcd67,0xa628e5b8E10Ddb29E17C94c2f373d8825B04811a,innocent label hurry train virus fiction gesture saddle worry jealous voyage circle
0x1f4cf76cad13d40f0f7625504899f26741614f537747931eff0ec9ba654b43d5,0x80BA658A8Ed5e1f6674578c23260A6a5FbE9CA38,moment spoil toy indoor aisle boy aunt armed survey glove print liquid
0x71a2a3c22a2452b4a483a55623059618f23c97e76c5fb5f2a89f06b40103e60a,0x219Ae5fD57A06a83023c1Ef321f4B02D9c908A60,inject enlist average olive good talk recipe attitude venue captain milk stadium
0xd1d49f4e4bad0b76edbcdf2889945f158677c9197bb7d4e1776838a1121db27e,0xE402BaE04EBC297aFa3fd61cD23f7865Eb37F87C,bring tomorrow cement cry gossip rocket fatigue furnace decorate scorpion trade wall
0x0eca0d1e5816c8e449a68d0487ba8609603faae1f3010cce025bdc4bea9510db,0xcFdf34f8882e002F2c258A090eb5Bcb78EAB6031,injury peasant tone indoor brief load move olympic ring royal shine kingdom
0x24649f0661cca108d79a090160fe72377fc1faeb49088df905609a45bcee4840,0x3A76eAeF57C8594D5d7E50DEd63c9b9322910c23,actress board verify sight term turkey snap audit humble edge armed vessel
0xfd3766dfa0f2b7a81f6cf28516241ba645b1f702cfb5b7d576adc7fcf55d6dd2,0x91C9a8e653f671250C279Ae4Ae9769aEb445B054,travel patrol illegal clean verb innocent cook auto nerve team van other
0x4b09fcde7bbd2b622ed864d8c5851531237efd8e7a1985bd03a23789335bd1f9,0x7277a4f0777E08CE33C7D47F771A89DA66CeF464,slender federal mass occur say chimney solar script fox village core crack
0xb815adaabccd35fdecfdc330702a8fa57f4f3f41117274fa04126ebfd3294f72,0xCc17f36F71ba5164a0AaF4fedc50764e969A0f9B,leader ski toddler later notable call liquid leave render snow forum chimney
0x3847a978b7613cc7fa9cd2986755cf622c76e5d0b5de827161e970836cde683c,0x7524F38C1DE83f390D78c0a29Ae11D84b3623f8c,kangaroo still topple pact object present antenna pill soul aunt profit rabbit
0x3c1f801509287069b61491094b5b38cd4a118dc633467ab587b8fc9ab4f91322,0x22bB18763Ca58A5D9cA01f1aC7EED79b44A3A186,arrive mechanic advice drama grab year car thank report private monkey walk
0xb45c5ad48c0535d3644afd4aac9d114ca4147a3e181804280c18b418808fe3a1,0x63FcAfC0e29D4B1d15363DFaaa3c538531EAD2c6,cake area believe acquire science sure punch fly ocean enhance symptom cook
0x8742e23a63f6d55b94a64f8b1205a80280a003e611a1df6a504f37acd7a7c4f5,0x68A2F0A791fdC8B483b9B56f14512Bad3f50b363,oppose team include style live suffer mystery squirrel parade mouse awesome sell
0x28e469f5b2461b0439c11435a7ab6d8fe7f239bf4d723f111ac7f754ed17f38d,0x2F9CFd06252f763419037638C6dA4C59cddf79E7,cupboard dune blur truly enjoy language find crop caught sea aunt glad
0x5f9f1954e10aae9d9bf4c970fe1e6b444913f9871f22701e95eac1bc4807c26c,0xcfe3874228B26f033ef2D0CDC4de26207F492Eea,require exercise pretty jaguar amount train rocket trophy file humor picnic elevator
0xf2503354a27b962710af774ae4f43e10d1f3fc1b875c1895b755eed5dbbe794d,0x861f3E8af10A157B48A2AA11858ee90594Ed332F,parent mirror predict turtle prevent blast option system digital upgrade chronic mix
0x74cb93e735bccad8a99400278c1217970b034f99c97bade14022a3d4b2225425,0xafEED971D6e884761a51665ABd85058D5B1aE284,spray again spy area stuff insane lawn camp ahead faint monkey lion
0xccd17a32c2472eccebe4185a420547164e0857957bb28ea73cee2c4a748907b5,0x79846Db34380BBbd0cf6c1FC4fc9578827c5816C,lake thing addict harvest entry hello maple fun danger rally hospital burden
0x0b13e425f6dd3fcc112477b6fd3532eec131e4573820f9eceafef5e60d0c3e39,0x717bcb8D125a972d7F33Df5E87b12B1cE1589aEc,fluid donor portion tissue force gap escape shallow begin cushion earn night
0x6c0afbd16adcf2dae57206b6836bef7d632447451a7ea7dcccd8a7420978d09a,0x602a84126CF09Ad612084de6752094c67a3810F5,elite stage forget above cry thank crisp innocent cave inhale identify trick
0x67d78150951c6d5df865c4cfec591c6246c473f077a1b5fc33909ec9feb2f8bb,0x1e372e7A9ba1Df2EDcd56e1388cf4cF745f9eC7F,grass bar search undo initial material butter seed jeans salute virus improve
0xc2f81efd7e908a0619a84d11b10ab34133439071772d81360a416513e6041540,0x8870fDC19899aB34438f52Ed5a6479D1a7b954E1,tumble resource crack ripple use sad evoke math release behave next nerve
0x7e700a21a37860b82141d721277a5e17f1aed945b3a2c29fcd2bc5bc77977ea8,0x658A4053F3626b84fdEE7e56Ab0B58Dd64E6C943,fiscal wool weekend law foot safe balcony rubber aisle move neck romance
0x17d0aff30e1a1783db9ab499c3eb4ded038ef549279095e010b408d5a1772da7,0x2C757915F008805a13655a4F1C2Da2265f18D2FD,episode sunset glass lion bus mistake desk letter member lobster melt cup
0x96acd057252144024a2e20ea94f8247f68f6e4c114bdf8d3449a472b16e82e49,0x54305674b316f17c7b15BedAc7FD28D1481CEaB7,someone cash ethics flower alcohol plastic hybrid clay dwarf tool junk much
0x7df125f64e09de174a5cd295beb7b77817f6ca7821d9fd55b89d9736807beb88,0x8B096051be295a016042C75bCC625f8AC7E70047,hunt shallow obscure congress stomach calm flush curious regret drastic man kind
0xa9740f14f170ead8870be062e3722bd45906a7d3114f7a81b3509207e3d680ad,0xbF2A006E312c102C633F063A99692eC8DDC80035,make assist popular exotic govern still mercy domain behind click play warrior
0x8717c434efcc98762994cf9497a8795c57830079333597e9c7f47208d43a4553,0x979198515f4A4641CA080C61a90E53E07EF930Fc,harsh ugly cannon push they gallery dignity layer jealous cargo blossom bulb
0xd2325c849297135d9bcbc98beae69341aa5f06f681ef212907b089bf3b80264b,0x6cEC8969177E2D2217d5f96b4b849733e0217851,market version category doctor put mushroom maze assume cycle gap fringe lazy
0x05ed958b8095b6c683497c95681eb1f16615001a20b9a8bf73e9975c467acea5,0x86574a953e8aF91966fDee01D0c3C988Dd2319dc,friend harbor evolve answer negative lottery way civil wood spike battle traffic
0xfda13124d341864ddebc7ae250c1bfd96627a3718ae01eb5817a92fead96fcde,0xFac87b207642645a19f455B0d2575820F378c97C,property summer bounce idle cheese please culture budget merge kick trade solution
0x1ee1b6f64aba7fa6fb604f2ebeec445065c93aae9472e6ae434077ebbc789387,0xA162b7F49aFbE28Cf6542Fe649891a7693305024,used return injury camp coin regret comic blouse bring flavor picture acid
0xa2dae5cfd27e7600430e8c1053db91fa58dd4e7c985382cf5bad76bec509893a,0x6CA3C5573621Ac203158B65AA589836247c11749,random wink shine goose message journey fetch cricket thrive twelve tuition awful
0xc49fec376491a0ad00a3d7afc48834607f328ddd017a8b67d6f28152974b2db4,0x8a49b734E43e365f2242E4721525144a8Cd74F8D,boss tornado silent soccer job job glance crunch pause divorce cousin car
0x6421c99821afda2926e009d1b27c06a381775628b7af792b9c9a59a0be1d587b,0x0FB7F4021086e0c3846F0ffE3db6812A16B73747,slam spy apology insect square roof hollow off purity together stool valley
0x8ce38e63a1c9765567f3c5d5b4638b5547dbc3c877767b04ac353b73c528be41,0x1A6f4181B6D28CB8c30deCa618Dca5977BF552c3,paper false parade fame antenna piano few extend wet flock dream subject
0x9e30a4fb57182be22aa0f588c389f30b1f63a64bd937a6f7eebc898078bb9bb4,0xC298A40EeE8Dc795a11A39B69e11172629fd9093,bundle oil open wine grant ecology unfair fence idle divert coffee unknown
0x30b8d1fd93dda039c81407a0a54f2bc265a2a379cb553948deaff85d7700b617,0x86dBF668AfBf9335628eEb5671900E087E30177D,mass antenna essence rabbit green orient twist museum case motion trend scene
0xb06100aa96db76f1b0f56e722b6a16cc5656c5ef3238ea3608cf4bf675fdc0d7,0x8B551cCF081366d3dD48737645457B8BdC18Cc8a,fringe brick midnight question visual play green fold wreck that pill you
0xb85377962c7d90d0493849041c5ad36d80a5634526b92ffa889ece7f3bdeb13a,0x062F77648087C26AbafBa9D814Cdb5882c567082,hedgehog transfer jealous club voyage skill hub mango stand notice extra above
0x483a4895e52d3ba984234915ecce3053029f20064e2c96f0d6f65117a0f3fb8f,0x40DC3774542e6b3dc95461D5b42d5D88D651863D,actor cat state action cause kangaroo live clean elevator history clown kitchen
0x2fed3fb1ac82a106cbbe1f6be4de1da557fed9336f912a090c7a34814a9ac6d5,0x8B281873B87DED4156E06C588A06eE022A147914,cloth check thought solution bacon giraffe already toward aspect jealous lady luxury
0x024a854c14b17984617a21e37085eb9e9fb327532ecad893b8a62a2c780377ea,0xC45A6bdB8dEB2a4A57561502EC9AAE0A49D3CBA7,crystal barely bench struggle talent panic potato clip awkward zoo smart learn
0x818c0f7dc2fd28609843ce9f84cb98d9cd894325bca2c02796b9ebab5e956786,0x25827A5415B18781f12d9f32a49a3afb2bF716CE,defense doll sphere intact unique tornado live fire report response upset town
0xa8dbf5597c276f9530b3a418cc397c99e25de7e6421d8225320b61d13c35bf99,0xA093795ce99F278F7568add143A706153Fe3e41A,video goat note grocery guide nasty collect net lottery yard nation advance
0xad14c61bb3b42c42a02f63cf397527ea00b9acc91eea93510243a0a9d91231f9,0x979FFcCfcD337488C9e845049cD2a6123D8c613B,ability obey slight toast same decide index smooth puzzle remind duty umbrella
0xdf2feb8b5ebad2fff5b3db96f1dace284716cdf83348b8ef3d34d86e26406c9b,0x83D72Da418C468Cd8AC2D1b22E2f6538625256F9,saddle cluster news scale cruise grain practice april rebuild can aim bag
0xeb1c3b7a89655584c0c462ab871f834b025126ced017319c5f7a90bda0e77be1,0x593F6731A5FAed9830Efe7Dd2AA3f12755b34C6D,coconut hybrid marble frog length adjust liar pulse misery wet pluck right
0x3b7315f81215c2bd1707221464ec764740605066feee0af9164ffb00567fb5b0,0xa9cd1FB825df9F7E2e80BFAc8F78652c97A6Fff2,tilt submit fragile pigeon ancient royal base slot total vanish perfect digital
0x3c0e5ee5cda08ec2926ad223f3b5fde2077dfe427d1e86e8caa7367f523afadc,0xE91EcbFf93c676015C73AAC50599eC546a6982b5,half book gossip cart monkey then wasp lab base oven program bracket
0x7fb62d9f8a0302892488b7e146657d73d4cc98b2d974acb2d6afe0e7571c2c2e,0x5Bf80Ff13f21CbB619Fc82868BF4224c034EFDBF,fit must candy sleep genre play festival trend atom banner drill leaf
0x2d98c666761a1ff11223e24df6ffbc2685f2e850fbc737367a44c28166b1f234,0x840085aFc708034e1c562A24460755984ddA90B0,diary limit sunny ketchup good will hero story result stereo damp nice
0x2dfdf13616f0a9a8051ffaa19083f3ae4cc06bd7085b25acca22d275b4203d5c,0x01c423250cf184818Ee92caED89BB24dd95AbdD7,mosquito already position next retire invite vast behave nature danger harvest lawn
0x6c4206f864af1df173d15e719b27ddb227e66cc9abfe2138c98e8e4ee57fab83,0x3c551b5fFC920757dD34Ac3237F4cBC7FCFFe4a4,strategy cause blame thing embrace type saddle message idea shy cement super
0xc5bf44a739a6131ca9f6d6022d231b5f664e1049dd14df5f4580e74d27547a36,0x95c61986e41f136EFF8f86f48c13629cd99D4EE7,zoo this deer cook decrease child region invest prevent play border helmet
0x95dbd53d6f95b09507827f0214b21e1cda8d45be9ce66ab176fde962b729a943,0xc795273B55bb4A261080B12A85bE05A1944Afbd7,toward carpet birth pulse enlist nature token state cereal way result merge
0x51e040ae95ad6b3fce998b3e4958297706d20b1a82dbbd50b2a1e4a5d39e4b51,0x90787B58879Cf92419916aD87d916955aA104396,oppose urban ranch name nuclear oyster second hour scale adult misery trouble
0xd179fc38bb6187f3f28fdf9a69b03fe9cd16189536b4a94405fe87d5e3aa0f7b,0x294ceEFAf8Ce42125C8AEBA56D88c097ad0cfc00,glass tumble exercise cash panda police example farm egg black buzz humble
0xdee18fd1f140bc45ccc0d3cf0fdee825fc125b8b0507316cb8167d72890487ff,0x39FDa0A6933b634b69A7973c7D235837f25c9bdf,avoid chair orchard hobby scorpion grief tobacco arrow outside coast expect embody
0x6e022332b1b9523dd6aa00aa09909626dfbd363a77c43ed05f50f716d2af712e,0x4140281b0afCFa1DA4CD7F953b88972efe1f87eB,corn toe token diesel lamp weasel level used wrist cradle seed screen
0xd18285b3d8faa3a8b8328bb6051bc727e8d878a3aa1d193f4e7e0d6be5b35fc1,0x916B517757dBfc136367e60c3E685ba82aA62E31,endorse moon speak stick mandate tired bargain wage thumb game kind cloth
0xe202c3cb6b4e32fc2180acc054f1a863b88b4c01eb7eda39d6ea5b472bd2418c,0x70C316fa70547a521D723bFEc46E0206329773D7,express adapt hover luxury copy icon cram express key whale mesh morning
0x55374f5e4e92eb767967b530f7b4143a739e72bd884702252cc304562421db29,0x9D41224BD1881458E861C817918A6B6A36D8Cbe7,merit scatter false shoe can elite can decline shift dinosaur number cliff
0xd8249d7485a5163ee3dbc1182a976890aa99f7955f7cc73ad0690db1120216b1,0xE617B4b69153A0BB35FeFa7cc19eA88e437eCc32,arch armor frog lion erupt raven wide busy amused novel nut clog
0x5f0235434f3ad6f3ab4ede2be2b620a6e8d8634b87f8a5e68daba86a1cbb6c4c,0x76D48A2d683774Cc0CAB13715c086c5cf2ec1A93,crisp luxury slogan long knock surge hidden salute cloud east sail intact
0xdd65e8efa8f388a420cd8f61ba2f97dff69138efaa40e4673b4652c97e8727aa,0x96Cc9B0F00F52DDC8438bF2440DC337112402676,canal minute candy adult juice teach gym stable calm try monitor hunt
0xa7db2b6323e165459721238ed479133f2b0c113bb7a027b10414d5a5f7f64f84,0xF46746c969ec9Ec5081845b168181BE7f18504BF,silly tool enemy quote mansion cushion mean muffin hunt pitch near motor
0xd0ebae4de03648a4ee9ba3838485c86133afdf81999ddcaa428ecfa63c1bbc04,0xEE7aaee97eD8819AfD2e0DB2a86325a2353E8d09,crystal benefit govern regret acquire aerobic oppose sad erase hen subject gather
0x49d66b3df5ea0da4f4842440c91957ca6f6b2ac01b673a156607c8ad7b5a729e,0xA1E458d2967E0665F5B493a041DCcb1A0e36C007,frog desk truly body enrich sentence unfair receive menu soldier large change
0x17fcf5a15fa001bf53c56fcc93a88cd9bb2d872085efed226b91a5fc9e178855,0x78ebe9DCEF3CFfEdf3F67D78cde1E8b16D6CDf77,script breeze pistol runway sure chase rather skate wheat together correct giraffe
0xae6fff64511111e7ff7f9222b35ffacf5ad38cf374d3f7d62ced03e2c2489426,0xc537178FE468E10098D2F75479a9031623856DE4,shift hover logic lunch ankle venue young amazing wear usage filter sweet
