PrivateKey,Address,Mnemonic
0x3cc7b83ec02c91b3118bdbd2f58a2f37c1bb16028add9b74315eb98a62b6b303,0x50D72709f13E37003bFB30453e6a4C34d06b586d,solve swift office wrap sweet card father saddle inflict parrot dilemma inquiry
0x2391936f38183abbf37310352baf1d7715dbc9650c0dbf55c6bccf5654d13052,0xd191C1d33432082a9a54f2D2C91F3F3e4C74ad04,argue question direct screen sadness excess creek core crawl save recall prize
0x62192ba3bf0d53fc5af48eb569a95f962bc4ad5e3a610dc70ee0272820259883,0x84D30154aa4263AB367c1b08f576dF5F5e94D189,error parent kiss table dream desert galaxy able panther perfect nerve thunder
0x434f7c3de467c5bbc8fcaad278dc34884abe93950a01ffd3518a631a94a307ce,0x7d5c19cC1C97fE635BBD36ce2b3EDe52902e42f1,model robot orphan call garlic quality castle october possible brain reform parent
0x1d76317998f4878f86238d2755789d7e469a4de86fc27b50ea9127fcacc89a48,0xA37b2F14C86728Cecf87CCaeFe3CcC70c3872125,talent copper vicious before trigger unable vague feed answer border dry seek
0xed22424675769c7314cdd0cf242b3a4721b992e7ba11829bb7176d81a8783d69,0x278dc097900775504e06e7F12514C6CE24798Ec9,admit hammer verb taste insane believe exhibit number angle chuckle blood human
0x5bfa1ee21cc229f060b1f1e619159957ca72bdeaf5eec8a65830314989c7aded,0xa90925310c6cb3A76ABDA17bEf946cD773B0B346,lawn endless depth coffee jelly scorpion scrub pigeon poet debris helmet seed
0x4d515a99019ffb2dfeab71ee21d8e977b1c371a74e12c050da8d957efe0e8dfc,0x467616cd1C7a54D6DD545D3E17Fc5cA0cAdF24f9,pizza crystal inch river deputy urge busy habit address bunker visual dial
0xed613f0a91acc52bb106b2852858fe6325d078008310f17702c75d5e14979c41,0xB93320c0b679D499Fb928e61FbC7f3890b2B24E3,citizen smooth paper toast crucial drastic recycle bulb admit symptom donor prosper
0x484d63029c35ce2a8efd7170ad83ef879f049f07278c5e3138925bef158a10fd,0xB4f1d4A567Cbe745de5f538c519E24490214859a,hurt recall disease layer vocal casual favorite curve action blade order sick
0xd2b21fa6e4840941c7bc421b197231a7cb610f23b4c93e93e708e2b7407f2863,0x910572F21c440EAB90aEF3a24799808f12f99fAf,movie scorpion dance jungle spring tunnel stem science ivory carry fine moon
0xc9687fdc5fd7cdd4465835d8f3dbdd47b43d4335f56e3ccaf3e88596164c7bb9,0x136DB79F8846159f58eD0C697c6e6b29793Aeccc,help purpose very ask negative method scare trouble hire indoor pipe assist
0x672344c9664a5e05a3738075a89926bcbadcc624142d2df3824b4dc0d77d407f,0x080eb64DdBCC78E8514b8318029D7E857B039d58,ridge response robust exercise march resource globe country wait bridge floor castle
0x163aed31fa4db53e534f6af53147c6f29a4fd1ce90e197174580ecbbe901a75d,0xB08f226EeB744a49c4314263D581DeD6bfCB9D74,camp useful october card surge ancient slogan diesel build toss spider clever
0xf7f09d913cab09fe02f8c85e3c36582bbfb7cadafcc76ba9723fc40c0ce6429a,0x530C5789Bc0C54b438D29944794a55F187fAE63f,staff hunt follow scissors board junior champion sand cube job quiz forest
0xde69055890717c56c19339b18101f0fcbb8ad94f77681b4bb04560072c020018,0xDC57e66aAc4e9db2af713662C3115298F7F8b817,job corn month attend stomach jaguar organ yard wheat grape number six
0x1cef32e7d01809ad29aa3c10c0679999767422ccf82ce140639a8b0caf2fbb42,0xb1311690Fd94C91F3ed9A213369C7D66048235A0,swallow goddess kangaroo visa voice lucky iron soap online moon area useful
0xf146e69f6dbba2113ea900bd6f060ff88af6174e2629ceeb3ecec6f629751530,0xA492d3e91fAF39D3358BD1c190Ab92eB820765e9,cheap cannon giraffe lobster identify wool rocket scheme mosquito rigid sudden crane
0xc59fec5e55814de10b7179ff168cbf6d388ff9d6a86b1c83e8fc204b55e25ebf,0x573BFB4E17c8211648AFB34915c98b67374f2552,wool gate bike move else tomato cage choose debris sheriff fortune sister
0x7db110dc73bd43e6a2735397bd27e5443a22cdb4702c0c0dc040405726131bcf,0x5D087e1194c2A12AbBd0c44A5D491C01522065a6,quiz captain base example praise penalty moment select mom group dish force
0x8b93d96cf73d2ded5bde503b2ce4c3890a8f79a50389937bfd62f95d5ca720d4,0x4641795407d8b46925f0E3b6DEFa7Fb31cE3C1B1,clump arrive short resource describe skirt remind cake step text gap clever
0x6b813aeaec68cfdf76aa637826aa01a1e0351ac653658fa0e5f8cd3a2156d31b,0xa9709f6DCdD96f3a74CA2Ed5F8Aa7743891B3f9d,jacket speed leaf hire breeze jar jump bundle hollow find hunt admit
0xd73d225f228a069123ade826414d95adc25ca41cbc893df4e0f8b5df80146505,0xF5F486692DA59e2603A5493eDdFD795e9F0EF41b,spray goat only cheese law good mobile good memory tennis typical flower
0xfe107f526dd9391f16ab501512de58422e2c9f382e76cc1978a4f4491e9ca6e2,0xbfBD54d7aD342F5F7916248d73EF5a41d95354a0,share shove home tribe nominee family kit obey now explain teach home
0x5acc8f2e94f6594ca6970bd0bc47affb12d59ad6490205b5acb6c87fce2b6d58,0x76144D0D5478C4978909F224cD312C258d2d1309,awful indoor noise phrase vague demand wire duty trap dinner oak screen
0x0127ed797ce34dce5ca1abab31ec336ae3e67de61d47383034c60515447a17e4,0x3F3aDb1d38823b83A31E313BF1f9fc7D7Cf1cdb3,jeans kingdom such task cigar column minute neck catch possible stock pond
0x0e716675fd44a520c500ac8d4feacd5917edbb52bbf2a4bae6495588981c0223,0x94c50a0eC489BeB8ed4d35C6f60947626F5334b4,ranch eye icon orange apple adapt trigger scale glove height unlock timber
0x4b9426c451c75575fe5aceb0c531c6aad34fb85bf685ce8201438624434e6de6,0x0bb6b2e2c0B435B8FaaD482264FF175E6E9778b9,mystery toward peace word because carbon marine crowd process camera worry pizza
0x3827f08bf642305f47b5645b5802eaf8991ed01dc9ea3dbc59b4cf9a5f28f237,0xaF20B1bC576699a1068e606a7a13142fC2291da7,lemon empty model able faint public rather elephant wave cabbage gap hill
0x2f35df7e5a7b2aed99f761ddb7c2795907ad12cae32fe2f908dee9afe28c215b,0x5377B8575CE15664F84e2531b35D7Bc6fd34732e,title rally fury coin term still then junior brave cake wage stairs
0xbd4836a545e5f53a55054607df2e1ab9ab1292a14d502f0ab6ab1a52e6c22bd5,0xf9eB53553dDf08198F9aFDC704568cce06ACB321,case museum motor second stable rebel fatal there gravity doctor swallow maple
0xa181e1c6139948916e82f717fc0a2f11db19657b05c931705e46f64063960c01,0x0083F2271d0A8FB2671FD3dbce2234FB89343a88,twelve dry middle portion yard control ice dolphin stock pencil case response
0xd9f73750fc9dc2b86caa1491d22bb435a360172cf360c88bee0faa7634f2d5a4,0x4e24fE16334EBe7d825eB968E5D46410cBfe66cb,layer waste truck kingdom fiscal shoulder kidney busy exile actress mention magic
0xf8c32585ea3142a4360d7d6f7dc527ec61fec5181398444df7d78b9aad289c9b,0x7134e90ED552baeb7B18d5FEE43AF25E0Ea7B7cb,tree trigger misery bitter leisure west million dawn carry wall student mammal
0x4bdc874e149bc610ff37e97a55f2275f4a93216abb979ddcbebf0cebcca163c6,0xbC4CF001ecd6025ba20816AB5A43b7a31475c691,shallow casino happy country prevent fire avocado chest wrestle apple empty library
0x3e3dd27e81fcd842cc51ab8f7d5874d263a00943d5d44297fd1ba032fb53621f,0x2FB2af888160cf8f017ef2053A15bF68ebCB43C1,symbol reduce dune modify recall economy client awake unlock mention pottery bracket
0xab68f2b7ee62a61c670e99a40dc94407c1129af2db2923535692ee53aaf2dcd4,0x2655f1C41aE4e3caDdDd019F5c35e8d739900C34,grid blush round black grant tragic next desert disorder call rocket ski
0x64909f8dcd2efc13f64586ce5b66833679e40654f8372d7aeb04b90e49778982,0x2ce99aAe5927eDA7EeDb8Dc64d2d8B7c7eD654Be,injury husband enjoy father hurt number oppose skill slice month endorse toss
0xaf3278d7b92b74215acd58d3a6b015a0b6494c3dbb8b1e024461a38f59ee40f4,0x8acfAd5707416281C5eA304201fF702cc2eDFfd6,basic arch express diary snap history orphan tourist blanket wrist trim holiday
0xff530d684da1e910026b422875dd8a473bf954ca16e45ed0e2f7c251bd560214,0x0090f67398aBCB5638F541dC840A6fDbD18e30e5,grace live mouse mechanic parent garage master novel drama flavor oyster page
0xf3ad38bcc3bd8f8b2aec2558cdb73102d3db4419068a0c3fa1f4de6a40e21af4,0x6F30d3Bf1C77fFf4a4495D6fF0Afe89818c55EB2,relief stick carbon ancient sample rude unlock plunge autumn actress ozone used
0xfaa94755ba0a340de38169e7c7624e88ab9a284767c5d55eb775277fe5f55cf0,0x63F11E5cCdE0C1356C40E033515149FCEB717B27,depart nation crime blanket raw choice else idea merge tape negative ready
0xead55c0ff4e0da3c94eb0f14b668169532f582b07a13bd2f3be475d2b6e91b02,0x9DA254a29AB15BDf2223077AB3168F9e28c8cD59,keep eight unveil donate mass attitude range squirrel giggle fresh upon people
0x39241eb42b7f1612b6146e50dd7e398cbed78a9bb74ef2803efd1948ebc11b65,0xc79BDC9Ef559e45D860a7301C3Fc53b0eA90dC58,wide wool soul melody educate home because april grape region pumpkin kitten
0x82c23cdeba8258e6d9cff95d1ee63ea120c9a7c7677ee717e9095a0f24b8bc74,0x2149DBB7B01852ef7b4BA52A86CeB9ca33eC752F,island awkward tank obtain denial rate click usage equal enough armed tone
0x57b83e656cb472e502aa48a657c77eac646d54629d95fc2b835250171a225570,0x8d521220a8CB60223b62e8B872668189E7a88456,embark various oven fluid science notable before tiger radar wasp index immense
0x84aa59372170b468277630665a0bfc85da13b4056bd46e67593d9d3bb2b0e071,0xd86D2DC06edaD34aaF01433f11D5f22bE8581114,hello chuckle absurd biology giggle weasel turn approve used left shield strike
0x70b6ef0874a86468dd9b3fa1e2978cf625c3399d51f7f15d79b2483ac03e5af5,0x3fAc17414Afc3C8C3A183d80CA7C2346E56a30Dc,pattern when wasp decide page glimpse peace explain story trade unable exchange
0x856d3fb638c82e48c8aac8e4090ce3988c8079c492f6a2ca0ff960fc45663498,0x2cC7D7dd7e8aE7f082AFe8adCd881E3CeC92f588,bullet deliver crowd estate uncle noise divorce crop sing leaf pact filter
0x76c8430804f2617925efaea23dbc4aa7e2deadb12f920ae34de9e8f3c25c60e1,0x8a17Da90e353407b001906c8267d02E9068367d9,salt once alcohol couple jewel choose undo random brown scorpion flash cactus
0x256b194d9b2466fb544f67d5e7da91256f30942b568ee3329675f0fccc54df5d,0x0d91c91f8Eb95CcD1A8174585026E4dcd441A94E,high spy asthma suggest feed slow weapon fee rival device client face
0x6aa03d65d21744989f62f1fc518f311f6b1fc96ea777d1a83735fbe6c4825244,0x210444C97cb07696A87FF916aE99D6eF9eBe7940,paddle park buffalo hip globe juice win letter cluster chef want master
0x2ca75af28cc754a40274358d7fc4bbf81389a798aa3f07449fb7204036cf5e7c,0x5929eA7084a9f45DaeA900FDc6dBf7B04989548b,trophy network salute ill that broom motion motor bamboo year number pepper
0x2440df1a2f4ddce674dc1377e283245c0053bfb88813520a39025654b55adae0,0xE784489663F4758DA0Dd7D2479cf2cfc8CC3BC26,treat door craft entry brick beef celery earth tag explain derive myself
0xadaac31e42beb6b06f1ed7eb52d8c798feb8847a495c65db2478df51ce12f327,0x8D29e6997c87b0405c922Bcd3C88deA98407Fb1B,detail april crawl flat flash embody style feed celery culture glance language
0x1142aef0ffe03076b22b0db6e6db33e518be4befc20aa01fefb5799d4359d9d0,0x7cA73Da467DE8494A737761aBc7A30b7b2e26776,prefer final lady pet alter reunion very project sugar side top grass
0x856b6cfe7eb59f00e46a64fdb82a18e93ca276b8c33148cd177987d4c5eaaf72,0x6629c2dB463aDD1BEE3544673CDf41728c052521,initial fine abstract about leaf swear skirt curious arctic waste cargo urge
0x4b207aa1a74c6759a2ab7ed08fb94776e0c19df5784c01dabc274d5a51cde3e2,0x4EDa0170bee0DEbFc0C220E1b3c9d4E09736c1B1,brain decade danger step card number forest diet myself sport stone cotton
0xf6e076b4d434d2b6e2f9a048ac73bbf2285bf2cd17cee034309b26a7fe48ca4d,0x949fD6a8A0c3Cb9c4E63de0116E76b7914F24baa,fuel chef rude small fly ball media know fresh woman chalk second
0x3cf9a0074a69d6d6545df00265a38ae96a34ca491c1c2854fc9f2f01f057e549,0x8CCF11322E1FB1DaD4B8aa6cd11C41F84A36B37E,smart orange humble flush media rescue theory carbon task salad journey spare
0x3aa963eb769c40ec236bb412f8d2da043840585fd9915054d1c1697b1df02cce,0x114ec4DDFA4c31311D7a2d3f3C17C5f05de4b122,mean flame sell silly grass crystal staff cat drift way fly opinion
0x645a8587de93ede6dccfca796a9197d095a341afe77e1809a95a0f27cabc5826,0x3EA113712F6B1C806F09F5aD44Cc11Bd12161Cd8,sound general rebel off program kit true develop hello walnut coast accuse
0x565e0be1a4348f72f266ec25f2b7ac4e6772769ae57a4225729a05ae367f6c66,0xdF1fdd90E4718cA0D52E7FCe99bdA783Ce159302,liquid wagon level aerobic piece insane eight shallow romance leader few mail
0xb1728e9d47ba7c5a0e17dc58551d4ed3283a5aa5c6e326f12e67c3a2edbcce40,0x9b12ee5080a490601A89F2A749C34fD70D015CFf,increase menu ivory wasp fence source donate artwork install snake east opera
0xcf04b3abc645a4591b72c33d9ee25aaf16aa82a847dfc9d3bf0665414d4b8805,0x4BcEb96FF539569B514F028215066aB46228D0F2,family neglect effort outside blame describe dry tilt fault panther guard burden
0xc76e2692cef6c96034ad9e6219ac249277f4e66bb99e46220348e44c06cdf9b6,0x3B132e399e78f7070e34Dc973C4D52c8BBd73C65,biology any borrow fish beauty spoil crazy squeeze canal diary left antique
0xe79e5aa4d842a70af7ed303c7c906063b1a7247aca4cbc880c3e62c40c76695c,0xE58FaA6299C7Fd14597C5938AC3d2a02ce71Df20,jungle lawn hub luxury borrow truck draft response cupboard join setup leader
0xd5db611aa636c3136f087eaf85e7c1e1f1221fcadb4d25d3deb4c5a0bf1448fa,0x736199d0e3FC0ae018C4919547a7F3C0F19ba52f,loud helmet one need mammal yellow suggest twelve lottery arrest dentist that
0x5c4af33872aea6104fb1d09c675652f8f60fa8eac90887b38f53fa48729d8cfd,0x84D7FC9BFF41a6fF5c5957AB7c0539bDF2fdA3a0,drift kit pony audit rural curve already rotate olympic install rifle fire
0xf32dd637759258ed1b07488420f749b8468cde901e06506081085a777bc37c79,0x9A793207626905B84D61D85c2eb477671df5E41A,indoor seat entire blue under race coil retreat vital mutual again dinner
0xe1d049bf10cfd9f6d1527e589f4baaa986e8bf79e2d262f9fcb5430c2ffa1d06,0xe6E3762E648AEFC984d98302887f19c548bb30b1,taste sing kind goat course find assault nephew today able dizzy panel
0xbe5f2a2b36b42ecae06b3b95e2b822f6a338ccd6d167ca18a0417e890ece65d4,0x4e52Ba5954F6Eb3b00d4D67F1cEC9E185019Fc6F,solve disorder scrub essence involve cave limit twist harsh arrive time team
0x3df10909d17a6923b9125a346acc24d48071d72d1b8b5b82d4d57009ec2e7332,0x588dbe4942915C7Cb0fe5f2956f7a9481B22A262,clutch forum frozen scale parent awesome milk fiber strategy unfold rice grit
0xac7e3f4cc6ac0e8265491ca6507088a90c5f24d3581bf682673dcc96748f6800,0x940cD08afaf6a74fdb464655fD866D066776FB1A,music good thumb piano demand attend collect culture stage fortune work resemble
0x7c67c35d74e9b10461cca011bcee26aef89eebcf17f8bdab029e516d4005bca0,0x13acC4Ae6EfB12c89261a356ae3113ca1647B207,perfect toddler armed climb slender seven robot solid lake discover among silent
0x7fc738b4943d17f1581c4c989e0b6530dba1ad1c5dec2a247df69d7e0c34d2a3,0xb0226bDb527f5732b9C4878c22342Ab6fb712799,bulk easy retreat walnut lyrics useless elephant thunder chief envelope dirt idea
0xc920189f8c924cda6b13048091f703c6b72c14e686a978871d05472c452c5588,0x1219904d7eFB56D7Cb06493635D740EB2F16110E,faith trap portion margin vendor alcohol pill guard arch critic bind avocado
0x27c977208c477075e9adb4b8762e2d872672c8587b36ff5d6d81383804f3689d,0x67e5d5D8b56057e44B1c80a67CEe2D3ad72a0626,exotic enough little sell royal stomach upon rare brand sign wing language
0xa27f5513d165f439b706a6fee68f9e7cb12d50bd4f2332505c0492cb44b17ca7,0x37edf4a6c84233A1Ddc376A561c0953ccC36a276,sphere light consider future magnet main clarify quit glory minimum dose blur
0xab5648626782377714e1f7eb4eaa848c9f94e097f687e86d2db5ac599037afcd,0xA34a302D65Ed6d3A8661801777F34071f085E310,knee deer scrap course lottery remind decline extend garment fault bomb rotate
0x107d852bc9a8f418ef2a24a1e653a390a9c500d2ba8ba404ff9b2b50e150fa09,0x569aFb2bf91a9c4475dDB4a2105745c59D7ECF1e,east toy object captain twice admit brass track fault connect list minor
0x8a14bd6636870e3fe8dc1ad921f73bdcec699b8642b550772b3f51a3c9a6da8c,0xf4bE46D4A3ea07E96771b71476bd6767CaA4f17E,loyal trip number hint donate romance library tide census sight sentence distance
0xf4d9783b9806f766de84e7100749526215ed3a71b1179e5f0e1c7f9dfbbfe059,0x1A60281450A1A58e530343c3B1C60C8761381763,oak lion timber cotton dynamic tent engine crawl leisure peanut basic execute
0x85ba526fcb2096a8c74bfc7d648c3bcd0e2d19fef9fedcbf25928021d954b01d,0xB2d14dE8d0b6188887dAe8663F57026EAD552dfC,ramp tomato boss innocent eternal smile wrestle cream crop wasp resemble coach
0x120eeb1b30aae98c9435d5b9f9988f4d4cbad02c82955a32ef8a00ab4c9446cd,0xaaC2d1EE549848C3D839ECabE4249ED58bb8C337,enough daring gown since actual stamp hotel viable buffalo ball excite supply
0xd25ad1fe8185eda5326e6abebb1bbe586b50855ce0fee8b7adeaee42f6fc5bf9,0x548809651A3C4A88BeeeB1AECD290D090998e454,fancy electric key imitate option remain census small trust kite dance fever
0x14c20601e67a7deb5c376885576dca884c2b064c9067ced54339fa8a6926c85c,0x11531828AB4aB56640e69616ad60Cf5523a8859D,load frown cheap cereal basic bitter meat color brief dance buyer tackle
0x228094e4728e1ded94ca9230c15a65ab01093720f57bbc0dbaf571092720e967,0xF8F5DCfeE80fBf36114f938813F722cD5E83BF79,crystal alone cram parrot globe direct pudding food answer mammal dance rough
0xe7257648380fee7e6909a66d3545f7a2a199f1954431a1775f833024c4b388e3,0x8CfD2B99C5b6091691A1b2C7a4cce2384855E08b,ice feed already word wear soul water tail lock patch drama floor
0x90492e264f797766d87d1178f94c2dd32dbb3e29a96e407701ad0054e9113105,0x78399E298d13Ae5f43B16d67f284f8e600d0C95F,museum diary maid shaft onion father ceiling strike peace jaguar echo master
0x6b8a87d833332ad2aede7db842e23025d085f10982d76ed7f0f379403b74140a,0x390E3DeeD9e0aBCF8e8d8a697536FEB918902935,juice bulk kick morning wave memory bread stock stuff more true input
0x103769872e6dc9686b3a1408f91178d834314b5e6dbf1174faf0e268a22bc51f,0x14E782846Be9E712F0c1f7e123e6F314b870E296,improve pool also travel echo dad plastic aim tiger hurt sugar such
0x593976054bc8405b27eb9c038b68a5ec142f3af4254817c9a4ffce2eba9abc5e,0x8D59B14222C081cAE74a62D6d26bb5dc8Dd5c67D,torch spike because middle oppose jungle summer track govern huge media become
0x03aee653e30d2d5c797a5ff5f9aacec445080f56cf763b082dee73bc7fa5d1f0,0xa660b9FAe42CD3F3db4d3714469f3A6b36902F18,frequent fever enroll digital aerobic maximum gasp blush orient stereo embrace element
0xdee2e6e599c2f55065f7424fa68a239983134d8f146d348fc5854ed43cdb7f90,0xBBeba394B831C6EacA38BA5cE992663742DC4075,slow salt eyebrow labor chief vendor tuition race blood fossil animal mobile
0xc389ea7d520d6ee8dd7ffb804ebb13cab5272f03fd42bff6294d7e7f54dae185,0xf41f613F0DFfF79C72915b168352996d6bd0853b,example combine purpose teach flip execute town winner notable level fatigue curtain
0x2fc7fc87bd57f00f4d4e16f50c3cc7083165c99f95bd965c41b2860479e3924c,0x2Ec45EbCd57F81757f6cE0e5219D77aEbc7c53a9,panda word main drill stable usage cover swing feel kit destroy cupboard
0x22e1975ed81d97e237c6ec7b2c67130e7e59c271a196f5532df5656cdeb8b5d8,0x76750617454826C051AA4107692db3FFcCba91b0,fly adjust night major film choose grocery network design awesome vanish year
0x41a80c3e119804bcc03869d09181b48e6366feeff64a5fec8fa1314377e81a07,0x594670cfaC1a56f3c2Cf6d0a38f3c6dFC160F894,scout glove page chief gown bread crazy steel twin middle clip material
0x13a79373c927ab416fdc62860eae8961d14fb110a26e05f4d061b9dada161358,0x0F059E99CDe47524165B6865d85D1f65CCd051A0,glue negative peasant coil party frog december smoke raccoon certain then naive
0x29fa902fd8d348f1bf3a0323860f1b11e4be3241ddf01d4142de80ab02476b66,0xe2C929B8e10279cb9D93bE31Ae012E3336fC3687,chest raven erase planet survey lyrics vendor memory expect boil label drama
0x41f9844bb84fe63feab2ae4020301e1405e015e8ebdbc872943a7f5c1ccec87a,0xf94a7FF15Bed1a2cdC20cd0329DcFA78D76ADE4e,cousin print box quality student minute moment have help describe various receive
0x82dd76634982c76d1875bed782e32029e3bd30ce9387f7f0359c21ba05cac3de,0x1041EB7C1e6f3ee444B40bcf8B6F174348a02b94,motor flat able alarm boat much trust uncover wagon pizza chaos damage
0x99c675dc690edd39c8767d745fbb64b2b9df688853fdb7ab02603a1ba45c82bb,0x297488fC3439e5561Ec7548667a72E92B25ACd9c,since sail vital shuffle estate urban oak banana relax fluid elite coin
0x1b4245e86ad7f4536c285348e0982a996c010e98908280712c0cc590f132c5ff,0x1abFDB212E6C402e03659433aa783513A3c98513,dune bulk permit absent decade bitter immune feed voice math pulp okay
0x2a37168cb144e65636f8be0bca2bdcfbee2e5140e58d9d675481a6e100aca30e,0xeF60333B62C39F41B6870dda1d3001D6C5c49E70,purity relief devote reason tuition borrow age mystery mean already blur sweet
0x6b40c0fc44eaa3647df23d07caa99664232d8e8122f9aab2ff5381adafee6f8f,0x7520C8069F4fb69Ea1BDE45c8909186B728503Ad,exile utility goat cave suspect circle ripple inquiry sauce enforce visual tobacco
0x3998e4e8898d9b0390b44198fd5dd6e64269e2c5f9904fa7bcd31239d98d851b,0x7086E6Aa616a546De37888240dcbc64C299aA067,angle please two now garbage they slight west valve across staff mutual
0x4ca7273c0ac8462437b6c46dac2cc8de3a9dab629584fa4c520a8427e0d736ff,0x5639383c5FC1A65A76451aCd66CDed07006f5778,sweet damp review develop deposit hub deputy horn twist cover daughter brave
0xbba6b5d2eeed33fd7b8b762dff3f872ee853106d9db6a3e662207576d73c2235,0x2269E431d87fBAc1B0ADDa404D1441AF6D236EDB,popular debate frost raise heavy cat nominee useless grant struggle price cigar
0xe3ddd165dcbb13c7ff2a493a597fb227044500cd39ae0e47061693aa08725e4b,0x980e6e8227ccaf6203be84C9B0D0a7eB3A052EF6,when lend regret churn arrange three hat clerk power order second crawl
0x0d706dccd24000219391ff86604ed5fb0787db77b7dc7ca29ffffd8eeaf710d5,0x2087b75CE8A124Acc1F2096Faf3cf91b38727abA,wait wish win cover soap bulb ordinary father travel rapid olympic couple
0xe2c6575eefbf25ce40b4888919184b06a9bd08efe719d4dbfcf36ab49737f006,0xecD1Bbb72df970145c02b4fb65B35fA6Bc74D44F,quality danger enter flock climb above control replace mobile injury dog usage
0xc795dd81d2a253c9cb699a8d8d35de785cfa8537580d5fc401da6b9e7a3ec80f,0x014648fAd4Ac81dC803AECE1C1a65CB33d92eA93,defense health finish sport toy noise thunder fee name shuffle nurse screen
0x208509694364ae0823790f26867eaafa46ab02ab31b229c9f2c8b765bbe00805,0x60374e9F7d6ee25Cfd4f08AB0D4016B745924041,regular text myself door party bless kiss another elbow index arctic immune
0xf23ae023b677acb4863565847160700a1c10b2539a64e784fe2e09645c9a0908,0x9B5880b3C2de80B33c6134dcA0167f2F00E266b8,coconut shock tooth mean century damage ripple lobster clog tide trophy calm
0x5cb1dc14d52e8a3ba6adbda185263d2d6c95d546dfcfb2618c8e121207480254,0xc758D356f15E7747D7be5Ae2E57979E1587338f4,great worry change bean exclude mixture right luggage inch warm oil furnace
0xdad6bee44505036e9451cd5b22b8af7a2d41701ff00be5ace448ae9d2a173af4,0x60d4d900b9f14621CEE2d1ebc7DC0491d9FdC6B4,final among name flame awful champion object exercise endless refuse rebel wild
0xda456894eccf4d1165b42e073f7eddf2cf2686422a7ea3cfb296fd56a8c028d1,0x499921A1A9164dC80254B60B226D0C9C232891a0,modify priority profit carbon skirt tide will spider cabin sword frozen solution
0xe929ca5649a5909d440eac8c9d279ca2229541dc77d23c7dd02c4cdfa8f5696c,0x4415D4D7e29d6a1dc5447E5136cf33C26247D231,toy old misery fancy dizzy arena wife orphan cart puppy crater extra
0xd7fcdd0360f1a1c3dea361f87a07afa58c28ba04d5681745ad4f6769e0166f50,0xE27894549CC0d5fA7cEaBB41b6Ddfd8a312B40CD,purity amused okay deliver cart ramp cloth hospital grape clump snap good
0x1971675ffa0961e9ce4893afe70c172781e269b219b7fdf520457e70f45d34ad,0xAb1618470a392D96Bb90B3f3A93D3d412C872AD4,speak knee flavor diet object expire room injury valve clarify parrot control
0x6eee97483e141d68837734e69082581b54e8298dc81e891b662514d6d35c651f,0x1304944e236e0a3fb3a1B3E32a40C5fbEc44487e,coast sock elegant valid social crumble chest evoke mixed retreat flight manual
0xf89fc1b7ed62bba63b0d4d18034e996fa9d61960252de9f79f32302bf6b7f00c,0x8E1bB355C711055e3656160DCD26C0dacfFC8AFe,talent pioneer human avoid illegal term rib torch lock amateur satisfy happy
0xe9d2edcbf89d60d556d6d4ca32869d6c6152169f0cbb7a461ee31853b7c8294f,0x185E500026d55349452ba7eAbb08808cEe2c8723,liar animal response mechanic ready bread daughter country blast wasp fury garlic
0xee43a742201def1e2af67989b946cb534e9b6488cc45fd2a7e20482cb68e0b3e,0x4AB75c4ADE858AF416dBc52f00e9503Bb647b433,lizard jazz sting explain swing spring weird rack trigger curious easily banner
0x0adcdc78f971b51736e9dcbc63c64755ca2c916594d14ba3e6af809fe3acf370,0x6Ff0EfcCE3b904Ac8228C03308426E379E044762,skill gesture now menu start bullet such claw above divide version apart
0x6cf48b2f37fe749c31338b0bb1d9e141dc2dab84af7d32cbf45aff966697beda,0xD4bF3d770D45926755DE79b09fcC2E636429E8c2,brain final soft century design resemble amount envelope chaos prevent guard travel
0x6e7716a3d7d2e80a133af319d8d0146764523c840273c3971ed02ef8bdc650ab,0x1EE08F2F87d8359a13E2b2f80202b5C14947fbd3,clinic license six trouble ranch scheme aware excess antenna pave physical inch
0xad786954c7bf75c9766882c11f25ea93622956fef808d7bf6d8453f0fc2e7e3a,0xC125bB354DDb7a7E1ab3ED2a3644F134E62683fD,heavy monkey kidney absorb decorate card virtual debate help horn drift imitate
0x7bf6aca6e253c0ff352bd6dee1441f0ef82483d2f45bb74845993cc7ecc5c23b,0x77B4F83Ed5dee1798e732202B20d65ED0186FadE,pulse burger lizard exile lawsuit over doctor inform permit tomato lunch skirt
0x4224da322db5935b713c2953c6335dc556f5db199661b2c4bca2b34d0c770239,0x6d9b5d210d647c3265cE792CFC41BD6371BF89B0,impact panel exhibit tornado lesson worth april donate control wife idea naive
0x0119c53e42d63ce150c2c8b076719d72b7d3059ac2a5c96b8222739e71a092a3,0x19E3fC8aE4A83cB5764bC00E490Da1ABF787027C,satoshi believe truth brain device scout trap kidney sand van baby income
0x5d7a3487d26c6315302bbfa764cb9732bc77b72f3e927d2b4ebdf132e6b4c55e,0xA584528F7BfA46Bf09DcA3974E1041D491f9f948,solar large delay naive scale toward clog inch assault catch kit acoustic
0x2b9705d65fb882a4d9291a1ee1fa6fa05e0c783d4c5f2603e734d0f71fb0de15,0x371CB1a983769aF2b5106C24277Dbde86e742CB4,use match patient ancient kitchen any profit point inmate city tilt degree
0x33f26b7d4fd8ab7b0dcae729e435a0686dd3a775db6e17e0aa72957cda6136be,0x82bc4943B0AbA1e1CEECC45CeC0993CC56015075,bargain favorite defense topic addict fragile city agree chicken glimpse solid list
0xcd2b61b97e05bdde8d38c9f6e341ef425e220dc648514230e53a87dbee51d455,0x6bA37b398E87a44F71acafe2E2163CFD1C1cE751,mistake market hen collect dune athlete box vessel ecology right teach mountain
0xd836a42ac4b1044cd600811a43f77c01ef9b170b0f2685c120f3ca6e03bd4d4e,0xd0eB64A141643BaEAC8B54737bd6E92a9519d29d,view parent resist setup obtain myth dilemma order memory envelope screen online
