PrivateKey,Address,Mnemonic
0x6ac784790c05873c5473c43def1cd5408682d0eb3e27529e13a811e7e93f69ef,0x66D98F9fFC33A3727d5AEBC6C8563E539ef1459b,benefit radio that conduct struggle confirm vivid matrix era bind wedding smoke
0x85139a545d90ecc4053f6bbd55c468599324b8548cb369f0b636e3f8b27910a7,0x34446787d296cEa970157d3aa8d915ec0A6C179b,steel glance few able october add dwarf check derive filter salt say
0x81d2083d215562c17481b573740fb6c8c83822dabde0de4c18be330ac1736a4f,0x9B883234f89dD8A75611C30cDB4B45d6a76d7BAf,comfort scan youth push calm focus invite opera expand cup slim raccoon
0xc9f49d23f71cd3d50c428a837b7c35d2a48bfad52150d88782e4d4025a1fd7ef,0x5D39A7c957cD0A3B3CC2b05BaD8681ed688F340b,damp pitch robot inflict law economy grape rare practice course citizen acquire
0x8712f028a22d75f36b26b3d27484b0660ce1ab7071c85213a609e7db6869c59a,0xc28d733774e7cFC5656B3BC953F456627C761C53,pottery unit visual moral rural sentence barely soccer object urban second dream
0x265a39a769f770254be505a37b46897da17ce38a7813209ef61cff319eb463ed,0xBe81c81eae01EB03786BaC740088949DacbAfBf5,balcony clown twist oxygen hair plastic accuse fossil trim anchor million liar
0x610db2b237d60de74bfc32a41d4d2ff0394793e74f87c1eb1220095d1573e2c9,0x387766394D7094FCb62E023249dda10ab0fE64D0,club gift twin then seat palace recycle stock evil awkward shift rescue
0xb27743f5b738d6a783fddd573163d983bda6571e242327ad410fa0a205af7cd7,0xe7E0DF3Cdc68A45C6471cDcf5EC9902272fb85e2,sea mention science nice work dwarf announce silver approve measure spatial drill
0xd9482e76529b446440e72c8e770e4a2bb9bfbd2e94cb838b6802b8b3dc7df5dd,0x5f1930a4F8E6a7f2683a4cAF928FfF5CEc95307E,someone true jaguar panther six decade team pyramid exclude food pipe purse
0x353e2a5c8ef4cbf66a1061266b9520bde251f3e4060eed5626f92c70b9e924a9,0x5D636025c68FCBd1424fDEC5d3639C984DA5aD11,result gospel jacket turn unfair foot legend modify trumpet gasp tent monster
0xf602ba8f1ff4d9ce82dd3c14690a477d3d7fc6485da115a8cbc237c9226ee8e5,0x7D9d4b9274F3ee1801B0108F143A097e6Bc79b5b,river witness margin hidden false surprise patient dad first gossip when minute
0x69e8833458c70edfc7de8514742544a58ed720de495dcfd4993cf61040bc79b2,0xaEB5E0316A4c6B50edC94Ca771eb4bcdC74049dA,sausage course alpha wave mushroom inject fever stomach news piano build media
0x12fc7e43be4c36aa2812a55f3baec686cc049d24a52663f812d59282f24db54d,0xED4BDa04415d97396Bd0C23bE2Cf47a4B93CeFA5,naive public style admit advice taste office wise bone seminar fox organ
0x6ce5434d00a65347799ab5cdad388f94698c7d1ab882573247d1aec0fdb9fdf5,0xF3297A51ccc44777656fBeABF68667B7969BEf97,ostrich deputy leader inch turtle invest video disease order sea person shrug
0x29cd7625c265cb2d0ee29e588343dbbb75abe978290fbb1393e2637d7e19ce8e,0xFEe61E29FF4825e0e990Aa53A890A6cf487C385E,thunder road buffalo oppose planet follow ridge field half element either tail
0x31daad658664fe8372585102c599ca52c3d9033ccede9935f0c87ce27801bbd0,0x9b5De22Def80b7a51A51941C748FE9E63Fd8A275,season lamp fame doctor sign hybrid element salad twenty pig wet circle
0xfcbcd0c6e15f3d8a2026f2a8d4332f21ed12b78c8a2df31bef09e04692733835,0x423043a85993d83E04fFa8887634c0Cd4a41BE99,people crazy metal senior right weasel again require machine moment mutual mean
0x184629df67161659ad125703c1091ea35d0ddb373b1f45e43d2f335c3f1a563c,0x73318Eb78783a01E19AE213BcbeE50E6e8A97B72,story same walnut carpet prosper body unusual disorder diamond then window side
0xb0a5864f4ed6967613b974c697935657ed64e31e3632e2e5e7c51a6ca4353927,0xd5BF455a0527A4BD8e2bC71ef04272134fc65d6D,milk vibrant feel lawsuit middle purpose pink yellow near chicken opinion fury
0xdc5f93ab0d61e7b2f7cd1d5deccc950141a271abdddee4cd9f5cde8a3eeb5f56,0x399ac3bc2E7De07f1Abff67f556f528A045eAAda,frequent electric damp peasant waste idea kit embark lesson loud limb casual
0x025d21865d34ab0885a87507c1020b52c26fdd280a419f3a3051dc7ca84c1673,0x4aD6aCcB0eD524705576500D081813f1384c18Ad,walk organ receive enhance unaware february ten legal spoil trash park parade
0x2e0f2397f7b2c9dfa3a2551311a5eb8ae92c7ffc8c7de8b0f0d61a940cbdb01b,0x7cAdf54867b5A9Cc3fEDF7ffb5521D38386dB38F,pig express opinion walk verify flat wolf theme side tip cabin child
0x59ade18eb1891525df250700a4db047efc8b56b00322ffef772e048dbb6b3fa6,0xF46A599AA24c71102c1AC4200d55F1A0B12578E1,original like panda group quit habit arrest squirrel bracket stem bar pencil
0xab4912479440f256ce47b5053cb4ae2e69c8af4d8e7550006ba77faf2f6e4c78,0xD8FE9E125ea8035e5Dceaef4CA43c5d5F029e24B,base network midnight kingdom expire ostrich dad joy naive charge arrest mass
0x4494b0bb60b4d31c4e5fa29ccc2e6c8ee7d47b608495dcb40738d1b4d3289e94,0xbE4703A14076Bb030c1DBD0b83Ab282bfe44A21e,chronic custom joy stool joy dragon casino drill measure enter negative steel
0x5940ef2e7386a715275b5c14cef10abf6eb6213680532903068dcac9a2032760,0xbb0E4d72bdA635E37cb13e2977dd9EDF9202d758,ostrich enough impulse cart bird cloud face draft hint produce sea humor
0x48b80d6f17f6279492facd02781431a242a27c73de0207c13cf79c0d91f7efeb,0xE5b44361E85DF05c36C0B9Dae4F5407F69849De3,excess trophy hire live trick snake language enter enroll sketch divorce aerobic
0x87ba68b4d8a5e0e3850a5cc834d44fcff83b21fada0b22310da2b57c5d635482,0x3302cf56e759C3b8417824C645c6A543EFAB9557,miracle crime hello ridge resource broom armed cable crunch ghost such rack
0x64a2b890b2e221be4283aa67c36914ef182b6bba3c567d86cec43e22a4856247,0x4DEEE3BfDca47998673C213FE42901e17Cc97677,lock cheese spare glove creek solution sponsor august bus horn describe craft
0x0f25600431b894d810e264fa39db841b4ebde44e07ac3ec0e6ffde90edbf4540,0x390d2bC855Fff8d2218316953B01A6973ea0CC59,glide cactus bus solution wealth blur patrol visit reopen flock universe tackle
0xb278b844fa0ca0a4bb1d7b92ff5cecda2c87461285daabd781b482f180bb7e9d,0xa7bc1E1DDf8270c80d5EB7255e513CC360c66683,grass season now job jaguar guess child runway wing issue catalog happy
0x8c43613dc483a52d7f954ec75800bf4313fecfb4f2cbb8f98e0cd5396824d2fa,0xfC9170cd5e1ecb6d73fBc2bb312E69B56a94F563,dolphin gather edit debate tennis angle climb sock area speak blur trouble
0xf7a71a31e7c742e2270c006d41795dc0addfd4d16b881065e12fc6507d2301b4,0xB8a1Cb1e9bE748C12DaD712ae5749789B4f409Ea,excess kiss service cup bundle okay attend exile pumpkin session coast employ
0xe9fcf442d7f6d34f3235d85514d3920c7a67158a916894829285bc9b23793632,0x3012E76b7ca110ccDEb3d3bD2Ec08C3a33EB739B,vast brass habit million claw pride slice market already whip diary crouch
0xd5cf719903b94329ecfaf6aa4ba3f7f05df287f81103cf067ea999e9d8afa11d,0x6D13CD44aa9802B7B1504b776FdB3bf5eebfe9E5,wire adjust test ripple roast false unit endorse cinnamon grain mountain suspect
0xe5c54e2043270ec92a5e64c4374034ac47c11a07ce08a4ee147783b1687ba04b,0xc508fca31be8B50539f9c8C7D6f28a9c45222453,march maze cover cheap kiwi sort soccer quarter clown harbor finish foot
0xbb5c9db21e3ea31adea002aa162c81f98bd703d6c9d028a229ccd0545e635125,0xAB220E0a37d55a3B1d1C1659ba7bCFF9b54eF402,extra barrel future tribe inject smart main stick carry number exchange fish
0xd8c23ccb7244a00902d87f1d2a8c93200c139092b728191f0788f2b13f6b538c,0x02e458e3e3eE257e03f5648377eAD30f428dFA02,excess voyage topple million lucky salmon voyage base critic boil north dutch
0x8dbcd1d861f4a58d2939c9556250d5ffc15c0bc5f01b4c5278348d8ea54aead7,0x8c24B425CF4848cad5295b67c87a2A0Eb776FF21,garage inspire zoo alley check sibling tiger gain crew way hockey task
0x4c015afe600e6c0e1ac9a6a8e15d8a511932c23bf80c1efd91515f9d4e9838be,0x7bFB3e6884AC03767439c92a268DFbE5396Ac4f0,veteran surprise cat push antique hazard occur song hour okay puppy client
0xf6c9cf1125ae354d602dacdb611a26dc60ff92132eb1c1e3549fff6a1ed1a5c4,0xe75BA9F64Fac5b6a4ECaF5C76bdc5b38bd504a11,float burger control grain truly sorry concert sleep window waste wife card
0xdf9c99ef5971830578d5de15de96c5bce32525f4e495e457fd7a1334550c10fb,0x2Be5a34C61B83916E6Feb75A031feD0e9B4e228B,demand public chicken ensure result supply unable fit document toy whip inside
0x619f575a938c49a9dacca997201331e65e0476a50b13f61aba4c119f5a0b7efa,0x71fD79f2b0C6ceFE7C80B488631E2d6E76Df1A63,bone else toe acquire congress name usage around sketch project door inflict
0x067b1b6fb4089d7799675ef45faf05c27ef9ca325475687145934f50807cf631,0x60526C168B12Df9dED0A47EE3Fe3b69a92b722Af,shaft lumber rabbit diary dice trap female garlic robot embody insane walnut
0x33e7c557b1bf4078c689c7b3ab126bf7873574919cfd1df7d581c2ec6111cd34,0xCffC75aCa6c4429936278356e6755145A9328980,ramp rare fine market prefer trash chapter hunt budget cross multiply pen
0xfb50a0f7e55e53e6705cbb5d987167ccbf3f5bfb9d92dde2d622c455a30d931e,0xAAD727297741F8002708D3B3F71f2478D1A9be2f,auction oak liquid venture loan indoor club hill render cabbage sugar stamp
0x4664de1a2bfa818b0ac70d185c87e0e731d3dcc9c946a6d249548e24724afcfe,0x3d65E1a805D1dF02342e2Da38dcD62478758b24D,garlic ordinary baby security match girl easily fan duty celery twist rural
0xe5fa479475d06ecae714c64644b825bd64a9121e0c714908cefd618d6c131886,0xa189a86dCA136fb372D23D61483E9736F91664B1,glow demand degree rare post library surge number valley false kiwi join
0x4308d90c8ba70d29b4dcb68fc4aaf95a7a0381d78548cc0eb5c80aacb43b651b,0x04827C560BBA30Bdd1D1Efc4154b8520341B1a07,thunder balance crouch world useless eternal yard unfold use hero tunnel fly
0x3fcc5a22e417c395c111b6b690645c790568da2ecefcdb13c5ee3fce5603b064,0xd55Ae45919543d50fd50a62C8f8DB602Fe232Fa7,purchase bone frog obtain trigger begin timber bike nurse churn spring produce
0xc1a5e3b0ea2906b90d789d6cee7b1a7463713af4a61d761c5cfe61a88ba36fa9,0xE19beE821598da0297B72572B68e0Fc3fB4664Fa,siege spike sound worth cable patient define usual charge later month buffalo
0xd17334eb9534a3d2bda3a2f36b371168519b2b76252c1956e8050f422a6e111a,0x20EB20Fb34678f14D9bd99816089B004Ac634695,auto bachelor gallery strong vanish increase account fatal fluid push cabbage dice
0x86c01c03d2907266a29f0a277df6cf06140bfbb0ef38fc234d79c286050e9e06,0x406170506Eb0626c0af33cE3e7027D4357710270,focus bone movie imitate equal swift admit keep dirt device fire void
0x35ccc06938835a08a238441e71f369b39094b1cd3a14e6b96612ba34fe281596,0x353B76ef5823491e9eEd5C74b23cd3b8455AbB75,impose usage time coast abandon sort twelve sunny flash law mind crime
0xcf69fce74f2e912f3833959bc8d34390ce67337b30d3e78115e96954f433e621,0x1302696e031E3131ec28588B915fA28F905e6d1b,own share remind excite weasel insect october maze assume rather differ borrow
0xcb6dc32aa5efdc281dfadd01da2e2e729f198034ba4d08819e206a75621ad4a9,0xB6956cA386BF14A3295855D2C9FC578FAEd90c21,spare have journey december dune describe devote tuna rocket lunar siren knife
0x5f6fc997732f5a3b8efbeb00d95588acde4faaaf7efb921ba2cf42dbd022777b,0x45838746dA4f0678D170cd6f2F962956c6E4eEb5,left cry soft license ostrich raven morning ready future satoshi rain crawl
0xa01d7235c9df88c4a1bea391fe73864167afc85f13d10e407235f609bcadb8e8,0x7f8e13986C83A2A69bAcb14cf50aD8124eC5C387,swarm kit ball armor elder agent grunt pyramid situate affair truth choice
0x29cf2742095371fa9a9a1d02a3ab96371ca1cf18c3046087bd7f09159e905ebf,0x3F6132d776f55aec9c7dAa7398376F8AB7246374,ethics betray explain remind switch object cliff retreat park bulb siege usage
0xd0912296c0bc604583dc707598b9aeee1f03a9973570fc314c4910514069884a,0x73FaF3Acde0B3Da860f766C6b32aB409bb638AdB,speak weather end lake frog place zebra eternal cage window purchase public
0xacc2f6d386de80eee73a765291dd860e9db4b91182d8184dafed9f054353f13f,0xDf2930470b6b9aB81AE60401F7B399175B5d5689,broken spare evolve frame audit calm coconut humor deal hurt own depart
0x325e366c2267bf3ebfc6eef6524555d5729bd6d0586a9cd5f94c1dea1b7a4496,0x8bb0076508EEaE325EDef76c794CF055787aca8B,wealth sunset shoot grid direct spray weird post mosquito churn depth quarter
0xde47a8457fd73001cda620546ef2edc5dcc7cd4f1b284f3e768c92a35ab0f308,0x0E1Bc968D0b354Cd7587578662d0515529EF97B3,stone spring health lava vote monitor bottom sphere patch other excite festival
0xcbfbc3361c57a37419ca6535ae801a9f6a735f7498573be9d1eaf827b1ce6570,0x9cce20F04916684f2E6EABb32EF9F36318577c43,drastic staff profit column gentle local diet empower feed night town album
0x4c25a3d163427da8d193d00d5d4f6a047d6936dbd1d96e3ffd48bc91605f0dff,0xf1076f63997ee2f1282cb3D80818405D5fBadaC0,radar robust crack ostrich ask photo unfair humble gain special april wood
0xf43b3d19800e4754df949d38fc3191e736de3a04bf207292c4fdd0df28edd2ae,0x7DE22419f38Bc0A42B071425423b015ffFf57843,trash machine minute web clay breeze sudden elevator car spike junior double
0x9f5ce36c18d36b04c96ed6304252dcaa65f94de344786dff536e6bc49934e412,0x5De57Fa92e3D1848C49A030D381A58379526CC74,shock one jewel service bullet crisp melt like region unusual brother mirror
0xa1f7097dab27b857b8667a7666308adb11331566d26b7e3a2d4d5a01aff2e16c,0x7EE8341D776ca2C3f8d2B93D3ed6Cdf245803737,finger major any proof biology abuse excuse nut sword slam fancy claim
0x4033b9c3732c3e6120a2100e2db6b3ff7ae65860ca22edb5fd3ab67a5cba9047,0x5f100AEfa079067C123Dc24b6BC73716613A44cE,virus magnet verify laugh album strike flip diet park trade gallery maple
0x51f936ba01174982ed856097d4cac6994e1bf416d064943f67173be6115a0e7a,0xC0f7D9662c3266B829D3d87d171B17b6A797eb6B,stuff betray upgrade love arrest trouble business jaguar tool aisle endless vendor
0x0ee1fa85d80d2f96101c9562c7b14643b7426a5c0ac37e02db63637bf7c74f52,0xD3F46794948ce965126cfFa9086524f9F5d2dE45,bundle lobster bonus brass film measure allow merit label train nurse immune
0x842da47da37faf3c4b86a957029740f3063760aa3c049dee2516c04f87a8aa96,0xc07ACB8a7136Ad884fe1332E6B567313885558AD,train crater nest check flavor whale position receive thumb sad vibrant another
0xf0f739ddc9f52930a1b99ed72a316c06cdb7c19a2941e5bb9ea486fd14015f3d,0xFE4C9E6fC58334336c5615EF2bf20Be181240cF1,crumble actress scan ball topic vivid post scare bid label wreck pigeon
0xf1d66648f7937d640eeef2ec3f6c7d7b9ce695da2b07b2b2c62c380ff7a07dc1,0x398CeB766D758ABd5cA25951d87Da4Fe74d0113F,impose try movie allow buddy solid trend office riot magnet quit rough
0xc485c0b96de50a28aa8636339122e767f33f4539971595a4ebda3b140e67e4ce,0x6Ec75768a73421dA1BDc76Eb5A4B5cCAA30F3391,sound lizard envelope lumber hedgehog law gallery ask pledge plunge tribe task
0xad144ebb6d480eb073205b166c6dd894088e3a449610601d9d5c4e53e8f35885,0xF62f6b5211AEB25c718A2BAfdb7f0cfCDAF86817,switch foster chief damage found broccoli cupboard urge spoon person riot mother
0x3d4ae13b369251e16febcb50d1954145feb8e585354b2d4a1c6f97868cd0d4ba,0x188C6FBc6DBeab1684a1C0718DFC5dAc50b58352,split sport denial blur divert soap twelve shuffle picnic say fame gown
0xeaca32f6d1b52197011fc5a9870b4a03562662e22c04962f60a4cd1b625cb6b7,0x17Dc3d6bf34853bfd6e0cCa962Bf4CA7DDC63b38,local pill mask elbow shield capital hurdle brain wedding style orchard ankle
0xe71a40e9bcde81545f092ec5bbaf9a1df20e96319335d2f23afc0bd1d207c1cc,0x380AF45094db097c78FB315247e7Ebd90832CFa6,upon dinner vanish extra pass modify pumpkin echo canvas safe series orient
0x6f15db764fed00348153deb115618a5024c4172f1647e5f87c505677ac2cfe1c,0x2695bF74e9E5BaDf16d87BFbc02Fc366d0A85B1A,improve remind bone kit one lawsuit hospital weather burger float drift attract
0x67d9d57746d380878ccdbca2020404b1948734985a1cc90ded4ecab108dd1826,0xD37c6f392b6b21b0906927d3F490B06C9b8500c4,render rapid world mule prosper amazing minute wealth few crane shift jewel
0x6e34e7ba3221c1e2326cf981baa8071752a511274fae9a95cc0848e910bc079c,0xceFc6d054be69Bd1eBC97AC3F72dFe2Af080aB17,immense aim exact vacant pulse jump ride hen snow puzzle rail intact
0x776170a66e7bf581585974b8cdfddd94df19c460acdc1b4874dce01d191c74c6,0x0C50D98Ed25aDc99673B1B675b36AcbFdBEF746b,short bottom walnut purity cook approve punch claw museum spoon shrug diesel
0x84d5aa84df993d3e3c95516bdb5532f8daead97988c745ba22df300079820178,0x3D81aD1D0ccD083873353F850d8Dd100247A59e6,code firm stadium train liquid admit duty city industry cram jeans clever
0x8fd4dfa8f22b504f538b5da59eb502d9cf86d16cb03c93afceafadc7a86d28de,0x26457E70896e1083d5A52Ce57d70391D1d84b3ee,erase teach act endorse tuition tumble chapter rib ask hurdle cactus peace
0x340b575d52dccbbda102e09655b9a71403de12a069ea66c249436bd39d51fdbd,0x484954F36288385B8c982416F63242c8e161ED50,lyrics sun twin deal shock addict palm coconut honey enforce deliver embody
0x2f84dc4839c4ae9edb8849bfa40b44741fbdf348f6c1a547661f3453113718a3,0xDd48C9208f4a07016731B73B516d254D4Ff13Bb6,feature apology forget economy author answer food convince wing magnet giant olympic
0x0d99db17b9ac1d6ba237c10a49fc90eae2117b534d7d0ff1960bdc53c140df43,0x29AE898c908A7B0E7E43569c24c322bd41709d26,copy ring pool lottery expand lock crawl border reflect man space deputy
0x8ea329c527f42a4f043305679b99e7bd1017ea8b81f6e7b2ceebacf6740549bf,0x9Fc247d1DC6BD503DEd55950446527bc90D9D67b,coconut theme cushion because usual area practice sibling object orphan enhance barely
0x2325590aee6b023152b987e874d284494af09d893a1911c8831ce3f1b8b77aca,0xE1Abc5ae1aB4Cb576ecb8196Fa04546fbbCe3DC6,rebuild pony arrive trim say day web odor maximum same brick among
0xf04acb129c57aa134836babef0ea67092c9411a137f2164956d8655aff246d56,0x86ED19c9E799574083B78aA511773c3718e2826a,nice symptom asset else hedgehog online spin unable eight print portion unit
0xf9550195b3e23997eb04b9cc94bab77a92f01a325cf6351964834e6aec6135f7,0xd654EE8536367Fa0a3a3d14741c90073B00775B7,sea business vacuum walnut peasant cycle subject guide caution ribbon column arm
0xfa0de9cffcd97e365a12b9338adbccdb093c8db030ea5693261895a4281487e4,0x36cC7cc3DC206bb1738564F943b485B21FB207e0,choice crazy wife parent insect vintage mesh daughter clean bird bike vibrant
0xb485dfb8508a4932c1d0788babc6c7b448624a3c99e657e7404bb4d666db9b3d,0xF0dcDBa7F92d0F8F9de9E34128124D623f6A6c8D,dice pistol galaxy famous track shy expand sheriff smile box cram humor
0x1290ee2dd8ef2aceafda085910db06828260aa5d2558742c955e8ebc923f28ff,0xFD6Dd559C582e22cb8F0666Ddcf218BDf7305532,proof tape satoshi daring mobile drum banana rude nuclear rebuild girl donate
0x5e591533f78ddaae2856bbd2ee0fe8f062e117965e85462d28a4cde929864808,0x76cEab661Ff078b98076BFED9B69ECc1737ef2fc,glass estate museum lunch wide thunder throw hard light bench hint angle
0x0e0f2545ab60f7c310778170d646a6287ef5e0fcdb72b3d31f0078f43c0c1277,0x6fDcBDdA396Da8C1A79BdB4b8557a0b1Db0dE2B5,wrong swing broccoli blast critic chief master miss enhance input blind market
0xac1d6571460c34eff4e49574f9ca0d103db885dd3e0f7afb81557b7bf4887982,0xBDa03FbBFCD148383C5C35A5859842D8840D96ED,donate glow impose welcome time apart volume pulse novel assist all glove
0x0d3a4fdec9092fc2e8bcec0be10867a55fe426cd3acb3919ff0088bf252dffd5,0xD788C881dD4d6a26Fc727cFC1EcA592f77ddB687,reduce this sure advice trouble loyal drive bid flock february tent need
0x065cba27d2d173a448237653cd6ef626cb4ebbd11b5b7c0f2047fcad90b23aa7,0x9b61A02e2be8900C1EFBb1F6aDcD2F33a564c47f,extend acquire throw time entire leave excite burden area relief dial drip
0xcae6e588b53313dbbd564ac4616e8ea21e9842a206f50389b10ca153cef14f8b,0x9740bca48BfBCc9F0db715f0BDDd621AA025b56d,color afraid gospel neither chapter clog phrase soldier pitch urban plug indicate
0x1388c2e4ae9da9073f7ec915aece6a92cb56361a2c2d75369d9414d6a3463a65,0xB14F044fb7D85BA42eB3ee6E1507CD81359A320d,divert mimic feel tissue north mansion simple pipe way raven occur fuel
0x206f6b7464f100b099cfc4db3dbaf3b2e3df28d31fe5e2d8c2eb362e3a15114c,0x3A29e62122a261d86916064cfefb07F1acc012a9,crawl detect bullet dynamic rare border rent friend smile sad essence alert
0x56b7d738dd412356cf741adf3619e9d577d18786ec42986314869f8a23ddeaf7,0x13FF25F508C362Df60DAE5Fa7E3a06A93B085166,dune bread shoulder genre memory sheriff general move solve leopard nerve bounce
0x747cb32ff32885c5f8862d27f58c3966d2c50f58c8cc861d1cf00c22c18d1580,0xe39DEe880d854A8c1a995F6d2Ee93cCd4841f9Ff,into confirm nasty young acid denial poverty essence brain party garden coral
0x21a193169202e28b5d38456d8d439f07d60ea157d58f9359cebc26d1992bcc84,0xFFd1feE2397D786f9E3B2A9D660CE3Fa526AFb5C,treat rapid track involve solar thought learn finish dynamic misery walk leisure
0x8030d3d316aa9d306fd0791ca9a0f8b0180286ef959c7f77ed4ceba7af2a7ff2,0x886633290AFEc530cA9ae5c4e9a775b3e93B2F0C,change miracle identify super cheese exit horror wrap legend anxiety spice sad
0x079803b5870e41ffc2961f24fcb327b9d8bafdffd9e5d1651ce38ac170aa38f7,0xA8e15Fa1E91f3E56B5d65EA14237C42c9DD003e8,bubble garbage pause borrow boil skull fantasy pulp pizza error bubble eyebrow
0xe03da1b6c4f031f75b92299f59744d5ad6d704c650557f3fa6df57fd53e0fec2,0xAF203Ca888447a1C1F1d0D698b094eC7C3CB2407,sketch skate antenna banner casual spoil tissue luggage apple settle own surprise
0x55d879cfa379a3dcbee6ed5091bd735c12ec897df7a750130bdaabc080620551,0x557b490c4681235458b5c62F0aA619796fd8b657,welcome awkward gather patch large mystery capable risk alcohol churn praise disease
0xcfa0a4f908eb108039a755e80bf76525b8e6480fe1dcba1ecacc1fcf7327a534,0x23ED665c44323A38a4Dd1dF6B3a544e572778d82,february silk wide enlist payment lyrics blame ability amount hover october quantum
0x877babe4bda293bfdae991d111dac678dcee9e79e96ed227faf04a236b706bce,0x9EF834379cb084fc2Bb2fb3142996878b389407a,total acid drift damage execute holiday drill banner affair clutch gallery industry
0x9068fd07ba790ec2a1fcf88dedc5d65d6f557e6622fa213543459d46ebf314c3,0xa752C49996C1A30df59178C1c4728B5Ca8C51082,flame capital hour suit note erosion buddy secret lion vivid thing round
0x219f0efd9f0d3ffda7b2bdba0980209da90c4d80caa3efe71ec690ffac4323fc,0x59d74028477c0937776Bb8e102ceaFA97946C29B,night stairs daring reopen warm admit bar kick flight health brief seat
0x642ba8edb26e91895a9d5e6f3d0021cb1a26463264259e4e788683a3b67f65cd,0x5DE966048D67490d5e5d1deECe28d568Fa271711,pencil slush future stone laugh history play force payment two satisfy dirt
0x06c95d7941fe7739feea3123f3ce7d854d918c53b68639cbc306aca9d657c252,0xD1dAE10fDB2791261181C4f312bAf0e24F1F4987,setup wear thank stomach party index cheese cement tool street road daughter
0x6b5a0242229ed0e26dac0d227c2cedb137c379d64ac900eff551686cc1a0b559,0xeFC68A8eF9De99AE5DF80181b0B7c9806EE0D368,hobby else remove various alien unveil exile merit eight hospital sponsor sport
0xcba35a5bfbd4ea2d6ff0659ccf826983d64fd09b26be2cc37facc9f7b45072ef,0xBf06F8a91F9C515Eb99cf789ab23Aed1F8b3E730,praise ordinary unveil yard reveal tree satoshi side impulse bar stand focus
0x41cada8d2ba7b025829e089af28dca4b608d4924b56fdb0ee7464f1ae21d8a07,0x7B49c8dD0aB6Ae91E16Ee23cA99118b4Fff49E4E,smoke essence oval toss category rebuild arrest waste real must pipe another
0x65e969d1808ce2430958dc9cc5b26b73f18de59b89029bf402315fb28d41272f,0x166e29A6a9e615869b7E30233C778C7022ad452a,walnut april combine silver blue clown limit lunar autumn recycle hello heavy
0x22fdcc17d37256a1ffd0f878cd5598212a72d9b1ac0127048161daba766980e5,0x8ae1362E711B0355d8Aff661E4D08Ce0319f7db9,regular fatal tuna spoil combine uniform satisfy pelican core fly trim rug
0xb3f9b4e904698ebb568158246dbca6ecc16cff8ab74ddabead497ed760b6ada7,0x31F75E69261cF2Ab8dd2a003D5b31A320ed4c285,math matter obscure insane enrich nominee whisper join wish cup normal life
0xa6be32007672d6355e8acd68a5c27ffa92998ba1703ae38006e7e79647c597de,0x67578ae331b1B4Ba0FCdF64268AA8CD7b721B791,over fiction joy sweet oppose remain case december fit language edge mammal
0x9a889e7a81b76fcd92008428585407788bd70856ae61c91f73f481620202fbee,0x940A9D0FDd720981A6773720E2AFe3582c0c4f9c,winner barely trigger radio tourist sting bag approve category bench atom deer
0xce403c43e75ed45fabc1c986848519f6e2cd61e43fb7e0cc7e016a3cbe368c96,0x38B2D8C6c88C7518FfB396675C447C2346f9A4cc,claw soccer explain unknown quarter fan rely grit wrist round blue gloom
0xd69c36d058381326921f26f39b6602388a6eca46cf9b7cf3cb16dc249ac7ab51,0x22eadC275f3a08ce1401e0543ffE2e3749783dFf,hour shadow shine breeze faith chef sadness what deputy two flat hawk
0x8dc35763382bb7c5a0cebbe631f7e59ec9a73f6155869c21b7ca9659d26ab154,0x1D742C20656Be59C3b0D7c2072FB5CBD1f776351,diamond castle dynamic raven file key actual cable myth famous blind receive
0x9332e313b10c95b5a05ef166997a02e5c198a7e3ddf816fdaf60161c61b3b5fb,0x23a6B61AD2a89a9a9E305f32db9F3c48bf11c7b6,shallow attract deliver camp parade horn soccer flush sister speak stadium culture
0xd9f6bcb82d6db1e2af2d0c4cc94f7e57a67c2384956b3caa2af29acdf1ef3071,0x1eee352FD5366C5c4A3b7639289235920669384d,fatigue chalk witness obscure strong tonight gorilla sustain kite obey height rabbit
0xdf6d8c2759de82e246ca0f3ee80ce9215b5e450ac9c097cb83febbc8ad155852,0x301264c0Be1a288A526280Ba53D2c36b400DdaBe,stage donate obscure february mango story enhance lock spirit chunk fiscal scale
0x9e2ba0b85aecf222fe33942604300f8ad1d805f883cedd0d604da845db8b5aa7,0xf91f5B2a3aC1f2C26E6D06d6003A1F86F3803bD1,van slight expose share potato primary double north enough west average identify
0x50261fcd183647f3d770f9fccbf4a7af9178e0b8f1a2f21f1c71e0747a2a5a85,0x3b6C7D124C1AC549cD2AF95bf3E82AD86aF2D6A0,neck panic aware worth glimpse pilot friend series stone radio damp second
0x3034bfea1645a82dd75c5285b2916dbc5bf47a8a0c21f3919f2d0b534d7155f6,0x169e4033D998C4e7366fe36BA8d073BaF3D0DED0,now coin quit oak copper vocal park tomato horn head breeze toast
0x1325351fec498d373fe7493bc17c6be8a4957009e4ac7d2d2b7c67f7687947db,0x70622965bFb71FD96280dFF1702c450E6ce3AB15,infant voyage ribbon now relax aunt expand enact jar enemy guilt regret
0x5c49699a23ee535a34b2dac88f55e258cded2a98cc55efa3e3ebe4bf75e4c9c2,0x28d4B621113b2b4690001c56F81F2614E05d7E0A,citizen blame peanut glance run clog because curve feel critic clap quarter
0x0cb0d9c46edac59bcaf96d7235e859a2c8649fdf0d16b50587bb7bb037017974,0x8bE325489554e70072C1D5D0420542964D443bA0,health weapon siren never atom cruise pair blur culture behind unusual point
0x67b5a665f6d07539c0e99ff6cd150db4d2b95c42131019dae0991d212ab4af75,0xd35d99822f37d37EfE0dfA92449E1eA994B27638,theory usual bunker dad large stadium sort slogan deposit atom orbit sudden
0x2baf726ebe9eae087319815baeb68377d52bfeb9e9a691d7a324e0c8994afed7,0x93e7Cbe2d5A197013Ec9dC0Eef6A62c6DA2bfdB7,erupt index invest museum into rotate index destroy notice cotton decide sister
0xd960907931e9b1f49d4021d1a61d11ab529b4fb182acf392567bdc808ebbfcb7,0x35f4694a7217Af4f12C864a035BC1f290FeaFf49,one output few turn clay ring onion wood leave asthma coyote easily
