PrivateKey,Address,Mnemonic
0xb27064d12cf5e15374844956d6db29e5759ea6cdc145f0a5f1fbde40b823b6ef,0xeBfCf7147B448DE37e89365aaBb132B83e286C65,nation snap front wash hair protect there sad spin until daring glue
0xe61fdb100fce849ae6f93917fae9c68cff78c437e52daded54d0bcb861a23eac,0x4e912b135cba83e97EA9BA0C0861661841f8128b,damp peanut inside audit theory shine illness easily spoil law reflect decide
0x3e51705eff6b8c8807713cff910cf28c5e3e739ec85d37f670b0b8fd873ba026,0x01C34AD0B9F05935A973Fa3b83586d566a85eD7d,snake decade side wild cube actress blood snow violin horror history adapt
0xf5e4ec0d6ef0d89d3e7b8a0a7aa8ce593e264513367533b95f86989f80aa6f87,0xB5B9F91d84Cb1F447AC5927DEc5115a83edF000F,orbit skirt increase traffic omit note shoot okay collect one rigid federal
0xf360f8da108a30934f502182627ff737b4a8b3afd63f8a27940adbe375c79eb0,0x825B878E6C95A555E677a3B1365568e584dc1326,flush problem meadow hammer lend click top weird rookie host issue blossom
0xea1f2c9f36c87385844cf15f5a17934e9579b8f1e77b0f5d753e0dfd64bb5a46,0x1B3F7c8cb5038A5aED9EBc2268bFe4Dc34CCaBc3,peanut gas betray catalog jeans cute summer differ minute trip nominee rookie
0x4f18ee82bcdb3529b7119cd6199546f3392a933fc5dd1848d1bf8da625cc09e7,0x8a0c8b15aAEdDf638EAf6cB2BFCB82652A16Fbe9,squirrel uncover churn public coffee orbit divide click tag jazz slim nut
0xcaa6bdf1dcd7de11ac8f7c548cc86229e3aeccee595dc9524185ea12cf616a64,0x3FEA23B95139156DbE062a0f7555bBe264EE648D,parade portion predict cactus patrol lucky wife hero input state entire park
0xf07e993c81bc6b0118cb50eac9bc2a2053a3aad7661d5c638b8cb38e5be3a9f8,0xD31B94B90b8925A6aba4BAce2a1948DE3d381549,uncover mystery security push enrich method speed egg resource pistol orient one
0x929eb0bba28119bbd60f5af8538a05c999157b80f4e6b606bf41be7746ebcc54,0x3fBb7F386b5004a0F32b1aA2CCAa8B2123B84d67,soda dad film glide muffin debris winner rhythm tool result stool kit
0x6601dec23bdf3451b6e978ebe490bb50435bbe2c5e700e986bab92babdc7a292,0xE38ad597733f16A81795C5DD28150b18d6181Afc,minute uniform magic safe renew eagle weird fruit again seven legal phone
0xd3703bc41de26f452c36dc6b139076a9c996d5a89af2e0715b876751716dd3c1,0x7CBFA8faf69EBB6d0d096bE3Cf373EFc2d714Ca6,area donate brain potato course sell struggle siren surface cram deny clever
0x6f4c5ea3dceba24d6f245757e6cfdbdc871da60aadda98bdfdebddb1270ae3ae,0x2c38FDf353B5e7f03A683D8C03ea987b33909b04,page valley coin any onion cushion motion gift nerve choose problem narrow
0xed23dcacdaed8a8ff82fb9a6d80122c54f73fbfb68bbd8b80fde0d69b178af3d,0xB26a5465386fc92c08905Bd3056931e0Ff26B5F0,stuff rose zoo dolphin mix potato depart employ prize upgrade curtain build
0xab014fd0724c51cd56d8b54b546b09dc9463d7fd62af639006209e313f05a1e1,0xdf66e8A320415EEB5978D85fe7C179a1804aF32B,quote alter gym mountain inside energy scene sport age series distance body
0xed9639124ea399c7e0a24ff9afc6068d989600c8fae0fc040c05914febb6bb27,0x45fd97dd89e53fa18F41f38a623bD7c1408bF30a,soon text sweet lounge tube assist also remind health chair surround gas
0x76a12dd19d2b0db65bd91dcbe3deb161e7aec54bc9522a3e05d1a8975112a9b1,0x76ee8d0daA34580388ae5E48056b55A56a96bEad,divorce divert unusual exile lady alpha cook same kick zero benefit pave
0x3a7046b911e38dfe9ad01b22c50cf1a22e2931fd01b976a52e2795821a69c27f,0x858e1f9508a1767A58DfcA41b7e8987776d0d16f,husband thank chef autumn omit daughter chicken aerobic federal monitor inflict chunk
0x465db9403e71ea7d287a84458e35886f7f8e707499af9c3b2fb1f72230686ec7,0x817931f2745871168271Ec4a08811c19623c93f9,submit valve pizza space tragic uncover hold sick robust lemon daring spread
0xe22ced51a80a1e9f271734031caea14327da51009396053ca2d4015c7bb26865,0x891A3b11803195CBe65b1b490f2fFaA0c8a5e7eE,holiday curve used brave garden average snow west input enter slogan clay
0xb4375029826f1b84d477762d82ea4e7ad3ab554a5ea4803b93baa7f0694e632c,0xa3b92070874b41b37ebb5b8a8dB7a816f0178a47,myth equal spider off monster van famous public grocery scout carry garlic
0x17737f39d5e8d5c1de493e48b6a207eb371b98fd7f8f41ce81358bff26570e7b,0xf6C567503332F31762Be93b93723ccbCB38d7690,surface effort dolphin stereo host scheme draft cash perfect blur skate shrug
0x17706a8b51857049eccdf3497ca4a97e482b72bdfeaaeade096d201d19a5b39b,0x3f0Ae9236a9f213Bbc12652d3c4443f2318772Bd,learn abstract differ ramp vendor amount cupboard quiz able marriage arena lemon
0x657d99d51bc4bf7cd53d2628a0f7a4195cd42efcef9cc064d4ad8d79fca105e4,0x256d3E61e552cB15396066A198c8a46372B50d25,kidney horror burger car concert demise math combine sauce maze copy vital
0xfc336137cf422456a6dfd7e26624c1c9cfc44489ffa777607d7a270ea314c709,0xBaE29c78bfBf6A2972957678611F78BDC1F5e034,pave bind cabin peace strike pulp large wrestle faculty obtain poet promote
0xc44fb2f59aeca85cc92f3bad3c782c03a637878d6dfb29e4e4351a5ea3142547,0xbC6168cF9715A81f018a6d4419A40a6a2785CAfA,upon draw blue buyer trigger ahead success insane aware result chest solve
0x0dcb34bc044f25bbdbe1da0fd0053656ffeb096e689c72027478175f7b7f878b,0x89222226496d0B813f933253D0A6a7CA7084614E,balance scrub say lemon electric scale front cabin rib dash summer snow
0x67a2b8104f43b9f656f862a03b1d67de94cb24524e55f792deba663f394bc13c,0x9D601F974404eFfa6D357983A29Ab1f070b1D197,entry random output mystery eight fee drive about shrug swamp inner creek
0xc3a3eeefd969d3eaf8b9309f323d6282eed862faef99c7b58e15ad66a57fad99,0xce1Ed705179EeC7569472B874e53A60FfC52b55b,crop angry elder matrix nut thunder target lazy helmet marine deposit feel
0x74f3130fa5465a0ad187e9734fabc4d6b1b462f87f52f5ea5bb87b58d2328916,0x3FBff37C7EaFD7e6ce2DB57D7163284Cc4009B33,venture match uphold humble sibling depend supreme reform extend input clap youth
0x4461420dd9664ac7778772286232aec9e4bea16dabe15a8129b39e80f11ce560,0x65D272AcDE7C012B6D28BCe0920cA791d30481Ad,piece brave cotton filter forest result boil inflict drop kidney mass gun
0x7fd4c45fc5989e69cd9f3d865dba82c560e86fa293033665f55c4eb36f00134f,0x06364dd91FCf35dD269959608EBB90B71B5cAd42,reduce aerobic glow chicken magnet actress three cruel another okay logic round
0xcf5482b94d840d50bc5ab447cbbf8496fa6cfd81d1dbf6a6547a4755b9a0b6bb,0x1675163fF18f0Beea991d61f874A42E30D9C93Be,city bread oak split disagree alley glad seek diet thank crime legend
0x4a1cdfa3fc267f9d7eb3436f1e39d595a470c6ee58c371b17b384ee0c7e40157,0x9dbA5bEa55fDDd841f07fCfC1150Ef002F5d0Bb9,sponsor craft crisp federal evoke drift board pattern ecology garlic inner rain
0x694e6dc8ee6388c1dc592fc0f72191230298d96a10b10b76aec429de785e95d4,0x8E2931c691DF9C72b750fb21d98B6e4fb6C18741,imitate strategy bar blue jump butter ignore grit stem rent short guitar
0x7e9f35547bc3bfb914f17421f5d60fbad4c64e2b2ec2f99e988308a951bd7578,0x38179951d0091D5369161950Ba64bE29f89e68bC,moral setup royal slow youth pistol result soon bulk name rotate dad
0xab69f2930859562077d362f68ece44c3adbd36b43bfa9d7146609b61b17a0837,0x6A76392286639bae1B6f371762c9Ce2Ffe8E7EEc,inquiry rough normal absurd lonely loud nut reveal health practice dice pioneer
0x5c765363b8efed3f06af7fce069275fe2d9541d673bd7c5a1ccca3551946164b,0xC6792Ffa6834AaA4C70241D6A91Eb6B697E42D17,key salmon shift gold glue retire hurry robust fat just until pioneer
0x06c5a694f36306e74df3b06e735aa291696bcc95994604cf70051fd9888fdbd4,0x71685e98a9190eE2830a4eFeb324e3c73A5c2160,cargo cactus fresh develop certain bench welcome sand below advance bless purse
0x8e021c8cf7d6163790a0b4a08c939df3184322c44241cdd073d0340b00d27060,0x556605201C3B9aF07656678D0052A0752dA52e07,torch wonder vapor leopard poet word stable suspect sponsor nature gloom soda
0x32c35e1ffd9fadb4b3a0d63a8e036a7a7106092e47e3e233c998c560eb04e1c6,0xF33739ce48FF9c8B495B609F2314eD359b1612f8,find cake series purpose run tent rule symbol update size fit glove
0xd294a05a5f0eb74b61b8b71ea3d5200ab0888e9460d3854d7c91ba8eb19be3a6,0x86304fbaCD7A2762e4A47A9C9631519E07519965,crowd improve allow chaos magnet slot upper area crouch lucky flush helmet
0xdb957d07675121df13b56d08de6af1d752dd55493c88ca539bd81c4fd0de6c49,0x19AC8dC22473085d97453F16435725C461DD13D8,song noble news better industry year cousin term hunt visa critic wall
0x8fdb39691845788d96b8e4a32ddbd555cec19320074a1ad67c01644261228c81,0xB99628D10e224e641e31F3B29E535CBEf0C46241,brief wink pink image orbit dolphin rate system frozen parade pause short
0x2c8beae7e47e76bcdbec10a841d335a935322c975b89a1a98a2bc29e20993296,0x6a6df13831967E175Fcb1B07dAC1BB81E7fBe0fA,bacon address wheat document cheese catalog crush cable face chimney mutual process
0x48fabf2fdbc3fb54a2f966cd468825915ad7ffaff392c7ff8913dd0de934c2e1,0x0D644CbCdc9FC8556d38ee4E9FBF749a45313CAA,gap situate rebuild curious december middle polar couch accident tobacco involve town
0xc7ef0929762acb0a68ffae227abcefc41ef0ef06899f57de75913347eb96aed9,0x4dE74b3F89dcDa32950D20b145ED1468e16fB4C1,purpose wish stamp display tray enemy child alter gold security kingdom monster
0xd5ee66e4e7e0f9742c7276673e56bf6dade5d94797cd35193ca05792b01e81cc,0x99E4a12a1e777223ff8ad9a22128fB5ebf520Ca9,tunnel over oil feed ankle scare rack light relax favorite match fury
0xdb8247bddb0f53298173625189af61b101cad79a544163e06fcc7e1d4166fd0d,0xebCDBfd3133EfFFA52b0bD2224C79ff197D0F9Fe,reform sail area million neither host moment actual element flame canyon hospital
0xc655dde9c83be0fc29e2aa302d654b8d0bdd9476a10462a98811f61afb065bbd,0xd18A3ec1AC9c32565eB532c3449189a6453EF461,hen captain depth dish furnace helmet scrap promote limb black gloom october
0x134760927df3412b5e91c5e3abd909f58ec7d33f2c66c9b582345520e96f24e0,0x82A353d3b4A8EA451C0d184bE54F32D6ac759444,pool write away fee valley plastic main love hour vessel category sniff
0x62b7b90af75bbeb23b1c68d71bceaf90c2d189c285353a2fe8fe70ef04e1fb4d,0xA4695A1d93f7fbb280C4589828f57d5D2d53f8cf,fantasy choose combine sketch system uniform provide video review siren vacant fruit
0x769396c69df39d276908936baf21844d76f8db08aff453d119ea3c6f48faeebe,0x9dAc35fb674667b06Fd4b94eb3560b261e4be1D0,inform mango pigeon leaf point laptop hunt river recycle predict impulse over
0xe103b149d47cb8bd95702dace18743f4e613cb0826c3ac50358338bed742eb43,0xCC11Cdec9d79Fe1f6037f027c89AA73358429A81,believe never neither prison proof parade bonus congress elegant license pudding snack
0xffbb26aff28287fadf4dad05a2de61ae666b731b73a12f93217bdbb0e5ece890,0x19c5943CCC4F3289967ded75E66035578f8D0cf1,essence disorder okay reform recipe time strategy lift all glove boil misery
0x761cc50ebbdf54e55ec8c00d7f46d84619eaae394fa3f78de7c15c5006ebdffe,0x0373985EfC1E44290C726B54a6b23c577d98CeA3,rescue settle oak pretty deal misery this coin manage smoke sight soon
0x77396a481b484baa3febfeebef7d1700d479f9942457d8a7c5d760aebedf9532,0x5B0559b85a81Fa1b410f889a48b61E853937dC6E,reunion truck sorry among torch question length cube aim hedgehog column draft
0xf1f7bffa020fec919ce3d5c12bee029dde5b7f9ef4f5c7e1df2e289a5883597c,0x295b1f221F40f748E731BFeBebCa7c19eCF9E5E2,situate april oak rely awesome orange snap satoshi over service try fringe
0xf1302d5189ac4da8953754bafd91fb5d80710dad44b62f82319a46fc39d4673f,0xa657cd7E499e4977181dAebc0E25752E4F9Fd7cd,goddess boost vapor calm stem marble pudding twist struggle immune antique uncle
0x407878383cbf57cf2014668d528e1826e1bfcd253a2f3bcd6890b5b3e18fbe91,0x65B10E5Fb8a8b8250973f4230AF05E4703dB23BF,fork cat hard rib bulb draw mother disorder pattern rocket organ slow
0xa20f939c2648f1a39f4e466baaac79de52a42ad1a78998e0086e93b2a555f2ca,0x8DfeAFc7a48eAAbc02cf6D603f74C9691ea0b766,friend film harvest dizzy shed luxury unlock hurry slogan vault estate walnut
0xdf2aebd51f58fab1d67aabd143643872f25f8b9b287d0e3666e9779aa98f5558,0xC4667Ae8518Ff2a5bD3538d500A84Ff07Af4969b,fit solid supreme tomato shop yellow firm front feed violin priority settle
0x0e049c7889723672e49aa4cb0074c57e422e41b3a688d807d7cebf3d56239dd0,0x59C84261cC5d82395a4C86582b5CFec97Bc97262,mix like exclude unfold oval repair payment apology crucial height waste valve
0x9158647c11ceb17764886253af3be9f130297fc08ce87adcb915f3bf5e9352c1,0x4a62E8B9e91Af4316Ead8340658aa27C0ed7156F,sure airport flip honey skate electric elephant deny saddle sweet flock pulp
0xe840b8063d8fe61932279d12d16ad34f31b580f12da28e08410ca879332115f0,0x8725467B4dA147d20B47Ee6DF353613e1c0bcF4D,nothing apology nominee tool outer vintage valley mobile long genuine oval before
0x558c2b93f8595d8637f27e9f6b0dfb9048a5ed350f662638fab3ce6b9e3623f0,0x6cD974310CCf7739fdb5896f050eB6197B289Bf8,kid retreat pony enrich kick oxygen valley main reject fossil artist bless
0x2e8b9733a9bc8754531680a0b6f703d3cbd99d61a65f6721eb9955d7985bd87e,0xA0B9bE39E7c87244D162a307F9C1c7e8E604706e,all shuffle mom turkey voyage cage worry awake hip minute ostrich draw
0x0056a0abd14331a494710d0e9e3700506874f1aa7ed6fe495e2b5ad7f45c0867,0xA841e5e0B9EBAb502dB3bff8fB80d84d602ed19A,mean grass velvet green warrior olympic recycle okay credit place vendor mobile
0xff1a3dfd196b1a5ccb877ad1965bd4c75fd1c11677f661a61684d56c7c1c99cc,0x2afD4068f6ADd3142f5a6d0D8DB596cde3B8c59a,pyramid network dance crowd runway provide resemble inner smooth orange test trophy
0xeba04268f9abe5f6d24b86b077e5cb3586c1ac4746ea17d8d840568004b139f2,0x19A92C26833B7FD80946Ed92CA9074f0e4Dd872F,mirror repeat merry journey problem blossom genre then simple cereal elevator lazy
0x1c11c08a92c5fffbc183c338ba8406bfe8a8c4b676f81a621924a1e6fe09156c,0x5FD5AE3E29625D6DDcdB42C104C1DA0A4f9a469D,pill buyer sunny tackle talent knock scheme price code trim shove tower
0x49d1285aca69b275459f6515e875ebfaf2d8d1340b086009a892cd3be9641eab,0xAd3f9255C545C990F5094247A1464e293B2b2B71,exchange guess chimney brown leg because eye party indoor bonus dose amount
0xa2ccb5381d5d59306b364a68a25ed18cac1c0b4674cf20de4be65e6ad90d6442,0xAfAbc4A3C7f1d3D0d5Dda1C1E5A33EccAA1074C6,wish click bench crowd brick suspect pulp front vacant unveil noble save
0xcfa19359c6bef794f5dcc9483920b6ab5384a0d522bab5ce911af9158604a739,0xa1b9816A91D275D361d09c1fE1E966ccCFfe0d83,shock enforce involve pride promote maple find unable future quality patrol genius
0x81c13f20abea97e0ce0437d9b717104212816d799e00e500bb03ea33c0c56f5f,0x03e129b5003a2952794a78dA0d4A402738Fdc7e3,desk clutch sleep betray mutual race gift baby kit movie valve problem
0x40e75018dcc9fd9c1470efe727b2ad69f186b9517888a373c096ed23810c0593,0xa943a5DD49A5a8425D57e5dBBB42aC7d84F375A6,cloud laugh cabbage warrior crisp fragile visa tennis loud hybrid nothing outside
0x9ef35089344e75ef5de6c3928202b59504d5870bdcc1d1d11b46b1f9abc78785,0xa19DF25540B5DC73a75A6a62C9B260910DBc32DE,tip car submit million disagree crowd egg rebel return raccoon adapt stadium
0x312b281895ba79e028daa05a6f0219299a472ee0036ccf95ef58783d8235c3ab,0x553C5F620e3905d309B96DbA384cE353A88C8dc7,mosquito gloom clip harvest wage account stuff firm myth lens stadium twelve
0xd44c34349cfee2724963977efe58bd12dbd0d68d633d7f8543b340c3713acf72,0x785FE7F686E2A667c6091f0b4092D92936BFD04E,idle coin intact price tip bird bacon emotion admit staff initial manual
0x4e4213c00a05f806fb8d654f5b5d2ca38fa7dee536147cf7852ddc75f22a0796,0x0d4b8e35186F9aAdED66947a7B826e118f5c7144,hurt cash unfold side hand purse improve merge bunker immune glory street
0x2054f3fbc93796833b7f7c942a71fa0f15cf0f56339684753cb62c83abce23f8,0x27164CE611940b3E61ba6f792d666c46DA828385,sunny safe unveil replace nominee loop panic attend derive profit piano pretty
0x39cba0af0f01b8e4dfbdb68c810c6758f080342d69f8aa3258718e1851a8ac91,0x8C6acD2531EF6C59822df16B53268F786a128943,beef kidney picture virtual aim promote bamboo mimic sword fever jewel unaware
0x727d287c8f28c521238217f10b7764dab4ccabc8196dfc4ecca0c7baad9d195d,0x46e48bBf40EBca0ab5Fb4D0dDbfBa01C8f7174d1,deal disease barely major garage prepare sock sign shy again thing machine
0x8d17bd85701f08d16bc1493e07d48afa379fa47008a84969657fbf89aa41a0e9,0xAE87D14e4A849078030e4281Ee2D83f007174E10,village arm pluck radar swim whisper deposit nothing prefer hood crunch nominee
0xd01b27882f62f59b421f9093493db840e79c484025f1d586ba9e9cb077e9d194,0xBE4170fFEF76A38E99e1A74591D2D16177e38743,roast design aim praise bulk injury code boost trophy spoil forward bar
0x4432701793dcfbb12c2dec7a7ebb029cb0f07f83cbc70caf57c6f4a2ea3cb4d2,0xDCb0642B9baFB5642217cdb28A7355dBeBb4EEde,unlock want fashion side stick tribe wall diary quantum stage ketchup affair
0xdaa9ad52adf0bd70d8df8e901db80af2f62faadcf460dc615844f1aabe220e3a,0x4245Bf3669849335e68C0c310C1eA1D2cDa5cfC5,party key amused maximum obvious project grant art bunker level give until
0x7cc6900c891edee9c70cb429a2efc5b2228312434c26ab0ad89d892dd83bdf82,0x395f23439553B630ed413a039A4a787b56472b1e,scan perfect sun dismiss entry arrest learn message dice dawn picnic snap
0xcd00d09d5959a1845ccc248983f52667bd59c49ae41d5ab5da66acaf37f3c76c,0xDa892f1a087224D428C4252a1fAEf0d542C75632,syrup runway defy decline kit garlic hobby worth picnic crop dry vital
0xe537d162247df34e1521a7f6a0f3f142e61fd9c61aa70031ef3fa094635958da,0x96C11Dab95e2e36F9AA591d46394882Ee3eaD171,raise brisk churn tourist violin battle limit will seed one artefact trumpet
0x3ff59ae6573075e72efd2725e2864f81ed95ee9f32bcb8ea9ca80c56c7ab72a5,0xad0d38BaFE78ea3FD5F87c697D0D6481ebB20618,search cluster amateur slight apology suspect evoke panther story canyon bachelor frozen
0xf47fa3ed157c8fbd70fdb235d43ccc32af7a005f04c1ab8144636251ee8ec5d6,0xD2E1515824677283A2c569171EA48B3926137f78,expose oyster poem swim post one captain evil fancy economy alley reduce
0x7e644ec9d5ceb3411b42499a53a999f2a6ac915e827301d302388939784df3d3,0x4386FC84960C318E0d8425917A3Ae08D6fc79340,hurt brother rhythm soon panda ask beauty myself swarm elder sister noble
0x3dd67279e1832aef3ece2a824f01d03eeb781cf0cbc5942a3a18df43796d6b0a,0x1aAaAEd6CA2FbE10c2eb8075669E874bE565584d,struggle cupboard soup advance nose year ghost keen great source toddler essence
0x583fd39d8503fd97ed2c7b2b5ca7063bfb7be966d3c3a934232f85fdec91d6d1,0xCD93ACD79f93299e7bf8c5c77102E4D6A8e1f8B7,stadium net boring transfer mean random law sister arch attend arrive fruit
0x7d538d98f25fc75375e42a0b08e5f6e1bd268815bf89bb1fa27079b55e4b9ae9,0x84691ca225FE33B2ACcee35FD89016080b8cf6bD,risk source derive wife fantasy liberty attitude raise must good fiscal jungle
0x7e00cc9c9891f5cb17ae7c31c37d05ffb827939f310b19afc4cfda4d4d98916e,0x0ceFc57c070E356b62BF3C56ef09C33611E6b41f,olympic minute sniff smile peasant aware mandate museum machine circle any coral
0xfe2af3670f73505e1f2965c8e76550eece1203e358de7809b554ce132feff6f2,0xEF2aE070DB837fd282446e4b0E6ed0E188C6df1B,brass destroy convince hub sign tail false mix surface spray moment eager
0xc985ce3fc36a5796eb0844063a188e9a1515a8f16c2bbacb29ec2ddcebb9ff5a,0x29368B354aE9ed5274AabA958BAE3f635E8A7C4f,naive scan pony deny theory silent alert monster slow theory crisp prize
0xf1ad32344aa64d3f3e51a83bc983e8d6d44b877b4504b7f9065e1d52283d8416,0xa867A0B3E6C844112b5F6Fe8Cb0E929A4443f553,impulse little defy also renew nerve evidence lab benefit urban tower input
0xc7a128a7ddab1a7ec63ed723b6b687d371e7bed9cfac15921f158e670cb08ea9,0x16c241D3dB6e0a0c2De4Dc89128cdd1f2F8a3fa2,arctic wear wife caution huge lumber stage inspire net message address base
0x11ead38b3c61356743c25ae9c13ffe266e6171b90a05e619209d39dac42de809,0x439b4F5263d92C12F19eD3939009Fe36b2597Cf8,panic noble sleep hotel copper easy fury deposit taste bottom happy proud
0x99fbe35e6134b552fea9ecc21fbb1c4836e356df9967209b96618f0d65f0823d,0xc19Ad5E2302023441e589dd3aC162c69264e6F84,upgrade like pride obtain soft venue race meadow quantum sock inherit evil
0xfe004d2b0051c2f4c75990fcad7eb9aa9af8d3f836934257432252581d19fe98,0x45217692e77Cc7D85A6f2BE2471E3c138f13EFFE,eagle party erase current frost arctic unfold autumn toddler tower cover chef
0x6a8ea80e771adb1bb8f9ce29da377e915e041f5d7ac66b7a1cd9fff9adb96936,0xf64Bc6Bb368Aab143eE761a70404124217a95C8c,movie bunker slide ahead praise wolf zoo thumb tourist purchase crowd diet
0x1ac8e737b9eea5258f26f68d374bad340eccb59aed729804e0ff620852b35881,0x2fCcf402cF26c9CA36d57Ff397333bdf5bc0Dd64,obscure craft strategy inner science drama divert huge machine exist episode swear
0x25e49067f5e2f33047aca470c44374951e92a137eaf24538c0c745859b8fd5fc,0x28E7129DB8dC745912071c76E819770DdC40AA2b,hire boy warfare treat pumpkin pyramid degree process own kit nominee dove
0x2ad523dd1147a05e67f0d992d98f185ad6cd6601515d0e1436d23ac50e299d1b,0xe079f77467f66f421127EB4946DFea0b431a7762,useful penalty cake cupboard process business pluck end east deliver garage purchase
0xc45c189d6739c9a0ba7504d808e06ca17f56cf899759cba49f857f062882c083,0xc4D9B5733Bc138b3A613886BdB530CF7fF5CB403,song devote update place stomach region recipe remember say situate someone egg
0xcbb20bb522f9f8ea8c0ef2235ba15f8885b59f65564d217c3efc724dfced04bd,0x7578E4CD1EA57079e771C247b48c5ae4028Afe55,pride silk alcohol broccoli enemy train fork ancient leg mesh warrior visa
0xbe0e2c5f32a649286006ffb4f05f3230ef17cd38c225ccb4cedf3b2e9db95a1b,0x3Bf81D0061a13CF8Fbf1B7518f17150e611ff487,air nothing arctic jealous lake audit need describe virtual improve basic nasty
0x980d5c9c75d505cbe69086be4ca09a0a927ca9bc6edaf8ef8b997072f09de26e,0x6885Ec2084674cFA2eDc9B2b7aB4e85cE4868423,curious draw confirm tattoo spare silver hen blouse athlete rug rare ready
0xec5022c80c6d5c253ee736f1ce762a120fd8b4c71892292b76255d099cbf4502,0x2391812158a7085b98B06500b248Df86E84F72D7,quality slice solution top inquiry assault bamboo toward practice only spot transfer
0xdc1031031cca794b8693cb4aee3fac6a50f5ad1125c42a3e4e105c038a4ae03c,0xD35fC09C3B7D75Cdd2f0cdb2F7f15c1986C33784,venture slice sibling sense lion border second screen ignore walnut obey sadness
0x03225df7ea92d1416039495629d1ac7bc1e754d2e9b71eee4c7a5832ed273629,0x49491D7341E596bf27934B01d8B664cA54B6eE1A,unfold image school toss recycle list disagree boil often throw stem begin
0x506d0f22ec2ee0db5e3dcee15bb154b917fd19cebb28ed062ff369ebc6459da5,0xD5F3D885dCcc9b1077D5C96A2DB96d5AA69Ab67D,clump note asthma surface tennis evolve deposit pumpkin walk young glimpse oval
0xba97f622e6a52af2e393c7fb40178a569bd6dcb6118e970dd87d81e5ced1cb32,0x23477B3Cb7Fa989Fc1528F244A8fDd304c979BE5,engine imitate blur timber crucial sand spin pond shield ride below ill
0xafc5b7799b9c6f340bcb9a64fad60c0d23387cb3265c62fc661934c42fddfd41,0x8573e56291109faf2a15FC65B4FA27165bce072D,knife sight much venue excite jump subway number fever insect wheel bag
0x81907bcc027726cdba5d900ad9e0bfe1d75499178630bb333549e42a4f06dca7,0xAAd916e7cfAaa31decFBA0dEc0d32e0767F2D737,twenty buyer orbit brief chair medal grass agent mutual noodle sort genius
0x17fbbc3dc030f9c068e9025646efe033607da3ad0f08ed94928387e3f32d284a,0x093A3C17E03180d938dcc242e9952A63de834Dc0,lock also upset car cheese garment dad female real error armor clump
0xef6c12a1387e69524cdb3823e785b87aa80dab0891839621c70a2afa0c17a7de,0xD28e9eB61Cff66043cc45D76962e08C0D4933b97,kingdom used render grant tackle bridge rain holiday job crouch melody hover
0xc67cb944f7fbfc82b7cc90f3cb3811399cde08bb4e881de2cf102a4610f381d2,0x5133898F3471E2F82593aB6E99526300983f586B,immune short sibling zebra pool muffin busy lemon filter upgrade drip divide
0x7ece7edfefd1d9fea8b62c8292979c339284ea3c1526fd72f5e7b09d00acbe31,0x602B58b99EeE915520368C9C8Dd8b67B53F93078,design sleep mosquito gloom food traffic blame moon swallow lizard gospel kit
0xffc596e2ac86c8828d4b5ca54b501e5d074647f368279922159895c06d60fab5,0x74345dC13f55E8E69473bD50Ee200FCE4EE54C95,topple renew pair dumb powder verb obvious ankle insane hire exist donate
0xc6b782f722224c3e5327001ede2af24804c33a8a67da88a222dc350d390b9287,0x86DbAf3f923E166e6bcf25c68fDa9737Cc6BD943,jazz drastic assume slab there dad fluid relief laptop medal either catch
0x2643b010d374b79e48d99b9a07619a972fb4263c863cd63cfb6b845b449fbf3d,0xF088b6080f38eD86AF50eF976e5c21094ef99439,direct exist swear hint fine super cabin camp burden panther spread jump
0x8367715f9c56faee20d30f711025039722198b2923cccc2e52ed9cd771c3e964,0x088b9b376Bf5432d4E93E7487F3Da4Bd25337cD6,piano exchange dial arch paddle reunion rocket love arch upgrade endless way
0x1a0c5ef66132855bd2e08e9b632436e9c61a18e9d62cbe6ab3804b6936ddd3a3,0xEd41AabbB1b12578CAF2679C5EaC24706be1c4a4,mule nurse brand sting gospel bridge shadow found live baby desk economy
0x71e0e495d7dbc3f901f58d44c4cbf99a8a5837f620f518aa40d677c9cd35d758,0x36104f56Ab004d82f957B7FC063C4F62526eCAD3,regret clump illegal crouch divide hero winner fatigue common pigeon yard hobby
0xc3e7b0a54d377a0685b2e5f6350e1ee1d282a0eb12f6f6037cd55863f4ab4f5f,0x0cCA271d472F240aa5B0275304521eCB8B22CB0C,science toddler stove eye soldier club vocal seat swim only critic employ
0x06be7c6d3c845ba239e6a3da32d3a0ffa1b1d15e0fd905bc98cad7f24c9178dc,0xeC6A8203137D5136155ff401d66Dd0bb536a8C7e,badge vague grant point fringe various eager advance bring whale citizen scan
0xe0e68560b0334d1e21ae0baefcc2b1136496aa5d05d3f27d0c44d6d62cdd086a,0xC198a9cdbc948f75Fa5623033da8762DB1CFbC0d,grid summer habit wild liquid way produce arch flush swim eye moment
0x538fe2dc0366e3b3594cd5139b84eebfb5965c59609b6032b3dfcec3b1225fb9,0xc7E3b4D327162E9b79f63aefdD657CBbbc0289C6,above useless tired drip scrub model this another quality upon donor despair
0x80dd09625407acaa52aa48286b2e27ac749b0d26269960dedbc070447193fb08,0x5a93394f5508f8f1dc468E8BDb34fE676CCA2058,survey hockey bargain minor mercy cry neutral ice tide mother north length
0x11929900034b9f759217cea922e8262633823f6773da49f1ae41e7733d9c608b,0xEd4b1A152e8b24Ed61Ec221c3E21C8f6444AAfC1,pass sheriff rose exile excess cotton silly type broccoli turn surge decide
0x0ff78d4a5a7ed3c8af92eaf9e14878cc61ae1e191fe542f30d6a6a67ab417a6a,0x292E0A0b7432629d61DF269a461f3674e2D6e151,margin priority sand oil enhance gift grid window pulse exit chest honey
0x8bcc2699f572b2ebf4434c6381986c8fe3746ae78b4ca0c5aedfb5231f2a41e5,0x30aaB08061a369fAEc9f5c49b8b75fb3b1cA0Aa2,soldier tool tattoo patrol chunk rotate mail same mad target program labor
0x04806a61c8c8dd31ab36133f4910c00e7003687c3f1335363cd04fba252b43f4,0x2C14c3D2D170146057F58D686f9dC6D18B4b5096,mention bottom say target course wise gain blame near involve total garbage
0x7e73d4ce97ca01027c495864fb94804bc1ea859f3d1b27663add0f3da2c699c6,0x6E4cccBa9213Cf20241EDe4327281104828Dc8a1,snake soon tomorrow say blind master actor tomato base shield someone remain
