PrivateKey,Address,Mnemonic
0x9e58c105141002c511fd9749a5f2f62785c22a0e1da5abbdcd64b2e82d7c4f01,0x569e393349ff417400EC19Bef829B044DE2B2636,spice awake load man daughter butter giraffe lock pull switch have avoid
0x9b72521c47580309f8df6aced273fb453ef9e8224a486e3ff50f6c8431231f1c,0xFa95278247271CC6ccF916aF423c7218fd473144,border belt radio napkin opera someone pattern robot already logic bicycle choose
0x9ec2a4ecda81a30bf1590b7d925ea3bfd0340039b0968daa5edb9033b72b334a,0xbbA3cadCFc63df18169E646CC395d02524D61425,obscure uncle father mountain goose pipe there drama acquire forget prefer sniff
0x1fc2fec70d669b5e3a84e68d9e3fbdb4ce61978e0cfb5e768741d4648ae87b60,0x404Abcca3aFE4Ce459A9bfECDBC8D4238bD6c6E6,unhappy scare dilemma also trophy weird way olympic swarm dune wage dry
0x6783c5ccd6b2d7ed041613d1e8ac4793e1252bd243227f99c8a991cbaf433d67,0x4bdB1a8613CAE751F23d85638d5279862f7978DB,nasty equal picnic reflect damage kiss conduct tortoise laptop flip tomato lucky
0x23203879e03fc33682c217b8da35c4ddd0981cee3454ff50c8c931b2641bfa11,0x8ce7A15cf35d785E8d54f7F775f8d4378906Fcf6,game sad nature call fold before undo jar pet pupil unhappy trial
0xfc26ab7264d9a740b697296a4dca66bd30ff67763b523e7b0553d410b75cd13e,0xd4121E551AaeD51c9c44F94DBC6A5A906195005C,gain broom apart base charge fault humble tilt december avocado orange area
0x992e4a6553889788678640176eda69751f60f660ca996f9a2848cbc9c92165c6,0x244cf10Dea5C64F4b172f0eED877Bd80052D93C7,delay floor fold lonely diet critic fold truck happy extra powder paper
0xbe98f5b8f4aa7a19cfb01c99d475cb8fe4a125808be3d0bfa4ba6af6c05a8d15,0x2b07ad0a52E17c6C37ba13b30851012882E946D0,make bid oppose isolate recall promote skate avocado elite uniform network clap
0xb8d8405874e42df2d08c2b7696ace4f02fd35bf2a8dc05d7175062ab8094cdd0,0xe3A9EA3d4AF9Be0d4c531937d936aE96dDEB9984,garment section frequent abstract dog chat depend prepare cabin slow comfort motion
0xba482b2ed09556ad831534c3d4e8c08c94f6ea76514799f109f246b40672435f,0x233C271767D1ed98facFEF16E0746bd334d6A671,brain nerve essay liar jewel waste elevator ridge boring work tomato enhance
0x719e9f93db31a567268e8fc1deb10842643f00b32ff46214158a44d67dc24b4f,0xce811758C37cEC33BA9Cb47B414625dF972279bA,end clever pistol section below brick menu answer sleep reflect seed govern
0x21b2bd4f7cbbf2e7d9a5565877b18b52ee82c8bb40bfd9f0331e0d6be785a288,0x0e0eDdB7523d65BAfBe5dD62eBd6ABbfA658ab49,foam jewel claim blame unaware street boring kid frown leaf jelly parent
0x514faa8c92da418db7625afffb12ddcd07361593e0e102ee864e04d9a544aa77,0xfd32479914190636dA43df01F7488789b13B3EF7,version addict glory trigger wild sniff essay holiday present blur client vast
0xbcfee7239b179ea1112d6c7cbeca61312d27fd143e31bfa0d030f754efd23124,0x8cbaA03cBaAC56647180F48809fBb93f60283f38,decide kidney execute whisper device during indoor capital cabin steak jaguar turn
0x03986ae3e859b1bba7bd59876e73be86abe0b206a2a0e8e171dd90c723f590bb,0x9bA8811E7afDFFBE637e662CEEF0AAc6E640833B,various goddess game absent equip south purse tank remove day dial enter
0x0e5da78173dbc7e70278eb13126802efb25f6139649a530d456499bb80bff31f,0x7adfD7A85B58abfA6c07a229cdf04D97BFd96047,hour inspire all hedgehog draw goat helmet damage cabin liberty dune warm
0xf6cd3890c4f1e214323a4234488cf2d5f6ec6193f3df062d9b408e2f477deb32,0xF0D3be9794aB28aCdD9CB253484b3baE39e4E963,immune today snap couple prepare task vehicle cake view oblige tube task
0xea82d2b8737b96bca943693ca2b3d09737942126ab559b18a6f418e47b36c168,0xaE1DC9d1B505De83010DD223eFc802F0AF0B81C1,satisfy talk amused flat season theme you tackle notice already senior forum
0xe940bb7469feeb7c40cd4163879a69ef5379abd966b4215c0921e1df7c8b6f60,0xFDdBf9B7920F4ee79dCae396810180941fcC68Cf,taste supply opera dignity turn piece moral coffee drive panda dawn hour
0x526e45639fa95aeee85c7cec4ecedb8fed3aafb93b85c63a05557409aa75f676,0x6E36A311c650873897800EbF74D9D8416eaFe902,fault prepare raw visual level pistol gain vast wrap trouble ankle order
0x9622dbb9779a7d577a189e15a99a98776e1e589fdc10e1f498d0804884822a73,0x2609fBc098339b37fCd76f88d39428633B7111E6,sing wine act left switch broken isolate ship tide ridge assume wedding
0xb09d5c740e5ceff3ae3006f35fab69544a8ce7eaec1b40ea372e71fdcc9f1c3e,0x40F7961E557b38c2fB3442e22208612DE1ab9a6c,economy brother digital cycle pledge crop swarm jar change cheap scare apart
0x0570392633bf21e39f9094e6509c61fb0046df8bde7d98055c0ff88c34f1db54,0x4743F1a7142775682f940efFDa0b7Fa33264B6d4,senior point joy start assault together evolve hammer smooth legal vanish carpet
0x648ffaeacf30739f7c4013b52c9e9987cc55ff711b588ad1a43d62148ad6f028,0x220AaC54CD800553AD04E02739681FB2AbaADfF0,patch piano acoustic crucial interest picnic casual marine raven diary brain culture
0x0d97de2ff1a2be0bf97c8b3dde58df11ee097a7b1da64d7bb6f3c60ee30628ad,0x47b179E80dEe5d88c6B2405249aF5AF3C0A8Cb27,size dust unfair judge royal wall fury give castle steak source badge
0xa637065cebe7e923bb48465ab0ab313be2f9c4031b07107a0954b2eb85ba9cf5,0xDc533fdd848E6545ABe0E2C061710DE083866015,cannon fine animal annual spin series evolve pledge witness then planet salon
0xfb79cd71a959df8f52c810e736a7668e97742db4533c1253f263707be3364950,0x9aE9CC08379894d5186888297ce405BE6E3eba70,chief ramp tuna possible surprise year also organ device ethics ankle devote
0xe9cd61aabb551b534a2e7df2ffc42ac5f72dfa7031be7de9a3f16fea42441f31,0x6C6260701fF02EfF062cb330CAd348dad1949622,dream health sheriff gather cool window garden sun nation palm flight arrange
0x2d713815134bd144d591783e52bbedb776c475e1e96349a611924a80d94d4d83,0xa279152774E5ea593dC47D4FC0Afeec7df258133,barely child aisle faculty dad reason logic fetch they invest suit receive
0x3b03617625f55ff2f1e481d7f621b9cb26d8095cad5a3a88216e78d929833098,0x4EEA0E1BdEEC1033c29E574F71d6185ede79e01B,cloud rubber snack rule retreat census unable subway reward grape release winner
0x58e165f0e6e1005cd24929dbeaad6df0046a56a754ce8cd60c1ecb18f32be829,0x350252fb1368967A73c310A73b752F3D8688419F,call ball powder surround luggage behind reopen involve kit wedding lesson identify
0x9148d88f30b62eb5aa9807d78fb02712f491acf277f82f115060f17013a71f99,0x9e0E45e33f54BD9351185bB9328E3cD9c9256E55,firm invite drop door consider elephant wet list smooth lava fine grow
0xb2c3655ab4d0b36faf972e38e00075cd73acc97c105da3584aa2a590bb67b9b4,0x8b68058F3B8dE12A2bF15106EEFb569aAe403dfd,empower rule box bean knock bunker neither disease figure fish next gather
0xb7b832bda27f6cde6e1a5f3814e07cfa9b9b54c38837a02911533bdd1ad55396,0x742f10770d155e0f4a02B3c2AA6fD7D435495f6a,hope govern various viable race subject imitate weapon actor vivid wrestle describe
0x234017be8aa4b3738226eaa2cd7bc2d1956a56505d3c65cbd75a7f32964f76b0,0x78FFc7B4Cee2969Cc234c32B2CDbFd14fe559994,acoustic uphold together green student soup clever push regular swamp wish tag
0x24138ca4d1175da9f59b2559f40dc6fb9fd789d7ea09bb5531f243afc973f175,0xEe5ba5b7B8D43E7F2F6d4dE9a4dca393AC5D9eE4,reunion chalk twin panel tail dune miracle eight dutch balcony daughter leopard
0x32f1b370df80f9051bd56d2bc89f8b99c1c6aef5bd436362ba192ac66285fa27,0x8e070C8F0ADfeFB8F4Dd5a38BC8331cBbF75ED9f,salon caught repeat analyst spread dad before cat fun produce ability blanket
0x37fd8715ade18847cc0143b70c511441ff82eb136c4b1ddb73d3cb023b7e69d1,0xab3C258cD0aCf66467f4681a1980b949942388cc,thing blast position add mean document inflict fringe husband notable tooth adult
0x562d8991b5e33d3ecacc0b1087e93de1c6170213c13c65c30c03a4fa9076123c,0xf4346c63C4AfeFb4C2eAf25Fa4Ec7b7AC231BB7F,audit gasp owner coral enhance audit alarm mimic imitate ball tuna april
0x94693632c3a5bc175f7680d943bb8c593026543d83cad9a4e682108977a9dcb4,0x9791aaDE786F6708441d065516dD2FE3Eadb6Aa8,initial mystery train salt maid amount quote helmet arctic talent slight lion
0x855d9d60aad66c537bfb64c2a81deb0229d382bb90216b80e88052ace258e38e,0x5fc9fafa560715BaD5a394fa4AFc23e1B794d45C,float draw music supreme dizzy rhythm tray alone sausage move ivory monitor
0x3601bf81c09e25ca9c5c389bee3c0ffaa4659b8d1e28da985788d82be60d6992,0xf062094eA0CaC159c674b5E4F63E31343562f8C9,perfect barely engine rather sunny cricket segment menu plug flush again student
0xd0b7299e03ab65dd71bf71a44c802923a7148ea83c3de86c64a527cbd523a085,0x848dd22352138CB890F0BB7D9E2df9Bd8D3df8Aa,sniff resource final crunch behave couch sad depend now panda fix catalog
0xab6bb8dcc2be62b1573e545b7a755f99cdae2aa735599556a2ef358825396775,0xa6dd3fe634Eb07A6b166D8818855E0D150ee5861,absent job silly vibrant pudding zero angry kingdom used chief pause chimney
0x6444d82f6cdf0151895e01893dd7efa231ec83727068b2529a336880aad3da7d,0x19F878B7fF177799FDAbe0333837B74287b51eb9,phone valley purpose grocery crowd kingdom online scatter pave joy notice they
0xd9a49cfdf530300c14b57db595b8b6a0d69b26e5b01966a8465f68898082f553,0x23b979290503E9c6b7411336bC3Ebfe9cD66Eb63,symptom cave asset clean soft muffin birth dial initial steel cement ecology
0xefc510ae7f5bbf87eb19e0ffc723bf5af3a3788916027a69ae68d944fd1fd456,0xf06711FF4e5749A3921fE615f9DCB7DeaE0a24a9,fever buzz genuine stereo mad diesel chimney divide library rent cake age
0xdd834ff59b061fa5388462cd3539b3f22c296676808ab95d68dc7e166c9305bc,0xCBDd6805B021F77350410a58B0761F6c8CEecA06,test used galaxy sad acoustic prison illness absorb dumb camera thumb caution
0x1f1846b77f6e585e371f92025153b926488903f9873b9a5c5b078afff3b09b12,0x915CAa5ab1fD6eb442A9D976dC2eEB2B4Bf87cb0,eye volcano potato coral reject faith glance rose pet kitchen bomb blast
0x09df1bd5111a461936bb7067ea65005f3ecaec51bb3791344baaba0bbd0447ac,0xdDdb9b8b8A99cFba0346eB2D9e4fdf45de3097c4,tunnel plastic give actress drink input gravity stage retire convince real floor
0xdd35da36d49fedd5c5cf6d1f86d0eaa30e087d14dc1fe1fba279233a625c43fc,0x2b0E9856670a814391ecC7ef6DB2003D49f676eB,jazz lazy giant remain coin work infant among boil river soul vendor
0x64fcf7277ecbfdd7a9fdb25b78f0fc8eb0e1eb44edd2942aca495d5883a5f92f,0x0F4dC49D7B6cF7C033499514f8Ce0Bcd8d007536,someone doctor topple search regular kitten lumber matrix author almost evil flush
0x770bbe8e5fac9bb2f3dbc493d67fdd023916ce8b4c62caf9fb6e3c9d11bb28aa,0xF738d387C97a272CF2E59689af5baA9C1CB7bfe3,unfair carbon will expire kick upon involve equal accident outside snap fame
0xc9274117dcc29e210dab6037114d7f089278d1439e520320f0f5cfca0d154f63,0xa78AFe729fE3f5231A814E590d2f5F84f74d456D,together clown accuse apology immune quality message punch month lab steak pride
0x6a5dbe9e2819f6314dfbbab99d33ac63eb3fdd3d8c678f062aa5246123c4ffb1,0x24aBd1f4B950Bd5035AA7FAD6607F99874215A5A,win point spirit enlist spider hill rural wreck attack nest employ term
0x850490ac676229a890eafc62e56d64129a4a4c958bacccaf3f8737b18a237b66,0xe4Ac37fB34DF6F0c849efF4285771077f459938f,anger mean army hospital accident kit ghost safe night witness receive hip
0xecb615fc35fcfe0bdb62ce2150f3790156319b8f1addbf2e9fa35554cab43604,0x187313Ae7D8119053F335da6a6885C9948a22054,dog bench team muffin claim tag cattle shift soda convince truly echo
0xad565b21776430fef303847e96d7c5e9698214a3cc08bedb335687dd400d1725,0xc2d10220E04DE257Bf8CEC888b9Fdbed31c57bF7,cushion giant embrace trip noise club fancy pact draw issue twenty verb
0x88e6cb494e674e63b7a19d80daddc880ac92c61ea00e2883cce669747448f3dd,0x321f8ea1a8a4bE57be13FCE7c8f4E56af4C1f1B7,ten patrol another donor purity lizard winner gasp eight express observe eager
0xda9901e1bb131b5f5f9eb4a3bdcdcb3aa81312ed623b3e9ac3cf5f374a0a1d93,0x07C0Fa8e84f8E349C7276BC4129C91B1F174b6cf,green crack reward front speed twin drama dilemma three blossom topic ranch
0x1d95075020a6ebcb6e5cb25d040c6527f2438e8f94a1599ebfbb3809af68c9c0,0x14697886b50b64D6e32E09dB641c51DD56133D0a,during destroy word inside flee paper pattern section real avoid soft history
0x688913abfc73cff79e239215d88c6609c243f8135abce843afc6e83e865f9628,0xb1aa5D50ef2C6Eb78AA84d98ceD69454c3a042A5,velvet hazard local topic media rug move ivory thought fantasy material mirror
0x139c0fba3728b4f059d87d7ce7439c61778458b5803703949db9c416fbf4c61d,0xE9330c82e91ae975275835541f96feEbcda04115,loud true power defy flight fiber donate plug project stem assault lounge
0xe7bf6032efef7796a5f1fc65d879bc0d3ba5342fb1559fff19ab83be4932d0d7,0x9bb5cd795271316F5877f286DAd15187669b1950,admit fun cycle force motor great siege document dune erupt ranch viable
0x33ef1baa5ea0e71a15d41523aa59d35289af5d05a24723450fb887c74b2b8182,0x15fB9bF543FEaB7A4B05fae4152B4a2F7dF8A340,retreat tortoise accident decorate train balance crane hazard current news mirror pepper
0xb0f29365a6916a51627084099f394d52316434f3f5735764e35a99c616949076,0x23F32F3E10218DCFeF931810c85E5bCE946Ba3Fa,phone pave purse goat dinner jazz seek among have shove pretty code
0xb255ae1011e1b7c4fd8f221e617e003ce76ae679c4cfe0e6cf37e2372bbc8cb2,0x3bB4A21bC4c7fb600fF4D0FF0D7EC8624ca4B852,slice cancel admit bike cruel rotate mind addict response fatal tornado bunker
0xa689b047cbea8f78ad6f0d99f6a3fc7bb5c430f875946b477363488c28ec3828,0xf44C22e019955780801938C3A5757caBFb86aFF1,local daring milk repair rubber animal spray audit jar badge favorite champion
0xbe98b1049a0a17b2cc427ab3ffff62ee8e1ef21c53bab95cd8e7acd52066ed8a,0x2ccB8FcB23137e83E24De2E9FD0c6C11C01f15a0,same strong mercy fence smoke race correct high way wash business move
0xbd1abc7e18c2933a35458c7855e7cb24f38cf49dd412e25f06fd3035d8babf86,0x4619eB12Be51A4A8B155140D54006301A1162475,buzz will celery clerk derive axis hurdle length enlist cactus couple defense
0x04bc08dd85cb08eb1b665c33e4207e1a72f4bb3d255da9c75b224e1b826ff537,0x5Fb3Ba47800Cf7Cb4e7D1eE26b1AE0308c670527,sock salt pepper lucky task section dismiss math valley convince lava trip
0x10876d8c254adc5bbf2d767758397976d5106de3882562287d35a3769a30624e,0x17565a4F41cbC8593bf17dda3550E4884102Bda0,radar sick luxury search story resemble match icon above easily payment burst
0xae0b9b134c582bc65fe9301d73607354c64548b8793bc5351a963079a5f2ccad,0x5Dbb578Bb0308c32a8AED01F1B18C19Efc31a203,obvious employ gold danger online unknown again agent inner smile census nest
0x8ffcb0a6df79304b6b9b857ef0b77108c68e7750edb02abe1653dd1a2a0b911b,0x6628cAFdb035E27c11DC9a1AcB3A9E0B74cAED15,evidence foil loud wheel wrong prevent pluck toilet toast country admit domain
0x58847ba7439d6e6047b5b4389d919345f72927adef12d5f9a9deebb2443a4e04,0x5152eAA3Fd063D59f7Eaca9e548913faeB357A2a,rate often salute angry mosquito later outer pig lobster inmate fit flame
0xb3147505977f55f2b9f63a5c1515305f0060daea8b87ace6f218bd0d6c8ab46a,0xFE3aee0AfCfF5FC37831622446982EA116b1142a,found carry carbon divert style artist uncle before gap teach mechanic orbit
0xa0611d37bce7255eeaf5eb1d994c740d5d2b921d91b9dc1eb7c9ca772f1bace1,0x6569425CC3BBC686e4600Ea1758f4a257B1Adddc,slush doll pill voyage green gate deal woman gorilla ten maximum upon
0x87a974031106ce7fbce83391f3b1379b31c310158d9fb79ff4150e7c36f31fa0,0x3a97341E9D43Be0516Ec9B3729C04813d38c684F,fresh fall rubber ridge embark affair north interest ball lucky wave stock
0xa54aa17dac14def6132cb6e3e3ee0bf056086d52178df14124893437604d0c2a,0xE6d83acC7793DE0Af67b46746C202eb3Ad0aB7dA,patient wet double job tell bar imitate hurry enter range shallow give
0xb2cb28cdf38c8fc08c05209eb0a284d38c8561361830660b6ab5c7a65207f303,0x749E83CBd6290fa56481958454426A46ACDD5Bfe,latin snack innocent equip always tone fancy stamp fortune cupboard balance zoo
0x40232f6cbacd2cd74188e0ffee4089bb9fd5984807254d2ee6477cb61e38f6ed,0x1fC5bBEAd37Ae979de1eb07Daaec4Ca8abd25ED0,cousin tattoo still story fragile valve trophy siren inmate velvet novel tobacco
0x520dd849bd49c34c3b27b2af407fce1a43e0ad9bce3d39399a0e94b7e380c925,0xE6d494A2363578F10B1eC2195438E12D14d6e3a0,hello sugar slush pause conduct view grab live agent tennis only dinosaur
0x84d8ec6471314557b644318ea2fdd5d2684dfa5424b3d708b0036e5b3f0e456f,0xc712fFAec743e7Ae4aAC1749b2cB573536531A6d,hub street thumb lottery evolve myth crazy cargo sunset say crouch yard
0x3c74632cbcdf6302052f70c05778ec4ee880f4764ed16234c79ebfbfa657536e,0x22996fFd4FCeD4fa68CE999168532EBB3E82E1a6,climb truck wish ability wonder someone device angle involve chuckle glad income
0x6f829bf146d9b5e42a33e80807c78741c697090ed7c3d3033a1970b79b50d7b3,0x36FBD73033AE69d3245f8182EC82780817009f32,rifle liberty small announce emotion soft energy danger drip wing alone pencil
0xdac7b866637aecfa20d5c880c81a13b9a94e66867760282f32956df0e87ce6ca,0xb9C0f59ac0D51929E76bD1D63faC67A62E696630,jar devote impulse problem track ankle lesson across orphan cotton kiwi husband
0xd20b9ba2ab736f8515cb75e74204ee633e714aa640340e917b306bc01b229760,0x079f15E4f49b7bFE083E5CEFa5DcE23618A94Bf9,slogan gold side call color husband afford reward company wall volcano exhibit
0x551e7d0af172676013afac071c812bf8da5cb155f04a465783fc544dce669664,0xc217774EeCF47E7769515C4B03C56bbd6D109376,shadow lunch version vacuum regular twist enable settle miss trouble bubble seed
0xe87ea2adc950cd94861408706a837d2ba4bf0f75edd759ce57db1c8a5d14d99a,0x78109599bc4E1d5FbbCC9d0b0d0eDCE8410A62Df,metal sadness because cannon deputy dynamic fox exhibit program web lunar hurry
0x5d60654c0341246542e809867d265bf6cc81808b5f869f7a8c9a9d4aebf9d3a7,0x17C106C623c4759C62e21Fbb2eFa81Dfa28C6e33,arrow chef ridge mule vicious skirt bind planet child angry top bridge
0xa13cea0933e8b1b0bae50681eee0f4ded359cc1034abb5ab2cfd3bbb84704c11,0x6AD769C530dbaCA2469f147C7eb9939D137c70cE,skull coyote journey envelope patch slice equal cry absorb inhale say draw
0x8dd18f1692da345d0612a25a72e2cedaa7e05bb54d6d8de1ef44a1ac89140bf3,0x64E6237A5E39c7f4f5094d30472E2C1e3d12e98D,text entry chronic either friend dragon immune sheriff minor about mule hello
0x01e1278f08ca9e9ecad79a517ad865bc5948da0163ce883e854e8d0562cc6414,0xc2b2BE4dd41132fC1c32c66E60cBFa186613cb7D,cruel involve large sheriff organ play melt material boat blanket bike song
0xe7589c00ca6e0ca1dd74158adc04fcc2ca5dec05d760d710653c5ad75355657f,0x470b6D9A2d928646f8c31DF4c1e62d7DF011028d,amount fury squirrel cream shed dad bicycle help upset march danger path
0xd2b771f858dc1440cc11d3e05f64a5eb7c1a009efa21ef019c49f33a2380548b,0x95F653f22b1966cD1A87dCde80ef279CD15e750D,net garden seven home subway fix lucky envelope master supply like birth
0x7a8766c9c28dbaa1b7f4d40349ba04efabb45d0d7a88d031e7e1742fa380db1e,0x918827321EF080350F9f155fb8Fa2471393202B1,anger hurry silk able dynamic business grant core about client unable salt
0x065356c09a63b66d57ee21d1b9ce4e11ab0ca8acac515ac05ad1aa40409d2a34,0x7afB163bC2DC54A32Cc65F635e7AEdC2BB320547,vacant game advance fruit mango today soldier genius achieve arm lobster spray
0x17fbb24047b5d79d7f6dbd81457eddbb23fbbcd078ecebbd06b28c70cf6eb455,0xF9E30806E4b4EC20251e47B758FD7D7B97884Df0,wrap barrel spawn giggle gallery lyrics load lyrics equal combine raven live
0x6a28ff25a3b16b3e26cb6c285348d2b17c50bcc357457adacf91d03d5c45dbb1,0xb8e57f16fb47d33aF04ec93a2e1cBcE14780f3fA,pave size glimpse wrestle lumber window ordinary switch narrow pumpkin toy already
0x1432bfe98a1b2334265b39ecc710537c2e2f02e4819842650ff08f64a4710472,0xE2393d7019363c0824600E8DB9bF2E50C262c780,air fluid ecology poem sea sugar inspire canyon own adult nephew stereo
0xfd913e260564405ec5713e0f3feeb7c0c094156f75ff5f2dc8f22355c2697558,0xf5B17b51b7a3214236fA1bDD745F13b3c50034FD,cactus speed undo face empty offer island margin truly enhance basket strike
0xdf0ac80cccbffff739f83bd1a811c25bc14a559e5646b47e0a93890121a1ecdf,0x81453961C8CFC597E30dAfAC1b74BEbBB286b23A,elder jazz pink immense mango permit celery divert shrug sketch win cinnamon
0x3760374e7af0a4fa84ec1c40eaaf0004c4e5473def8363c43aa775a95a4c048d,0x3cfF668fc5B57D40F926e3eac20a1779722cC7A6,point vehicle margin dirt ridge unknown peasant bottom dinosaur dash long polar
0x33d13ea1a9fe93032641c903e9723b71f9077608c2f297ec85ade87b7142e5e0,0x0436DD23215780d330042b47b6981bEb113f9aaD,spirit impact vague question push agent digital metal circle board adult help
0x2281f711299316cbcd56d6d05cd7c6aee51ab989f0b4c749fcb90c59d8ecf15b,0xd5dBc621f910c3F4d7b6b6E48880efee83df2ADF,coral load size nerve vapor chapter rhythm tank destroy clump jungle noble
0x826cfbd5953ff0e615c845f2fd281b8669d5b1b68f12e9dcd1ea1746c5a46c8e,0x58256CE25eEfc6076EF371AF7209702bb71B0B94,web index purchase swim jewel segment physical second cement hope candy hammer
0xb8d8ac9adeea103804f00fee7211567860cefb0c7023a89d0c6fd677de3a6842,0xD58b861c56EbEdE7C99fb46f0C9C85678BF58e0b,glove bean brave knife pulse govern blind deposit lonely lunar virus subway
0x7e4d97b8aa460d9b6a8b7096f540a6b3fea55e7630b440051a8361d68a1e21b6,0xc981d44371c6cf64e1BA15d97846aFe9A238F6eF,science gasp jazz sting message orient auto town because lion depend hidden
0x88b402101b09a223dd1d2bf38e89e24f8fdcda7789ee620c5309af06ce545475,0x659eeb6493f25EEcC5896a91B6d5F6f55F38e3c5,crumble couple shoulder room liquid water hurry trick omit swim forest bind
0x28317f84879f9549878c07464cebae1eaecab78a1ba04134d1a01ef7479bc96e,0x7C9B42Dd7A72CC5065Bd10c70a05e179185AaC92,into aisle high steel orbit spice dilemma doctor essence enter federal regular
0x6861948ae5316524a13e471736c89f8d573ef19294e976a05f533a235643a110,0xc3af0aC2989940358585bAE9e114fbB9ac955444,issue common ship ability acoustic market alley circle identify tent sugar course
0x2a22ecb6bb9917ce2f269aa3d4f96683a957a127eb87e605b490e90bc1f084f9,0xDA2a257a2411586D8da20762cF643B124CA4fDF1,inform panic update lamp friend explain supply anxiety pill museum party hat
0x68bbf23e2ecb2cc87be44b46eb62a6c925832645a1ab57575244904c37982ac2,0x19C095814e91EE437CAa706Bb3eBB8f2a446DaE6,lottery develop timber ranch wait post erode cycle embark ridge frequent depart
0x50f9ae79debb3067b48e6d0e99d45c46dbd45cbcad62f6ca74aea8ecd73aaf33,0x924D8aEE867Bd377d3ABe4d0705847B42EFAFaa0,talent mix clarify final angry census olive exotic warfare proof leader blood
0xec957ddd7e7f1f86a1d37755d64c927d508cb7a1c97d64e23fbc7755fa9833a3,0x436B92195036D51c88d9FC91c404ef615DA9bCa6,table follow sphere visa mobile gun toast awful mercy tape yard crime
0x36d9484fad4fe20656e9e4aa65ba977bc52a8e14bdc2d267837a9ae2f0f61c5e,0x6f0d283FDc963280f30fa581f4d9a28483F04657,purpose stick switch turkey roof you glance unfold misery liberty cute pass
0x6a51d864d8768a7d58c95c089cb2eeb0712d6b8d254d5fcdffb7bdc8563daa87,0x1a63628C6bFbe6f2D7Ce0b394FAD9058aa1f0C52,drastic rigid sail spread feed abuse february nature saddle party talk display
0xfa699f947b2a1dc4766ccdb51689ba63fbcfff814ca98ecb137625cab884c793,0x617aDC024f867926Da08241379698E9e421a76c6,chief orange jewel canyon broken tourist piano pond okay run flash solution
0x2bb3b4145123782ce6a7851b82c943881928424cd81f5cdc8dff42a00c762262,0x5F7051590187985c3e18Bf18D112c777Ddc05eD5,spin local wish employ orchard increase hobby immune crazy uncover suggest link
0xa662791b2d7682e5d25aa02081452ba33ef00b9c69b5e9f155fc6c75fe254fd8,0x090931297E5146638B3AfEf1A5753Bb487a5EAc0,capital marine law survey zoo furnace capable parade ski axis economy country
0xb881df0db1b2e867a2e666fb2cfa5c4de1016ad6f72638e5f36df9ebaa42e718,0xC6ae1c30561042E19D9c0df0a002b1Ec8f801896,raven end trash indicate rail inspire monitor shift artwork kitten badge ancient
0x428ecd188b751eca1520fb9f36dbc3ffbcd239051e4a6f2a197c4d459052bf14,0xEA44b2BD035Cf70A377C233BEBB0F9A443F9DA60,leopard thunder custom bus first trophy sugar color identify vault push youth
0x9903b3618fe6288f772be787606a77f8b6d33c86ee8a5b807b3d77927e7bf132,0x64eedb8aD055A219c96ADa12C51274777E794404,vast apology walnut jar blush drama clerk pear more access miss step
0x904b11d27587b39a6025e1d81aacbaed7813127719d80c4e3e7735c796ef540b,0xF6366Dc2a5198fF1550854C1028b0f7714430346,toast rabbit hire fruit panic note arrange major frost awesome kitten mandate
0x4874a9f3b51b847e37d36b16b4963b978f5827276a8bcd768612261ddd227956,0xd437839134d10982104650E0784977e2912C7AC0,defy mail sell dragon have swing twist hazard clay price chief detect
0x55995c93df6acc9633906c1ce4f198dc533b1ee69ddfda7f2d0064bf8828d0a8,0xA71edB25ad65Cd5B6053b364d5cBbD1F34A1c026,luxury trouble lunar film urge destroy head decide beyond elder fantasy calm
0x0db863a725542ae4aa79c9a404ce0dd1a06df4a5eeaa7f8a836ff1dc07e213f2,0x4f6056286e1218AB6E9A756d22DcC21ca0De0504,prize deer nature sun mystery speed link wash panel material black employ
0xac91326912876f1499b3c7d044bbd02991e595b20e54e5c1db5277b1b63ee45e,0xC0B144D3014F371418EA176D24cb53E5c5E26E5E,vanish always issue account trumpet office open square bulk deliver torch remove
0xe13fa59a4b0b707de8a42860f9a83420e6d04aef375b48396087b814f56ae490,0xD7bC4Cc3136068A096163Aa359d3fF14506D1752,apology situate action minimum rich hammer quote gentle chef reason gate marriage
0x01c65e370868506520d5a2a6b5eecfb6d37729e32c3e5da526a75ed262bbd927,0xf2CC34a3d58517486674D00B0cDBA5449dd9FcC9,icon erupt abuse tone expose garage motion gallery step over shield mammal
0xf87b49f3eabefc96e5d22f00a94575c68768ceaa394143f62f4a0a3f04fdc83c,0x6B17c78c92C7ACE435fd75050b563F7e74f8A1fe,pupil puzzle toward tobacco power trade wasp gauge huge alone typical this
0x21ad8310515875eb7e9979f9e822faf8826d0cce12787c5633d21bd6a156a9c1,0x7EFA2C4cf56bf6e4CB7B88358e4F0bAd716cF021,midnight season guilt income diary coast lamp invite west banana foot text
0xd9ec88d49e763e857d27ca87504032201412d548cf3f81ce48c6601708959c85,0x8Ff9eF4a998DC19650eF451b9958Cd6Ed0FEC820,around mirror guard thunder coast panda wrist chapter audit copper clutch juice
0x3a67a4a8b621b3a2537b6e1efef2a7cbbf62197e3ba639b37f0d234bb2c58b02,0xC2a99d4b120513D1Da41eeBdAE7B717f4741372f,wrestle shove depart invite lion thing belt naive human any pink suffer
0xf0117377f24d4a3d440e446e87038028903722a225128271bd188898a2b87451,0xf81062B4B83BBFF88A4A0F4b1B97568520835924,swap wait snow this prosper monitor call bundle carpet napkin genius say
0xfe1a9e9c637c6916638c400007e6a85846dd30f0226642c90192a902b95cc4cc,0x97C081998240cb474CEa671f4C5218615A6A9E7C,fat ranch zoo noble tuna lumber birth vendor merge drift blood style
0x3953b4f0b0d74a7eee3f29f7fa204d64c206c44e10cb2a2eef4c30b095ace87d,0xd46a9c5eECAe06Fe525982FC23Fb34e98A12764d,veteran spare fragile dentist chase dog soldier beauty asset involve dragon odor
0xbf2885ab569ec15c3181bad0b0a43b9d8e74b4c25152026aa557587221aeb010,0xd01459fD9FC55bFbB7bb1afD0F53CB86014e6B5E,control extra state royal shed type panther dad primary grow ancient balance
