PrivateKey,Address,Mnemonic
0x7d9ccab3fe742d115c8faac7ba31be6ada529fbcee22923d81cc4401246f6514,0xf4D57d06B6F30Ce289E60D362C678Fc6bF5d4bcC,immense attract skate sound color boy real party giant urban adjust inmate
0x22795dc40d24688a58738dc17ab0fe8ae980403c4f149cddf69b6dca6209e0ce,0x56706413075F596FB572b129843A76aD16a37216,hover stamp lend advance couch mistake okay cupboard slim horn twin illegal
0x16d0a0f0289699043ebcc7fdb3b439851d5606f6c3b485a3fb7112fbd4f2d710,0x6B7dA552Bc44D73A152834612d688cfD97c3fc68,armor exercise deputy unusual predict chest frog bird diary buzz wedding issue
0xeb0eadbb562f3ba6f861d815afce332a4ab6d3fbb415a0680ac1f29f95a28a70,0x586796257E028A10ADc20d5eA6eCfd6d2D71a6b2,polar head suffer tomorrow keen claw address pear elegant orange win tackle
0xc27d1726a38b66dea70951289ebd62cf20f4c7c7cac7b62d6ac5ecc16ad1367c,0x120c9aa21e3f174AE6428e51Ed62EF67d35827a5,onion fire rural fun subject gesture chair rent evil develop sister pig
0x37cfd2645c21bfbe3e4a68d33a04951ec36722a5e397359fda8040dca2c3e49c,0x1461DA1895b16a23D66133c7947A200811E9630d,rebuild lizard evidence arrow bless alert else twice sphere profit unique stick
0x85fc5e43844ff05ea4c1bc0ba923bbb203d174c5fef6c0af26b90b273711824a,0x9c9cFb4E0A99FA3AaDdD7ed1Aaf02714871E2375,antenna very sun food visit behind fun fold clown flee despair giggle
0x48cafdee09dd5c24c5a1d33ba7b517ddd27f6cc2bd8d683004066e0d84e0ee16,0xFBbfc2dd47412aF2Bd1BB42DbD47c1A94BCae100,pattern auto chief spare school defense minimum call eagle vivid donkey tragic
0x9ea1da679fdf2c9a5d41181d17082b257c07b9fb7da8d4b0758044c11cbf1143,0xcc7174a5D0f0f7A375428d3eFAA10B637d0e50Dd,slow object camera gun library ecology salute erase absurd pen oblige matter
0x9ab12aadbe4f4d78ac9a65509fdfaaa7b16157f53a8fa0356675d0764c55cece,0xB4D3bE73599AF63587Ea75ab9D93c9fFe5fdAfb6,grit drift kite enforce slow goat length tank horror action evolve satoshi
0xd8f249709ea760b2b7d891d3c8658ae63025571944fe415b944090f4540d9cb5,0x7C9FE2762EAFd3A83F1C6e2bC943318E3b73Ac60,spell symbol mind ankle quick then shadow virus skull return wedding wise
0x3280bfcc045aa94ad6db3ffc599b764ac903bf4ef4f88e80abf6437b18b8f570,0xfCA40639fD9967cbeaaE71Fb19C9B3676382c98B,income book grape future relief online receive cook husband catch item foam
0xd7580c1e2c748700f2e42effebfe3145500bc61e8ba60ea854eb10e519dc71d9,0xFDBE8e51B6F6e96537005815bDCC8b9e22aA536C,define final actor antenna level infant engage dizzy speed hour session kite
0xc7b85af3b52f9982fcd723e764ef90e4db7d8cb7e611bc1ba29105e1dc814f15,0x81cBdb689b42Af816b215751CAF9ca03CF52F5bE,chef double speed urge draft obtain crush airport century vessel sentence bright
0x02dc7afb8e09003f953ed19f4dcbe0b41f80ad16cc285ae27cc66fd762454c2a,0xb91035C3B0f99CdFD3dfDE1304597E04adE0dE78,renew orphan sketch afraid rifle guess farm coral hockey knife power dignity
0x8bea39dd8131bc525edb28e6f7447969f9ce6ce77ca77a970529f9bbe71a4078,0xf2Af0DaDFD7441365bBce29f6143683CDE83B98A,space wild give wheel cupboard exact knock leaf pass stand police trumpet
0x2cec2804181c6c8cb892d225a9938cdedc1c67acbdd2cfc8bc8f459eb52c472d,0xf35a1dF4425a706EF26B9Cf8594704Df9c0B1460,soup struggle inch enemy purity rescue unfold breeze churn urban reform enter
0x12050a35e0b4a3b08169e6ee97f8ac037f20c07bf56f1715381c6023f12b2bd5,0x8380b4Fa25925E7ef19F645e00a26B276acAec24,viable promote razor smile pistol swap knee weird birth fade orange receive
0xe4cc3e339640a677ce42cc612b9251af91f9e0b78315e245dfa4ba2535ed8bf1,0x82b5335959484434415486aF3492fbE19ed904f9,depend lake airport prevent lizard transfer response shell carry lady mammal gold
0x132084c7a4909c1214d731753c058adf3a3f6113a756709987ed98bcdc23fad9,0x49CFE40d2570b7b409c28E72f4d71536DB778BA2,kingdom sister end volcano course song like cupboard glance violin fine actress
0x6791a828f0bd07d784c9c66bfec2faf214b5b34afa41fa6db1dfbfdf4fa86017,0x0Bc0a9d84AF19232D2D9e1C99A46174A2C51458F,attract hurry knife coast battle various mail vast syrup ski medal veteran
0x7b545d40eedc4aab9f387d1429c8663ecba37de7ae5a1569586a55d5d4354204,0x6aE7bF3d33b2F283580e3880AdCE2Fe4A4DDD146,anxiety perfect anxiety calm three magnet heart cook awful destroy carpet height
0x0fadd7f24537e7c4eec4c20845b2a779232431ac863578b1830167f9b960c1f5,0x397dDDB4cB5082dce9BF32f950B28d6d218179C5,wasp once practice title tuna peasant guide onion laugh behind desk voice
0xf197f688e7182aa3094e93831eab2031729697f86c3b064d3ec24b0b33e5b3fa,0x806bC984B5BF43D808ca89A441b0E5f804c50F2C,apology erase divide noise wreck october melt record phrase define wheel common
0xea19c6a3bfd675bc46f400f2161253dbf45fa27bc6f13c9398680029ea7741fe,0xA31CD913E94916C3b4dA8BBBa459baea11f61f15,popular parent become album media common family deny wrap off album inquiry
0xfb074af3db5c9198d3919f0a85b0f529ce10c2b6fd1ea8f7dc61c9cda4858627,0x0F85151310ad4A8c2F851485D31B9D589D470Bd5,apart busy collect display airport grab snow term artefact rigid picnic turkey
0xb707cc15150078cfca1d5e6f1e843266cd9b66ea67631b9190f345e1073cc54d,0x2ef34d8481fe66cd8F2C35190Fa8e591e3FA57B9,donate trap conduct entry warrior entire pluck twelve once area six vintage
0x093d849fe0d0ca35a6acc43a53e5aa92ae98f91a1ac68ec71c602c51e8995687,0x85c954c6b169Bb14929ed453c73c61f266c026DA,butter permit wear walk stage health ghost excuse input arrest infant innocent
0x94f95afe0b3707da15760cb390ad72da47a7a02b2df1dbe8baaabc71c350fc22,0x103155028a049424C5A5Bdd9413041A5dFCD3d29,infant notable erase celery claw warrior bomb fossil hope envelope yard afraid
0x985410460c480fec7ad325211dc0236e545cc1bab59bd410a13c0e8278cbf208,0x45d5F8D7e25DdAA75a9598eB2F0705195F17F467,matter drip photo melody cloth casual need bind shallow sheriff coral soft
0xa23299d0989fda8e6e00708ce8c6c4821ff2737d563507cb0d8c44fa059c95a5,0x1FF2f30dDc4410BF1e17800A6FE70aB645aC2421,garment scorpion aunt table sword tent that rich agree between fly cook
0xe377628a500c8cc4f27f09cc1dafb886ed7f6380ad858d0e37d6aea7347373a2,0x2CF0b8E4A0BE35BF90D4124107d2bA40669aE13D,prison strategy tilt atom install toddler wonder champion margin inmate panda story
0x2cac14ddf4e6f23069f4ea9d76791571256b111ebb9e59515f07feaa2be56dba,0x9E8D46359C49Bd54FE557EAdF361390DB8DDEed0,virus dragon index oppose carpet beyond custom forget buzz valid mandate sight
0x4f67a7457ee64fa9ee4dab0a54718d44bc3337abd17683c861cc2f411db76b0d,0xb1A8d3998B77574Ae8C3DcC2c3C5E9a8d2B16abb,panic ill super north album love screen cause twist stool moment universe
0x4a42f46ce8833717e522d2c8dae5694b66ea659d5756e5023ed95bb3d87341f6,0x6904625068c91121Eb6fEAFdbe78BC7c3aC64B60,fine catch stage tooth bike crane damp artwork west vapor off awesome
0x8ce8ade4364b22be8a2935024a2fdd9f4cb22fb6707a68cbf00f80c534a8f876,0xB723a50d0ED6abF67cfAA9c8C939eb4a0b7896c3,coffee antenna join ramp merry resource boat almost awake letter shadow robust
0x80e888c7b822a1a8ac199174bddf6fc3a82dbdc848dd30c6d907e0021a6d8a52,0x8A77A7d3641F5926856585d88e841EA3562a6905,upper bulb lumber update tooth winner damage virus random sting process save
0x90b1fcae7aee8a85107d3c1be2dc71a9f29287cda16108c108e2b5ce4d7a872f,0xA491B2cDa4a5adb4bB37e967568a155DB74Fd2e8,elder concert cable normal service exit insect enroll envelope choice chimney knock
0x648a7ca65b5d3033f7a273bb7a2237de847b513f347db56c48477798154a27b4,0xF79Af6eb2B66C0C5Dd87Ec56C579918294DAD8d9,lawn damage bottom side daughter foster human family unfold excite stereo nuclear
0xe9063add86d34d4aeea5165f86e85032eaba016be6766eaa40807136174f3724,0x7f103180f6C3938Dbe8C6dF4198f3fAF0Fb28A73,spoil rally month midnight super result swim laptop crazy limit bonus harsh
0x5254d1f8c42550a5307e6fe477064a5a46e8350b515d3edf92c635a02b89c813,0xcf8c8eae7f227A180Ca84203b32B6DCb0f4a52DC,okay grant carbon hurry tide near sniff diamond absorb tackle moon switch
0x2a788b277ca1d164fb34dcf83a1602656f0fc52770bcde6e3395eb6bbdda1dd3,0x6B44B2eDEd05894577B792Fd09a9DB9fd886b61F,firm popular screen seminar outdoor upper zoo size foot wet gadget woman
0x0edbca28de13d9ba5e47e6d2defdabc8d7216405cc1d90c7ce0f3b3258fc6d33,0xde5E8319dC6df0D2b7159812A1DE06B823d299B5,drive absent abstract trouble brick cage fever twenty black odor economy impact
0x627e641a5d35f498b35c22986b068f2cf9af5542e3ef38eb5ffbef54d7b7a83e,0x1B9f8cB8795597c343518f4787A00c3Fefe212dd,original mail nose senior sausage expect other garage finger finger lamp layer
0x410232ae7bc36efdeabb76f08342088111f285911d7a39fae9fa5fa72c9faa39,0xD2c48375e99c1d12545007bc3dE4605629bF1c1d,gain tomato play planet crazy escape creek baby lake peanut snap grit
0xd90321928fc733c35cce5c6fa5d573514a7aa8fe48a0970092d58fdc69af6322,0xe43b1A99CDa6876FaAF3aa8Eaad3501617Ac0FAC,ignore town duck eyebrow claw speak actor lamp card tube review near
0x3e7b0f0c1d6279f77e57dc7cddca647980ce6399fe9047cdefc93e871284e507,0x9c23d2C9F75a2DbB340486475e8b1f100531dECE,bottom logic letter record act seek question inject price flame tag normal
0xbbdb05d861e01ab23e7235bf7efbf8a4c67b52c42b8ec1cfc70012a432e22acd,0xF44b59b90eFE1D827Cb5CD6b0Aa6E036cd3e320f,produce tornado visa world pluck hockey glass among fetch crawl seat knife
0xc694106921c52009b076a75121d7d5d40957a39b669de14b57748a9de36ef430,0xbAA9ce1F179Dc917Ba0c022230F05C5826eC8002,useless delay deputy direct arch present sell logic engage eager love cluster
0x0ec6d02213c5f560d9371eb8e06ccff010513b990666fbc21ad20c5d637983d5,0xCc9776f2196Efd2c05B268B16Ac108135fE590a4,rich melody system struggle addict tomorrow tortoise custom version vicious shaft notice
0x8e606d63e711df6025798ef91e48bac95f0a7c48e465ee9efe8af50578c1db08,0xe33308793e6cb2AFF1Dd63d3F530049F7a1af10B,glass boy dish insect nice blood elephant link cup giggle cream sausage
0x86115cf89aade187e1adb967ab03a2b1a132bb64b7ae224ea244d90acbddb343,0x0b0e8A2a2264BE0B722AcA05dee63e62744f87D1,urge cloud crack civil praise sea type illness music salon illegal glue
0x58ace7a569ad9e9af88d008b3765155af6ad14e1c345c9044cb46bd128900f8d,0x35F571093D3Bb703E635b1A0D04c14493f401bdF,exhibit wedding aspect ship concert pride minor diagram visit wood person volcano
0xedf7e3f2c309d24b0464f90302e949ac6d92ba55ea879f42490ed9a2015598b7,0x4B0c9de254297393c0c51Cd86b3CfbDc1dfD5BF6,awkward salt burst sense firm lounge organ use parade void gravity shift
0x50fbdcfe14a1839cc068f00d395781e082ffe06a226e62830895e90986cbe66e,0x51390a1c4C11f34180965D1B23fF4085f17E6b5b,side hair stereo pink climb tool disagree welcome long weapon rally hero
0x9634d108ec649eb3678b0580a2eeeaa07ca7f0f8975e380a9afb962404abe08e,0xb56C3b8f373cae316F7FDC14c9A64D14Dd959cB3,very drive blade ring blast mail excess cherry funny asthma drift snake
0x4b05002f8f4df91fbb7402240e93143165798967cc21b8f5cf024e9d3178c3f5,0x8cA47c30B60Afce918f30BA926230e29aB090886,unknown chimney firm glimpse daring gate fly exhaust evoke behind vital merit
0x51275ba439ac7f4ba7d93737ccb02c061daae7a7ebae6ca73a808dbc4abdbdc7,0x1248cCd31647fD8054bD8622d69a0E4B3297604f,zoo injury thrive pelican forum because twenty rival excess setup maze course
0x5199db2fcbb57aebf03046f3b6e67387b36d7f8fadbab7674c1241c9be9ce98e,0x9Cd7b68393b89385093A15Ff8e2d635A2b11224A,perfect fly code auction surge lonely clay goddess curtain hen sail embark
0x40576fda231481f489876693614a92f8454d659f7a13282c2aaaa95b79992c5b,0x0c1ECDD295087D476A7CdCca1B4d940ad8A1A0E0,few sponsor fever fruit east tourist volume stick tuition cricket speed void
0x5dd5e7876a0e3da5da4f591bd68ecd70bf695319cfa21ebceb0a856e09e408aa,0xFfb7051Ec724E1C26bD3693919398F059A5da7fc,yellow seek topic toe improve length tell damage inject coconut hair wagon
0xa865d468211bf505a771e41c88d14bdde40066b7d63ca9169bf5568d4c2553e0,0x11fA83394e3dA7DEA6174bcB95900f8eA4B96AC1,sleep fan sister thought long apology busy absurd predict shift race nurse
0xfeee3f55feb5f89b2c8860df1deb0596a00cb94ebb21a1622348b37772a53b87,0xF720a889821EB962d4824BFEeAba19aA2Ef75465,liquid treat person amount unfair leisure image since property eagle rabbit eight
0x19f7cb3aabee914550bbb9b65b7c5009253c4f1bcf4703307237dfe27f59ff93,0x13c061B3A02b600DA55240CaEBF6A86190266719,truck mix wrong era cat angry glide question taste tool outdoor list
0x558a36d801dc9815f26a49eb6cf2327fb857fdb00c37b70cba00f7c44ae68a90,0x3fBD847C0a6EDA9cB1Be67a00E356A2766236195,police guess mushroom exchange home expire know gesture tenant picture prize notable
0x7b13579bb63c9a5fd6c935f2ddebd6f8700eeb4a6a340ac8f77825c02d15794a,0x74032c28ad7F5e7D1044c61fE8b24c97b834ED94,say tumble medal arrow primary cruise sponsor tonight relax dice beyond wisdom
0xa1c34105b032f48065e30931ecfc1260ddbd690fc9737f0c4fbfded143ced382,0x544A0cf2BC84183178da496541E5BcF6C7268785,behave oven dune baby gather dove three six bulk seminar sand dignity
0x8770f8fee4ea7d42b18e06b1dd8f78d515c9e600f9e68efdb6b87292bb501ed2,0x6AeEEa0F454Eb8F358e164040fB2560A166eCF10,spy shrimp friend flash april uncover equal record prefer hazard ladder popular
0xd6a67018b4d9308f49dc0400817bfb39b9c1d885483b28209f7cd53032e04f4f,0xBc5327a931eb7F6FD4Fd76bf2c5703bd0cBFE223,obscure kiwi erase wage claim wagon clog nothing crisp verify local oppose
0x2c2a0d7b4774803d5308711a79fe314f85b2213782b48f072ff4fd1fdf4707c3,0x0F506Dbc037A31f7aC9d65964977563362fF78f7,symptom coil pigeon left parade renew spot reform open absent crime like
0x843d5c17920e2098a8bfd1a721dd2eef7b235c267b171c9f2f0b6c0756ad1532,0xFc7Ee540F19652cce8e59aB24A77054293698DcF,ugly picture torch upgrade isolate trash alien fury virus toddler tackle surface
0x908f8b691a794a5e28b89b8a108b613f00b4381b29a08d9d13dc1e76e17e56d2,0x137585A0b25047Fd2AA21882CcF5Fd3535B41CD9,police retire boost extend skill index wasp subject stage income bacon case
0xd4cc31ba1033087d070a456abe7b992b07833f170133986ec6ae5e07680ef0c4,0x5B376df6057160FB4e4a36740906bCC7D2Af6892,snack hill trip evoke faith month romance audit table lens better degree
0xe8a7dbcd1f64a155ebfc4cd6b7ce545d41cb28199403f50d01732a468497ed00,0x83B0d2314f710D3F86945d41B4e5b33b3dc67c20,timber junior believe thought stage father sun magnet setup hint tonight grain
0x8a0f05617e3332c6586442b0ea17610d1456679d113be11f969b3c412ef490b2,0x2fFF4Ad376801eD123EE9588a075402DC60170b7,kid diagram journey vessel brief stem deputy water bubble under object amused
0x493db470116e5452060990c26d8fa9a5d02a7a6e032163a1188dc38424d3f247,0xD4bbdFce5f787cbF93FA6F729De0DB79726AdFe0,bulk cover casual apple alarm oval spend prepare lucky dance before enter
0x4164f7df539e59ba7716f2d0e4064ee66ea040636bc1316a9169ac01e63e52c6,0x3Dc5fc153aaDF50a3F06a697146515cA9D99b7A6,tuna enjoy prosper fine wait spot awful mail buzz harvest bulk weekend
0x2ee3a8ba1c5fa28b272c01877221209baed7f9e3391c5aabc38a1e62c757a817,0x2F8FeF11b5B7247671Fb337E9F1022602034Bfdf,goddess supply hover metal simple usual oppose table shine middle page minimum
0x457a656031cc6f4de85d89438cc653fd34ecc0e0db50a2e0d4ae384a00518e0a,0xc4dAcb62E15AdC5EF4643bc510F66CE5Ee936958,maximum social edge chaos roof horn three coral sugar beef cheese alone
0x5a365b45b631850d81777b0fb8463b3d3d619c7e707a5e443375619e6be411f2,0x17a9c1C6536E969c8De05D3F2B32326b523cA0c6,night page observe jaguar effort glare fragile pitch sail mind between youth
0x2988e015b1a9bf3def2c9ddb638ad110c98bf7c1a4757b444552e46b234944f8,0x7A5aD5C5C7B575FFaCA9D6B09E01D3A5d9b1e1A1,weather sock much together piece vehicle hip muffin bus already armed leopard
0x80cf9d72ebbd3c4b273d2b859ffdc4ee41d0c5f9c8bd80228feb4339c54b5918,0x1a464Dda32d7ee204bEc4425dE4E072C6d18Ec33,inject fan call curtain arch wrestle exotic ghost degree elegant sheriff cram
0xf007e6a18a3d897943c8ae7f35576f56d6efcce651cd748f330653d3fb83f2af,0xF43E39e7EB798942F393e600b4A75CBb75990D76,fan online float sustain scorpion frost sentence girl place common addict burst
0x79107849da6b109e89154c320bedcb38641ffa6f8188e7e8ac0cf0704917ea19,0x2963F2415BA200D7a5CC3D518F6E8F20c05a429E,chase force bar village illegal educate school drop fire chapter welcome frequent
0x62ccc99ad7e9e8a3f651b65a669156f9a3affdd222df02c204c527b542e677e2,0xeFb659dc3D1A09FD85481D9BB3707087D1c29c4F,infant manual property economy tray world betray theory help lab sell maple
0x39f2f61580a5d28d2c89ed2ea09454f4b71f2d2df9ad3dd5971eb425431afebe,0xCcf84F3400C6A8436A1EE4c021cD791E18766Bf6,join stool april broccoli reason unknown delay where market donkey indicate rigid
0x97c38076b7bbdf71dca3d48d70a42bbec16d6c1ca2df20d45adae3e0517ceff6,0xd26C4593793c71CD7d28C7f9305D52882034502E,gold diamond interest virus scrap mom wood october island rather satisfy purpose
0x11d67972f954f38dee0db00fb6fd34d30c3f9959fdbaccb3e77a8edb7bdac201,0x5CB44854B2f3adf51bAEC217Fdf80446cd19493f,depth school slush transfer dragon vocal zebra trend lumber symbol prefer grace
0x21bc64242737e1da21a4281b4d3e5581d1b8a372fb477479f810234c72a65d51,0xdB8fF80D0e9BB27325E5239E14075E13b2F26756,owner wealth sorry capable asset faculty cabin average stick say lucky nerve
0x39d666b29e1b190c80a4947007f513c361c6eec3f0823ca3842d52d39bc8fdd9,0xA3Ca472d7b902443e21380Ca76fe98C909113e9C,welcome faculty slim alone setup arena candy relax sound drama palm seek
0x4a0c25c0590929c6a3c03f2595b36deecc7c15ca9df7a3737a90b79f95b4f30a,0x9AB2383F105CF8EbE92EE31d340F3bEf089dE24c,lizard day foil copy bottom skull aerobic ladder legal congress grow jungle
0xfa04379bcae6168bc52ea85b165ca6738ff7bd9c79c71361fd7b903cda55b4d7,0x7F0618E636da670BFB9EcaBa360A64bEf9DD7006,comfort project risk middle chef benefit estate spawn walk photo reveal correct
0xdd9f0e5be898f514cb0d726a0d24b8be482f660a9efe05a31549a485901457c8,0x36D7F8d7C200C1cc87D137d65B56AabB6415Be85,chuckle now soda turtle toward copper captain tattoo correct snake pupil undo
0xd3b66a74ccd5703809a2ef3de9592d523fc2ea9724f11c8e52f6a4f90fd4bcad,0xC9fa6A8e0549C52280734F7586AceEa3a911ecD5,govern cave antenna mixture churn ten brisk inner hill flock plug rich
0xafcdd6528640f5fb228e0ac548379a736bb37f2d5c7ab8d578cd24a07c4ee61a,0x3F660054dcc3d232AdDc3D02b9A9222f425A4314,once pumpkin soon bind evidence material result outside tiger critic whisper elbow
0x49298c6bfdabefaffdbbbc8e3436ab250437f11fa3ac3f2ad65d9c59ab6f9c9f,0x0C21557eD3Fe7e0e583FaF83F0DacdE28310F246,best anxiety issue primary relax upset print half amount ticket toss ball
0xc9c1f59b58a622894b4f61a66d12340120e6d325deb3a2e3d90fe6669f303933,0x693a83Ab069acC0c5a7211123550F28De4aAE00d,thunder palm any cheese runway just tuna face spot daring soft execute
0xf60f9b3e3de5c6e714c2e34278eaa5152313a0a22602b384d3d67f0c4eb91656,0x278793B105123eb7a2AAF038313Cb2454888B269,funny tilt soccer zero rail traffic bulk fiction critic design blame vapor
0x5d8f7836a2fc30ce36ff81e0624571dcab6f0606013e65234233844b6ca0ec49,0x231aec5DA9400EBb3a563fb66a3E66e20A18D513,use young fashion clown castle thought olive remember hungry elite mammal gospel
0xe878da781a37cd4283dac6a22fab2c05304c68c5263046adffe6828baa7d3e4c,0xD23C5952db145d8A0bea3CED1782F22FC8D63ceE,balcony apart scout carpet useful invest insane eight coach utility notice detail
0x6c4eff5177421639f59c58fcf7d205710ff4c7d3680ffbdaf2b31c9ad4f78fd6,0x2BE87ab414B06Bd1C26Ddb1F0335cA7CcA5cfDbd,isolate elbow tape erase bracket spray name omit under mention pepper hour
0x0926cbfdc4bd6155c12943c16ed6e80f3d1a84578b16dc88506340b067498bd4,0xf137CC513ac829c9a8d8424C8D69B340b0A8c1Fe,frozen dragon tonight project reduce morning decline smile safe blood famous steel
0xf6865b9cf54ce58b811cfa03d5d092ed683d5c411bbd5788f0fcbce5b74300ab,0x5b1af0F0F28C54f7a91aFD8C5A14E1D9aD19206D,nurse online master exact road cargo sport danger lift cake child script
0x0fc35b9bd67f90bef694daf470e01b5fafe11d2c0508aca16ffee12f4542c058,0x60009df117c3ffC00A007b00caa23a4Ed7709F89,save food general radar ski legal extra arch pattern arrow cream armor
0xed233fee46e05cb7997ad567e79f6efd568c2543961ce2d65606ed1eb4f314d2,0xAa3493D35aCF9b42ed002305ecbe38D95c3ed65f,welcome social drift young banana truth boring build wine galaxy wagon damage
0x65a0e02777953f503c0f43684d927eaba4ea49ea1a0181ef95e21011e12ecf96,0x6E6b53801C46e9ddB4c5171F56a335dA9f1A8A5c,maze cool short flee turkey pigeon battle measure crucial night squirrel lecture
0x8289920a43d591deeab0b380828efa553eea3ac1841ad173d2e3460068a8bece,0x722fD8401aA564482D5DB7cb4fe490352545B65D,hope bar outside wonder hollow piece educate rabbit boring eager elder rocket
0x5d9ea90c35b433ad6a443454d1b18de139e1f86530ac1f877338372350029c42,0x89cb58B636761e79878a5eEB3a3dC516c98b8C53,also noble soldier valley favorite lend vintage kick word walnut ethics liberty
0x80ded7728a7f5fbf7dbb672b5a1d9f944594bf6af8d82d42e27bde28d448e6a4,0x0C0f33C5B4Ac43A540137E1EBCcC5A2D7e24FB22,guard screen tiny doctor arrow anxiety just heavy daughter improve adult grocery
0x665e61dc656f2a257803669b0307a280e9824847fd13817f169d39856bab54b6,0xa36f9350559087880Bb30471e80e2b22a9F11866,blanket rude rookie giant obscure elegant gas trumpet pact cigar stereo choice
0x4673feea27b89e31ab3af33736a785cff18206445f9262510d2c4f8c5841ef15,0x1E8f92B4e8bcb9b93611E52b3ffAe6C42e0BA373,raise bronze decline unknown small garbage win margin vocal accuse rude erase
0x1735886b7c6b6fa2dd46a9a2ec9c2fa87d9d62ed6420458e21731824797a2525,0x75f62666b30f60AcF01cDc630Fdb8bC498e8572E,dolphin clutch detect put culture hollow avoid that harbor dirt cross husband
0x15f625672a9c124b61bbd5a1b7aab33df7f544d5114a99d170a0b232c6e5769c,0xA77793b4B2928A51F94B05253ba9fb968f1EfBCA,script solve rib ghost install tray cigar unaware retire various empower enforce
0x54947ad670a8af3213634275eb36d540eeb4681936510b4c5ed640b64cc4bec3,0x2486c7A403e3D7eb7efFb4962D7d365C1cAaB5e7,suffer planet rib swim sock maple emotion busy shadow silk manual defy
0x8487b40bcaf5d229954554154b1b71bf5cae05be50f492bd009fec7132f119b1,0x97daB212885Ffe18e4018d493c9D4E304dCF6609,holiday dad vague company alcohol scatter hole common jar crumble winter tonight
0xd76a82708251e3063cb45df648461a765cf2613daa1c75598916977bf12707de,0x913dbd8e4e318e9372946276A95CB85a22433577,clarify crush main gun cram thing cage lumber salad inspire slice document
0x6f35fe7553539f8560d773f770edb8d403032d0c4b04638540b461d716e8b503,0x0EB48D846A26e9DD7BdD9d2DC6dA70b8E0b23949,heart sustain exotic witness grab logic bless reveal horse discover anger swallow
0xc3473772f41ed6364af7dde0a976313ef34a3d9947e7a7fabdc598a280d38f05,0x655081A733504DAD2fcf185e7b6120EAf58b6d10,sunny horse clip scrap warrior okay orient cement high must praise ladder
0x8cb4b544733a0889de9615e3b14e71217c68c4b439b47e17e2a9221d787f4187,0xB4b94AD3608011C1934635C344a41ab2f1e296B5,final harvest victory lady castle tattoo net teach blood heavy gold fossil
0x0e2b23c4f2a586390d32da86033ee3cf68da604f2898223958635e261a010b1b,0x8934F0a7958B5Da0BF50c492ed27aC2Fa7c73954,shoe flip trouble organ hybrid sand concert enjoy laptop good basket negative
0xd9cb9641f3301f15683d84463186d7574f1725b9bd8e78431f023a70e093a13a,0xA8E260527456B9FE83832798bc00c58c4f1314c0,detail guard ice prosper like movie cigar snap organ sense glad absorb
0x990e50c32979482427c7e7cbe145b6298a356e7ba57b7124a7cf0cd401c2e5ca,0xf18059e1a95FdBE617D642fd8ff9cD1F8542D95d,cabin number modify broom skate scrub earn slush season divorce wagon ugly
0x9ab925e66e203d07bcd0c89e1b0a60141a02b0ae59f62b3186d2eed85feb72b2,0x29B789B176CAc8eDd0c952a67d576162a936B888,shoe income broom plastic unfold bargain glimpse obvious mammal practice forest trend
0x8a50c9b46f1932a9453348a7d3027a59ae7d6c1494f9e019fffc9c4099daec84,0x0139b26F32484c939CC796055ee863A4bF495cdD,barrel smart title fat rather street first gentle almost lock corn buddy
0x6ced6f57172a3699eea1aab688bf8cb87befb0f7f2c354cb272b713ca2f81740,0x5a802b5dFD0DF30f2363d9d87FCF275C373C090D,million audit upset grunt oyster three bird domain goose will smoke skin
0x7906dbdbc96b026cc4ec58eb31ad590e40b0a1490516233784f8d014151998e0,0x6Be82314107cADC6B247f226E2543Bd6A3B5D7d3,frame limb sweet wish nut spike fiction ginger budget mad harbor melody
0xbf086f566295b0569075da5cc35ec545cc567bf97c91eb0459499a043c0901ce,0xB273ce134ea4043F4893292eB5801d9B8691e326,bottom cargo eye chalk inquiry jealous cliff foam hard dress woman merit
0xbf414f0b7427c085c8a3e6a79ea0e58c15378f0388e701e6d64cfc35cf0cf0c4,0xedaa6e9E095b4512677925F4ab4548B65C87E8c1,caught market skate yard fruit vanish hero ostrich domain hammer series margin
0xfb2fbdcc3a77f4f953934d80a6765961b4a850c46edd930cc5f2de4d37a94f67,0xA39f57505aEb15c13c96bc50cb8F2A633F14e0b2,million robust galaxy cloth purse empty guess phrase father solution course worth
0xfd55850a5ccc6ac1732e152deb74b838be47f1be4a41a0ec94367e7fd50a4661,0xA0eb3018536121F201b090b0586095ADe1287E58,music rifle general else biology inhale panda crawl jealous segment lucky essence
0xdbce70bc8fb92ed7c90cc38e7fdd2c2af3fa12a573fd3213ac7b2e1061aa65d7,0x8D0BB3A3AF5E03d14e59F5b80D37cBDB85336933,before submit olympic reward lens civil goose conduct tree test bike scatter
0x7bf01d1431e480cfc5da48440903f7b486d180017368dd922dd4b30b992d3dc5,0xa5F81B3165aaf8429535c76b474e430d31eef7E4,before expect defy book buzz monster quarter brush recipe tower security frog
0xfbcf667ef81b85ce050d7b9b8e3077c9bbb00929545ba819e9db9847c9c15c41,0x3E4b94bf4498E9D756417b5E05409dA388b7a71d,when chief vintage alley car lemon island deny machine picnic enact price
0xbfdcc1f90f9140aeca8de928c5345ada84be6de83895ab25c4643d90a7af365d,0x6A2C96B2Ba0A40Ca523b7Fc707C30099444C0410,entire frown crop enable opinion away tent left little skull dish theory
0xa93f5deb3b2be955e0c0ca0513cae74a21ad49f371a4eb2086bccf7cc5525a35,0x84CA4C7da95a1e1cd9d51B81B4Ad95f509BCB3D8,actress chapter danger join invest subject inform spy powder diesel fashion luxury
0xe1b5dc11bc1325f49c222ae75f96d90e43c0849d60d0022ef6d56ed8d9118d8e,0x83dfb6F9616e448D79a23Cd7b2bdd587599d76Ae,warm rose retreat december kit annual curious team frozen blue fossil tent
0xe2c1aa49c6f88d5842a3d1e2d71288ed45bb926dfd3b55c372b7c76f33684ea0,0xF1eB71Ca593677F7C46F9d1A89668bC17Aba8795,elder only clever follow rapid copy time foster ring faith mandate october
0xc5ac675b769573ec0f6052f9494161b370d980495eb8c3a36d2d970cab7ce189,0xB8eBE4a80632AC61d5224b91c612841aD23FA973,before siege calm leave dismiss trumpet because first indicate cherry end feature
